meas/.cache/tunecache_error.tsv
tunecache	1.1.0	1.1.0-e23cd7e4f-sm_86	cpu_arch=x86_64,gpu_arch=sm_86,cuda_version=12.2.140	# Last updated Fri May  9 21:48:22 2025

          volume	name	aux	block.x	block.y	block.z	grid.x	grid.y	grid.z	shared_bytes	aux.x	aux.y	aux.z	aux.w	time	comment
               1	N4quda7reducer11init_reduceIN4cuda3__46atomicIjLNS2_3std3__48__detail12thread_scopeE1EEEEE	GPU-offline,	32	1	1	1	1	1	0	-1	-1	-1	-1	3.40282e+38	# default
           18432	N4quda15TransformReduceINS_7maximumIfEENS_7complexIfEEjNS_8abs_max_IffEENS_8identityEEE	,batch_size=2	1024	1	1	10	1	2	0	-1	-1	-1	-1	6.4356e-06	# 0.00 Gflop/s, 45.83 GB/s, tuning took 0.020475 seconds at Wed Apr  2 17:24:44 2025
           18432	N4quda15TransformReduceINS_7maximumIfEENS_7complexIiEEjNS_8abs_max_IfiEENS_11milc_mapperEEE	,batch_size=2	256	1	1	39	1	2	0	-1	-1	-1	-1	6.64625e-06	# 0.00 Gflop/s, 44.37 GB/s, tuning took 0.021530 seconds at Wed Apr  2 17:24:43 2025
         1x2x2x2	N4quda10CopySpinorIffLi2ELi24ENS_11colorspinor12FieldOrderCBIfLi2ELi24ELi1EL16QudaFieldOrder_s2EffLb0ELb0EEES4_EE	GPU-offline,vol=8,parity=1,precision=4,order=2,Ns=2,Nc=24	320	1	1	1	2	24	0	-1	-1	-1	-1	1.89932e-06	# 0.00 Gflop/s, 3.23 GB/s, tuning took 0.011399 seconds at Wed Apr  2 17:24:50 2025
         1x2x2x2	N4quda12DslashCoarseIfssLi2ELi24ELb0ELb1ELb0ELNS_10DslashTypeE2EEE	policy_kernel,GPU-offline,vol=8,parity=1,precision=4,order=2,Ns=2,Nc=24,comm=0000,full,halo=00000000,n_rhs=1	64	1	2	1	1	24	4097	8	1	1	1	2.32732e-06	# 63.03 Gflop/s, 34.32 GB/s, tuning took 0.020569 seconds at Wed Apr  2 17:24:44 2025
         1x2x2x2	N4quda12DslashCoarseIfssLi2ELi24ELb1ELb0ELb0ELNS_10DslashTypeE2EEE	policy_kernel,GPU-offline,vol=8,parity=1,precision=4,order=2,Ns=2,Nc=24,comm=0000,full,halo=00000000,n_rhs=1	32	1	8	1	1	48	8192	4	4	1	1	3.61652e-06	# 325.97 Gflop/s, 170.74 GB/s, tuning took 0.031253 seconds at Wed Apr  2 17:24:44 2025
         1x2x2x2	N4quda22DslashCoarsePolicyTuneINS_18DslashCoarseLaunchINS_1DELb0ELi24ELb0ELi1EEEEE	policy,clover,vol=8,parity=1,precision=4,order=2,Ns=2,Nc=24,gauge_prec=2,halo_prec=2,comm=0000,topo=1111,p2p=0,gdr=0,nvshmem=0,pol=11110000000,full,n_rhs=1	32	1	1	1	1	1	0	2	0	0	0	3.00617e-06	# 48.80 Gflop/s, 26.57 GB/s, tuning took 0.003510 seconds at Wed Apr  2 17:24:44 2025
         1x2x2x2	N4quda22DslashCoarsePolicyTuneINS_18DslashCoarseLaunchINS_1DELb0ELi24ELb0ELi1EEEEE	policy,dslash,vol=8,parity=1,precision=4,order=2,Ns=2,Nc=24,gauge_prec=2,halo_prec=2,comm=0000,topo=1111,p2p=0,gdr=0,nvshmem=0,pol=11110000000,full,n_rhs=1	32	1	1	1	1	1	0	3	0	0	0	3.59993e-06	# 327.47 Gflop/s, 171.52 GB/s, tuning took 0.003688 seconds at Wed Apr  2 17:24:44 2025
         1x2x2x2	N4quda4blas10caxpyNorm2IdfEE	GPU-offline,vol=8,parity=1,precision=4,order=2,Ns=2,Nc=24,n_rhs=1	256	1	1	1	1	1	0	-1	-1	-1	-1	6.83886e-06	# 0.90 Gflop/s, 1.35 GB/s, tuning took 0.006305 seconds at Wed Apr  2 17:24:44 2025
         1x2x2x2	N4quda4blas11multicaxpy_IfEE	GPU-offline,vol=8,parity=1,precision=4,order=2,Ns=2,Nc=24,Nxz=4,Nyw=1	864	1	1	56	1	1	0	1	0	0	0	4.62869e-06	# 2.65 Gflop/s, 3.98 GB/s, tuning took 0.010164 seconds at Wed Apr  2 17:24:50 2025
         1x2x2x2	N4quda4blas12MaxDeviationIdfEE	GPU-offline,vol=8,parity=1,precision=4,order=2,Ns=2,Nc=24,n_rhs=1	256	1	1	1	1	1	0	-1	-1	-1	-1	6.98715e-06	# 0.00 Gflop/s, 0.88 GB/s, tuning took 0.006087 seconds at Wed Apr  2 17:24:44 2025
         1x2x2x2	N4quda4blas12TileSizeTuneINS0_9multiCdotES2_St7complexIdERKNS_10vector_refIKNS_16ColorSpinorFieldEEESA_SA_SA_EE	nested_policy,vol=8,parity=1,precision=4,order=2,Ns=2,Nc=24,vol=8,parity=1,precision=4,order=2,Ns=2,Nc=24,n=4,m=5,multi-blas-n=4,max_nyw_tile=8	32	1	1	1	1	1	0	4	5	0	0	1.08234e-05	# 0.00 Gflop/s, 0.00 GB/s, tuning took 0.021602 seconds at Wed Apr  2 17:24:50 2025
         1x2x2x2	N4quda4blas12TileSizeTuneINS0_9multiCdotES2_St7complexIdERKNS_10vector_refIKNS_16ColorSpinorFieldEEESA_SA_SA_EE	nested_policy,vol=8,parity=1,precision=4,order=2,Ns=2,Nc=24,vol=8,parity=1,precision=4,order=2,Ns=2,Nc=24,n=5,m=4,multi-blas-n=4,max_nyw_tile=8	32	1	1	1	1	1	0	4	4	0	0	1.87471e-05	# 0.00 Gflop/s, 0.00 GB/s, tuning took 0.012629 seconds at Wed Apr  2 17:24:50 2025
         1x2x2x2	N4quda4blas13TransposeTuneINS0_9multiCdotES2_St7complexIdERKNS_10vector_refIKNS_16ColorSpinorFieldEEESA_EE	policy,vol=8,parity=1,precision=4,order=2,Ns=2,Nc=24,vol=8,parity=1,precision=4,order=2,Ns=2,Nc=24,n=4,m=5,multi-blas-n=4,max_nyw_tile=8	32	1	1	1	1	1	0	0	0	0	0	1.19777e-05	# 0.00 Gflop/s, 0.00 GB/s, tuning took 0.002590 seconds at Wed Apr  2 17:24:50 2025
         1x2x2x2	N4quda4blas5Norm2IdfEE	GPU-offline,vol=8,parity=1,precision=4,order=2,Ns=2,Nc=24,n_rhs=1	256	1	1	1	1	1	0	-1	-1	-1	-1	6.55913e-06	# 0.23 Gflop/s, 0.47 GB/s, tuning took 0.006407 seconds at Wed Apr  2 17:24:44 2025
         1x2x2x2	N4quda4blas7axpbyz_IfEE	GPU-offline,vol=8,parity=1,precision=4,order=2,Ns=2,Nc=24,n_rhs=1	800	1	1	56	1	1	0	-1	-1	-1	-1	2.44649e-06	# 0.94 Gflop/s, 3.77 GB/s, tuning took 0.010231 seconds at Wed Apr  2 17:24:50 2025
         1x2x2x2	N4quda4blas9multiCdotIdfEE	policy_kernel,GPU-offline,vol=8,parity=1,precision=4,order=2,Ns=2,Nc=24,Nxz=1,Nyw=1,max_nyw_tile=8	128	1	1	1	1	1	0	-1	-1	-1	-1	6.99733e-06	# 0.44 Gflop/s, 0.88 GB/s, tuning took 0.006579 seconds at Wed Apr  2 17:24:50 2025
         1x2x2x2	N4quda4blas9multiCdotIdfEE	policy_kernel,GPU-offline,vol=8,parity=1,precision=4,order=2,Ns=2,Nc=24,Nxz=1,Nyw=1,max_nyw_tile=8,norm	128	1	1	1	1	1	0	-1	-1	-1	-1	7.03235e-06	# 0.44 Gflop/s, 0.87 GB/s, tuning took 0.025998 seconds at Wed Apr  2 17:24:50 2025
         1x2x2x2	N4quda4blas9multiCdotIdfEE	policy_kernel,GPU-offline,vol=8,parity=1,precision=4,order=2,Ns=2,Nc=24,Nxz=1,Nyw=2,max_nyw_tile=8	128	1	1	1	1	2	0	-1	-1	-1	-1	7.14558e-06	# 0.86 Gflop/s, 1.72 GB/s, tuning took 0.011341 seconds at Wed Apr  2 17:24:50 2025
         1x2x2x2	N4quda4blas9multiCdotIdfEE	policy_kernel,GPU-offline,vol=8,parity=1,precision=4,order=2,Ns=2,Nc=24,Nxz=2,Nyw=1,max_nyw_tile=8	64	1	1	1	1	1	0	-1	-1	-1	-1	8.06676e-06	# 0.76 Gflop/s, 1.14 GB/s, tuning took 0.006889 seconds at Wed Apr  2 17:24:50 2025
         1x2x2x2	N4quda4blas9multiCdotIdfEE	policy_kernel,GPU-offline,vol=8,parity=1,precision=4,order=2,Ns=2,Nc=24,Nxz=2,Nyw=2,max_nyw_tile=8	64	1	1	1	1	2	0	-1	-1	-1	-1	8.22122e-06	# 1.49 Gflop/s, 2.24 GB/s, tuning took 0.012094 seconds at Wed Apr  2 17:24:50 2025
         1x2x2x2	N4quda4blas9multiCdotIdfEE	policy_kernel,GPU-offline,vol=8,parity=1,precision=4,order=2,Ns=2,Nc=24,Nxz=2,Nyw=2,max_nyw_tile=8,norm	64	1	1	1	1	2	0	-1	-1	-1	-1	8.10152e-06	# 1.52 Gflop/s, 2.28 GB/s, tuning took 0.012049 seconds at Wed Apr  2 17:24:50 2025
         1x2x2x2	N4quda4blas9multiCdotIdfEE	policy_kernel,GPU-offline,vol=8,parity=1,precision=4,order=2,Ns=2,Nc=24,Nxz=2,Nyw=4,max_nyw_tile=8	64	1	1	1	1	4	0	-1	-1	-1	-1	8.20613e-06	# 2.99 Gflop/s, 4.49 GB/s, tuning took 0.012633 seconds at Wed Apr  2 17:24:50 2025
         1x2x2x2	N4quda4blas9multiCdotIdfEE	policy_kernel,GPU-offline,vol=8,parity=1,precision=4,order=2,Ns=2,Nc=24,Nxz=3,Nyw=4,max_nyw_tile=8	64	1	1	1	1	4	0	-1	-1	-1	-1	9.23588e-06	# 3.99 Gflop/s, 5.32 GB/s, tuning took 0.013121 seconds at Wed Apr  2 17:24:50 2025
         1x2x2x2	N4quda4blas9multiCdotIdfEE	policy_kernel,GPU-offline,vol=8,parity=1,precision=4,order=2,Ns=2,Nc=24,Nxz=4,Nyw=2,max_nyw_tile=8	64	1	1	1	1	2	0	-1	-1	-1	-1	1.01631e-05	# 2.42 Gflop/s, 3.02 GB/s, tuning took 0.013913 seconds at Wed Apr  2 17:24:50 2025
         1x2x2x2	N4quda4blas9multiCdotIdfEE	policy_kernel,GPU-offline,vol=8,parity=1,precision=4,order=2,Ns=2,Nc=24,Nxz=4,Nyw=3,max_nyw_tile=8	64	1	1	1	1	3	0	-1	-1	-1	-1	1.02291e-05	# 3.60 Gflop/s, 4.50 GB/s, tuning took 0.013669 seconds at Wed Apr  2 17:24:50 2025
         1x2x2x2	N4quda4blas9multiCdotIdfEE	policy_kernel,GPU-offline,vol=8,parity=1,precision=4,order=2,Ns=2,Nc=24,Nxz=4,Nyw=5,max_nyw_tile=8	64	1	1	1	1	5	0	-1	-1	-1	-1	1.03244e-05	# 5.95 Gflop/s, 7.44 GB/s, tuning took 0.014327 seconds at Wed Apr  2 17:24:50 2025
         1x2x2x8	N4quda10CopySpinorIffLi2ELi24ENS_11colorspinor12FieldOrderCBIfLi2ELi24ELi1EL16QudaFieldOrder_s2EffLb0ELb0EEES4_EE	GPU-offline,vol=32,parity=1,precision=4,order=2,Ns=2,Nc=24	480	2	1	1	1	24	0	-1	-1	-1	-1	1.82991e-06	# 0.00 Gflop/s, 13.43 GB/s, tuning took 0.011330 seconds at Wed Apr  2 17:24:43 2025
         1x2x2x8	N4quda12DslashCoarseIfssLi2ELi24ELb0ELb1ELb0ELNS_10DslashTypeE2EEE	policy_kernel,GPU-offline,vol=32,parity=1,precision=4,order=2,Ns=2,Nc=24,comm=0000,full,halo=00000000,n_rhs=1	32	1	8	4	1	6	12289	4	1	1	1	2.62596e-06	# 223.44 Gflop/s, 121.67 GB/s, tuning took 0.080552 seconds at Wed Apr  2 17:24:43 2025
         1x2x2x8	N4quda12DslashCoarseIfssLi2ELi24ELb1ELb0ELb0ELNS_10DslashTypeE2EEE	policy_kernel,GPU-offline,vol=32,parity=1,precision=4,order=2,Ns=2,Nc=24,comm=0000,full,halo=00000000,n_rhs=1	64	1	8	1	1	48	4096	2	4	1	1	7.65086e-06	# 616.34 Gflop/s, 322.82 GB/s, tuning took 0.058429 seconds at Wed Apr  2 17:24:43 2025
         1x2x2x8	N4quda12DslashCoarseIfssLi2ELi24ELb1ELb0ELb1ELNS_10DslashTypeE2EEE	policy_kernel,GPU-offline,vol=32,parity=1,precision=4,order=2,Ns=2,Nc=24,comm=0000,full,halo=00000000,n_rhs=1	64	1	8	1	1	48	4096	2	4	1	1	7.60924e-06	# 619.71 Gflop/s, 324.59 GB/s, tuning took 0.110807 seconds at Wed Apr  2 17:24:43 2025
         1x2x2x8	N4quda22DslashCoarsePolicyTuneINS_18DslashCoarseLaunchINS_1DELb0ELi24ELb0ELi1EEEEE	policy,clover,vol=32,parity=1,precision=4,order=2,Ns=2,Nc=24,gauge_prec=2,halo_prec=2,comm=0000,topo=1111,p2p=0,gdr=0,nvshmem=0,pol=11110000000,full,n_rhs=1	32	1	1	1	1	1	0	3	0	0	0	2.94286e-06	# 199.38 Gflop/s, 108.56 GB/s, tuning took 0.003457 seconds at Wed Apr  2 17:24:43 2025
         1x2x2x8	N4quda22DslashCoarsePolicyTuneINS_18DslashCoarseLaunchINS_1DELb0ELi24ELb0ELi1EEEEE	policy,dslash,vol=32,parity=1,precision=4,order=2,Ns=2,Nc=24,gauge_prec=2,halo_prec=2,comm=0000,topo=1111,p2p=0,gdr=0,nvshmem=0,pol=11110000000,full,n_rhs=1	32	1	1	1	1	1	0	3	0	0	0	7.61756e-06	# 619.03 Gflop/s, 324.24 GB/s, tuning took 0.003989 seconds at Wed Apr  2 17:24:43 2025
         1x2x2x8	N4quda22DslashCoarsePolicyTuneINS_18DslashCoarseLaunchINS_1DELb1ELi24ELb0ELi1EEEEE	policy,dslash,vol=32,parity=1,precision=4,order=2,Ns=2,Nc=24,gauge_prec=2,halo_prec=2,comm=0000,topo=1111,p2p=0,gdr=0,nvshmem=0,pol=11110000000,full,n_rhs=1	32	1	1	1	1	1	0	0	0	0	0	7.59259e-06	# 621.07 Gflop/s, 325.30 GB/s, tuning took 0.003971 seconds at Wed Apr  2 17:24:43 2025
         1x2x2x8	N4quda4blas10CdotNormABIdfEE	GPU-offline,vol=32,parity=1,precision=4,order=2,Ns=2,Nc=24,n_rhs=1	128	1	1	1	1	1	0	-1	-1	-1	-1	1.23536e-05	# 1.99 Gflop/s, 1.99 GB/s, tuning took 0.007117 seconds at Wed Apr  2 17:24:50 2025
         1x2x2x8	N4quda4blas10caxpyNorm2IdfEE	GPU-offline,vol=32,parity=1,precision=4,order=2,Ns=2,Nc=24,n_rhs=1	256	1	1	1	1	1	0	-1	-1	-1	-1	8.35368e-06	# 2.94 Gflop/s, 4.41 GB/s, tuning took 0.006872 seconds at Wed Apr  2 17:24:43 2025
         1x2x2x8	N4quda4blas10multiaxpy_IfEE	GPU-offline,vol=32,parity=1,precision=4,order=2,Ns=2,Nc=24,Nxz=1,Nyw=1	448	1	1	56	1	1	0	1	0	0	0	4.64558e-06	# 1.32 Gflop/s, 7.94 GB/s, tuning took 0.011067 seconds at Wed Apr  2 17:24:43 2025
         1x2x2x8	N4quda4blas11axpbyzNorm2IdfEE	GPU-offline,vol=32,parity=1,precision=4,order=2,Ns=2,Nc=24,n_rhs=1	256	1	1	1	1	1	0	-1	-1	-1	-1	8.41656e-06	# 1.46 Gflop/s, 4.38 GB/s, tuning took 0.007005 seconds at Wed Apr  2 17:24:43 2025
         1x2x2x8	N4quda4blas11multicaxpy_IfEE	GPU-offline,vol=32,parity=1,precision=4,order=2,Ns=2,Nc=24,Nxz=1,Nyw=1	160	1	1	56	1	1	0	1	0	0	0	4.65502e-06	# 2.64 Gflop/s, 7.92 GB/s, tuning took 0.010055 seconds at Wed Apr  2 17:24:50 2025
         1x2x2x8	N4quda4blas11multicaxpy_IfEE	GPU-offline,vol=32,parity=1,precision=4,order=2,Ns=2,Nc=24,Nxz=8,Nyw=1	416	1	1	56	1	1	0	1	0	0	0	4.66612e-06	# 21.07 Gflop/s, 26.33 GB/s, tuning took 0.010115 seconds at Wed Apr  2 17:24:50 2025
         1x2x2x8	N4quda4blas12MaxDeviationIdfEE	GPU-offline,vol=32,parity=1,precision=4,order=2,Ns=2,Nc=24,n_rhs=1	256	1	1	1	1	1	0	-1	-1	-1	-1	9.1429e-06	# 0.00 Gflop/s, 2.69 GB/s, tuning took 0.007092 seconds at Wed Apr  2 17:24:49 2025
         1x2x2x8	N4quda4blas12TileSizeTuneINS0_9multiCdotES2_St7complexIdERKNS_10vector_refIKNS_16ColorSpinorFieldEEESA_SA_SA_EE	nested_policy,vol=32,parity=1,precision=4,order=2,Ns=2,Nc=24,vol=32,parity=1,precision=4,order=2,Ns=2,Nc=24,n=8,m=9,multi-blas-n=4,max_nyw_tile=8	32	1	1	1	1	1	0	8	9	0	0	3.33707e-05	# 0.00 Gflop/s, 0.00 GB/s, tuning took 0.042423 seconds at Wed Apr  2 17:24:50 2025
         1x2x2x8	N4quda4blas12TileSizeTuneINS0_9multiCdotES2_St7complexIdERKNS_10vector_refIKNS_16ColorSpinorFieldEEESA_SA_SA_EE	nested_policy,vol=32,parity=1,precision=4,order=2,Ns=2,Nc=24,vol=32,parity=1,precision=4,order=2,Ns=2,Nc=24,n=9,m=8,multi-blas-n=4,max_nyw_tile=8	32	1	1	1	1	1	0	8	8	0	0	5.17928e-05	# 0.00 Gflop/s, 0.00 GB/s, tuning took 0.026880 seconds at Wed Apr  2 17:24:50 2025
         1x2x2x8	N4quda4blas13TransposeTuneINS0_9multiCdotES2_St7complexIdERKNS_10vector_refIKNS_16ColorSpinorFieldEEESA_EE	policy,vol=32,parity=1,precision=4,order=2,Ns=2,Nc=24,vol=32,parity=1,precision=4,order=2,Ns=2,Nc=24,n=8,m=9,multi-blas-n=4,max_nyw_tile=8	32	1	1	1	1	1	0	0	0	0	0	3.45059e-05	# 0.00 Gflop/s, 0.00 GB/s, tuning took 0.002916 seconds at Wed Apr  2 17:24:50 2025
         1x2x2x8	N4quda4blas13cabxpyzaxnormIdfEE	GPU-offline,vol=32,parity=1,precision=4,order=2,Ns=2,Nc=24,n_rhs=1	256	1	1	1	1	1	0	-1	-1	-1	-1	8.31666e-06	# 3.69 Gflop/s, 5.91 GB/s, tuning took 0.007024 seconds at Wed Apr  2 17:24:50 2025
         1x2x2x8	N4quda4blas15tripleCGUpdate_IfEE	GPU-offline,vol=32,parity=1,precision=4,order=2,Ns=2,Nc=24,n_rhs=1	256	1	1	56	1	1	0	-1	-1	-1	-1	2.41203e-06	# 7.64 Gflop/s, 35.66 GB/s, tuning took 0.010120 seconds at Wed Apr  2 17:24:43 2025
         1x2x2x8	N4quda4blas18tripleCGReduction_IdfEE	GPU-offline,vol=32,parity=1,precision=4,order=2,Ns=2,Nc=24,n_rhs=1	128	1	1	1	1	1	0	-1	-1	-1	-1	1.22993e-05	# 1.50 Gflop/s, 3.00 GB/s, tuning took 0.007152 seconds at Wed Apr  2 17:24:43 2025
         1x2x2x8	N4quda4blas4CdotIdfEE	GPU-offline,vol=32,parity=1,precision=4,order=2,Ns=2,Nc=24,n_rhs=1	128	1	1	1	1	1	0	-1	-1	-1	-1	1.01311e-05	# 1.21 Gflop/s, 2.43 GB/s, tuning took 0.006865 seconds at Wed Apr  2 17:24:43 2025
         1x2x2x8	N4quda4blas5Norm2IdfEE	GPU-offline,vol=32,parity=1,precision=4,order=2,Ns=2,Nc=24,n_rhs=1	256	1	1	1	1	1	0	-1	-1	-1	-1	7.98648e-06	# 0.77 Gflop/s, 1.54 GB/s, tuning took 0.006701 seconds at Wed Apr  2 17:24:43 2025
         1x2x2x8	N4quda4blas6caxpy_IfEE	GPU-offline,vol=32,parity=1,precision=4,order=2,Ns=2,Nc=24,n_rhs=1	1024	1	1	56	1	1	0	-1	-1	-1	-1	2.38322e-06	# 5.16 Gflop/s, 15.47 GB/s, tuning took 0.010005 seconds at Wed Apr  2 17:24:43 2025
         1x2x2x8	N4quda4blas7axpbyz_IfEE	GPU-offline,vol=32,parity=1,precision=4,order=2,Ns=2,Nc=24,n_rhs=1	320	1	1	56	1	1	0	-1	-1	-1	-1	2.5113e-06	# 3.67 Gflop/s, 14.68 GB/s, tuning took 0.010436 seconds at Wed Apr  2 17:24:43 2025
         1x2x2x8	N4quda4blas9axpyZpbx_IfEE	GPU-offline,vol=32,parity=1,precision=4,order=2,Ns=2,Nc=24,n_rhs=1	256	1	1	56	1	1	0	-1	-1	-1	-1	2.3937e-06	# 5.13 Gflop/s, 25.67 GB/s, tuning took 0.010020 seconds at Wed Apr  2 17:24:43 2025
         1x2x2x8	N4quda4blas9multiCdotIdfEE	policy_kernel,GPU-offline,vol=32,parity=1,precision=4,order=2,Ns=2,Nc=24,Nxz=1,Nyw=1,max_nyw_tile=8	128	1	1	1	1	1	0	-1	-1	-1	-1	9.71559e-06	# 1.26 Gflop/s, 2.53 GB/s, tuning took 0.006838 seconds at Wed Apr  2 17:24:50 2025
         1x2x2x8	N4quda4blas9multiCdotIdfEE	policy_kernel,GPU-offline,vol=32,parity=1,precision=4,order=2,Ns=2,Nc=24,Nxz=1,Nyw=1,max_nyw_tile=8,norm	128	1	1	1	1	1	0	-1	-1	-1	-1	9.71248e-06	# 1.27 Gflop/s, 2.53 GB/s, tuning took 0.006952 seconds at Wed Apr  2 17:24:50 2025
         1x2x2x8	N4quda4blas9multiCdotIdfEE	policy_kernel,GPU-offline,vol=32,parity=1,precision=4,order=2,Ns=2,Nc=24,Nxz=1,Nyw=2,max_nyw_tile=8	128	1	1	1	1	2	0	-1	-1	-1	-1	9.85729e-06	# 2.49 Gflop/s, 4.99 GB/s, tuning took 0.012943 seconds at Wed Apr  2 17:24:50 2025
         1x2x2x8	N4quda4blas9multiCdotIdfEE	policy_kernel,GPU-offline,vol=32,parity=1,precision=4,order=2,Ns=2,Nc=24,Nxz=2,Nyw=1,max_nyw_tile=8	128	1	1	1	1	1	0	-1	-1	-1	-1	1.29937e-05	# 1.89 Gflop/s, 2.84 GB/s, tuning took 0.007288 seconds at Wed Apr  2 17:24:50 2025
         1x2x2x8	N4quda4blas9multiCdotIdfEE	policy_kernel,GPU-offline,vol=32,parity=1,precision=4,order=2,Ns=2,Nc=24,Nxz=2,Nyw=2,max_nyw_tile=8	128	1	1	1	1	2	0	-1	-1	-1	-1	1.3016e-05	# 3.78 Gflop/s, 5.66 GB/s, tuning took 0.013991 seconds at Wed Apr  2 17:24:50 2025
         1x2x2x8	N4quda4blas9multiCdotIdfEE	policy_kernel,GPU-offline,vol=32,parity=1,precision=4,order=2,Ns=2,Nc=24,Nxz=2,Nyw=2,max_nyw_tile=8,norm	128	1	1	1	1	2	0	-1	-1	-1	-1	1.29391e-05	# 3.80 Gflop/s, 5.70 GB/s, tuning took 0.013771 seconds at Wed Apr  2 17:24:50 2025
         1x2x2x8	N4quda4blas9multiCdotIdfEE	policy_kernel,GPU-offline,vol=32,parity=1,precision=4,order=2,Ns=2,Nc=24,Nxz=2,Nyw=4,max_nyw_tile=8	128	1	1	1	1	4	0	-1	-1	-1	-1	1.31016e-05	# 7.50 Gflop/s, 11.25 GB/s, tuning took 0.014389 seconds at Wed Apr  2 17:24:50 2025
         1x2x2x8	N4quda4blas9multiCdotIdfEE	policy_kernel,GPU-offline,vol=32,parity=1,precision=4,order=2,Ns=2,Nc=24,Nxz=2,Nyw=8,max_nyw_tile=8	128	1	1	1	1	8	0	-1	-1	-1	-1	1.32147e-05	# 14.88 Gflop/s, 22.32 GB/s, tuning took 0.016803 seconds at Wed Apr  2 17:24:50 2025
         1x2x2x8	N4quda4blas9multiCdotIdfEE	policy_kernel,GPU-offline,vol=32,parity=1,precision=4,order=2,Ns=2,Nc=24,Nxz=3,Nyw=4,max_nyw_tile=8	128	1	1	1	1	4	0	-1	-1	-1	-1	1.63499e-05	# 9.02 Gflop/s, 12.03 GB/s, tuning took 0.015688 seconds at Wed Apr  2 17:24:50 2025
         1x2x2x8	N4quda4blas9multiCdotIdfEE	policy_kernel,GPU-offline,vol=32,parity=1,precision=4,order=2,Ns=2,Nc=24,Nxz=3,Nyw=8,max_nyw_tile=8	128	1	1	1	1	8	0	-1	-1	-1	-1	1.64309e-05	# 17.95 Gflop/s, 23.93 GB/s, tuning took 0.018355 seconds at Wed Apr  2 17:24:50 2025
         1x2x2x8	N4quda4blas9multiCdotIdfEE	policy_kernel,GPU-offline,vol=32,parity=1,precision=4,order=2,Ns=2,Nc=24,Nxz=4,Nyw=2,max_nyw_tile=8	128	1	1	1	1	2	0	-1	-1	-1	-1	1.94359e-05	# 5.06 Gflop/s, 6.32 GB/s, tuning took 0.015121 seconds at Wed Apr  2 17:24:50 2025
         1x2x2x8	N4quda4blas9multiCdotIdfEE	policy_kernel,GPU-offline,vol=32,parity=1,precision=4,order=2,Ns=2,Nc=24,Nxz=4,Nyw=3,max_nyw_tile=8	128	1	1	1	1	3	0	-1	-1	-1	-1	1.96211e-05	# 7.52 Gflop/s, 9.39 GB/s, tuning took 0.015466 seconds at Wed Apr  2 17:24:50 2025
         1x2x2x8	N4quda4blas9multiCdotIdfEE	policy_kernel,GPU-offline,vol=32,parity=1,precision=4,order=2,Ns=2,Nc=24,Nxz=4,Nyw=4,max_nyw_tile=8	128	1	1	1	1	4	0	-1	-1	-1	-1	1.95965e-05	# 10.03 Gflop/s, 12.54 GB/s, tuning took 0.016460 seconds at Wed Apr  2 17:24:50 2025
         1x2x2x8	N4quda4blas9multiCdotIdfEE	policy_kernel,GPU-offline,vol=32,parity=1,precision=4,order=2,Ns=2,Nc=24,Nxz=4,Nyw=4,max_nyw_tile=8,norm	128	1	1	1	1	4	0	-1	-1	-1	-1	1.94962e-05	# 10.08 Gflop/s, 12.61 GB/s, tuning took 0.016468 seconds at Wed Apr  2 17:24:50 2025
         1x2x2x8	N4quda4blas9multiCdotIdfEE	policy_kernel,GPU-offline,vol=32,parity=1,precision=4,order=2,Ns=2,Nc=24,Nxz=4,Nyw=8,max_nyw_tile=8	128	1	1	1	1	8	0	-1	-1	-1	-1	1.96656e-05	# 20.00 Gflop/s, 24.99 GB/s, tuning took 0.019275 seconds at Wed Apr  2 17:24:50 2025
         1x2x2x8	N4quda4blas9multiCdotIdfEE	policy_kernel,GPU-offline,vol=32,parity=1,precision=4,order=2,Ns=2,Nc=24,Nxz=8,Nyw=4,max_nyw_tile=8	128	1	1	1	1	4	0	-1	-1	-1	-1	3.23386e-05	# 12.16 Gflop/s, 13.68 GB/s, tuning took 0.019446 seconds at Wed Apr  2 17:24:50 2025
         1x2x2x8	N4quda4blas9multiCdotIdfEE	policy_kernel,GPU-offline,vol=32,parity=1,precision=4,order=2,Ns=2,Nc=24,Nxz=8,Nyw=5,max_nyw_tile=8	128	1	1	1	1	5	0	-1	-1	-1	-1	3.23778e-05	# 15.18 Gflop/s, 17.08 GB/s, tuning took 0.020521 seconds at Wed Apr  2 17:24:50 2025
         1x2x2x8	N4quda4blas9multiCdotIdfEE	policy_kernel,GPU-offline,vol=32,parity=1,precision=4,order=2,Ns=2,Nc=24,Nxz=8,Nyw=9,max_nyw_tile=8	128	1	1	1	1	9	0	-1	-1	-1	-1	3.25677e-05	# 27.17 Gflop/s, 30.56 GB/s, tuning took 0.024789 seconds at Wed Apr  2 17:24:50 2025
 1x2x2x8,2x2x2x2	N4quda14RestrictLaunchIffsLi2ELi24ELi2ELi24EEE	GPU-offline,vol=32,parity=1,precision=4,order=2,Ns=2,Nc=24,vol=16,parity=2,precision=4,order=2,Ns=2,Nc=24,n_rhs=1	32	1	1	16	1	12	0	8	-1	-1	-1	4.99915e-06	# 58.99 Gflop/s, 33.23 GB/s, tuning took 0.025896 seconds at Wed Apr  2 17:24:49 2025
               2	N4quda7reducer11init_reduceIN4cuda3__46atomicIjLNS2_3std3__48__detail12thread_scopeE1EEEEE	GPU-offline,	32	1	1	1	1	1	0	-1	-1	-1	-1	3.40282e+38	# default
         2359296	N4quda15TransformReduceINS_7maximumIfEENS_7complexIsEEjNS_8abs_max_IfsEENS_8identityEEE	,batch_size=2	512	1	1	42	1	2	0	-1	-1	-1	-1	6.507e-05	# 0.00 Gflop/s, 290.06 GB/s, tuning took 0.651306 seconds at Wed Apr  2 17:24:26 2025
              24	N4quda7reducer11init_reduceIN4cuda3__46atomicIjLNS2_3std3__48__detail12thread_scopeE1EEEEE	GPU-offline,	32	1	1	1	1	1	0	-1	-1	-1	-1	3.40282e+38	# default
         2x2x2x2	N4quda10CalculateYILb1EL19QudaFieldLocation_s2ENS_13CalculateYArgILb1EfsLi2ELi2ELi24ELi24ENS_5gauge10FieldOrderIfLi48ELi2EL21QudaGaugeFieldOrder_s13ELb1EsEENS4_IfLi48ELi2ELS5_13ELb1EiEES6_NS_11colorspinor12FieldOrderCBIfLi2ELi24ELi24EL16QudaFieldOrder_s9EssLb0ELb0EEENS9_IfLi4ELi24ELi24ELSA_9EssLb0ELb0EEESB_S6_EEEE	GPU-offline,vol=64,parity=2,precision=2,order=9,Ns=2,Nc=576,nVec=24,comm=0000,computeCoarseDiagonal,GPU-device	32	1	2	1	2	12	4469	1	0	0	0	2.2233e-06	# 0.35 Gflop/s, 2.76 GB/s, tuning took 0.014943 seconds at Wed Apr  2 17:24:44 2025
         2x2x2x2	N4quda10CalculateYILb1EL19QudaFieldLocation_s2ENS_13CalculateYArgILb1EfsLi2ELi2ELi24ELi24ENS_5gauge10FieldOrderIfLi48ELi2EL21QudaGaugeFieldOrder_s13ELb1EsEENS4_IfLi48ELi2ELS5_13ELb1EiEES6_NS_11colorspinor12FieldOrderCBIfLi2ELi24ELi24EL16QudaFieldOrder_s9EssLb0ELb0EEENS9_IfLi4ELi24ELi24ELSA_9EssLb0ELb0EEESB_S6_EEEE	GPU-offline,vol=64,parity=2,precision=2,order=9,Ns=2,Nc=576,nVec=24,comm=0000,computeConvert,GPU-device	32	6	1	1	8	24	0	1	0	0	0	3.54756e-06	# 0.22 Gflop/s, 124.70 GB/s, tuning took 0.038301 seconds at Wed Apr  2 17:24:43 2025
         2x2x2x2	N4quda11SpinorNoiseIfLi2ELi24EEE	GPU-offline,vol=16,parity=2,precision=4,order=2,Ns=2,Nc=24,uniform	96	1	1	1	2	1	4469	-1	-1	-1	-1	9.94743e-06	# 0.00 Gflop/s, 0.62 GB/s, tuning took 0.018123 seconds at Wed Apr  2 17:24:44 2025
         2x2x2x2	N4quda12DslashCoarseIfssLi2ELi24ELb1ELb1ELb0ELNS_10DslashTypeE2EEE	policy_kernel,GPU-offline,vol=16,parity=2,precision=4,order=2,Ns=2,Nc=24,comm=0000,full,halo=00000000,n_rhs=1	32	1	16	1	2	24	4096	4	4	1	1	6.72599e-06	# 394.39 Gflop/s, 206.44 GB/s, tuning took 0.066556 seconds at Wed Apr  2 17:24:44 2025
         2x2x2x2	N4quda12ExtractGhostIsLi48ENS_5gauge10FieldOrderIfLi48ELi1EL21QudaGaugeFieldOrder_s13ELb1EsEEEE	GPU-offline,vol=16,stride=16,precision=2,geometry=8,Nc=48fine-grained,extract	32	2	1	1	24	8	0	-1	-1	-1	-1	8.48144e-06	# 0.00 Gflop/s, 69.54 GB/s, tuning took 0.062891 seconds at Wed Apr  2 17:24:44 2025
         2x2x2x2	N4quda12ExtractGhostIsLi48ENS_5gauge10FieldOrderIfLi48ELi1EL21QudaGaugeFieldOrder_s2ELb0EsEEEE	GPU-offline,vol=16,stride=16,precision=2,geometry=8,Nc=48fine-grained,extract	32	1	4	1	48	2	0	-1	-1	-1	-1	8.83229e-06	# 0.00 Gflop/s, 66.78 GB/s, tuning took 0.099228 seconds at Wed Apr  2 17:24:44 2025
         2x2x2x2	N4quda12ExtractGhostIsLi48ENS_5gauge10FieldOrderIfLi48ELi1EL21QudaGaugeFieldOrder_s2ELb0EsEEEE	GPU-offline,vol=16,stride=16,precision=2,geometry=8,Nc=48fine-grained,inject	64	5	1	1	10	8	12289	-1	-1	-1	-1	1.95795e-06	# 0.00 Gflop/s, 301.24 GB/s, tuning took 0.021311 seconds at Wed Apr  2 17:24:44 2025
         2x2x2x2	N4quda13CalculateYhatIL19QudaFieldLocation_s2EfsNS_5gauge10FieldOrderIfLi48ELi1EL21QudaGaugeFieldOrder_s13ELb1EsEES5_NS3_IfLi48ELi1ELS4_13ELb1EfEELi48ELi4ELi2ELb0ELb1EEE	GPU-offline,vol=16,stride=16,precision=2,geometry=8,Nc=48,GPU-device,comm=0000,mma,3xfp16,m16n8k8	8	1	1	1	24	96	0	0	0	0	0	3.03476e-05	# 3712.20 Gflop/s, 4198.09 GB/s, tuning took 0.001139 seconds at Wed Apr  2 17:24:44 2025
         2x2x2x2	N4quda13CalculateYhatIL19QudaFieldLocation_s2EfsNS_5gauge10FieldOrderIfLi48ELi1EL21QudaGaugeFieldOrder_s13ELb1EsEES5_NS3_IfLi48ELi1ELS4_13ELb1EfEELi48ELi4ELi2ELb1ELb1EEE	GPU-offline,vol=16,stride=16,precision=2,geometry=8,Nc=48,GPU-device,comm=0000,mma,3xfp16,m16n8k8,compute_max	8	1	1	1	24	96	0	0	0	0	0	2.77358e-05	# 4061.77 Gflop/s, 2551.90 GB/s, tuning took 0.001104 seconds at Wed Apr  2 17:24:44 2025
         2x2x2x2	N4quda22DslashCoarsePolicyTuneINS_18DslashCoarseLaunchINS_1DELb0ELi24ELb0ELi1EEEEE	policy,dslashclover,vol=16,parity=2,precision=4,order=2,Ns=2,Nc=24,gauge_prec=2,halo_prec=2,comm=0000,topo=1111,p2p=0,gdr=0,nvshmem=0,pol=11110000000,full,n_rhs=1	32	1	1	1	1	1	0	1	0	0	0	6.72278e-06	# 394.58 Gflop/s, 206.54 GB/s, tuning took 0.003937 seconds at Wed Apr  2 17:24:44 2025
         2x2x2x2	N4quda4blas10caxpyNorm2IdfEE	GPU-offline,vol=16,parity=2,precision=4,order=2,Ns=2,Nc=24,n_rhs=1	128	1	1	1	1	1	0	-1	-1	-1	-1	7.35585e-06	# 1.67 Gflop/s, 2.51 GB/s, tuning took 0.006540 seconds at Wed Apr  2 17:24:44 2025
         2x2x2x2	N4quda4blas12MaxDeviationIdfEE	GPU-offline,vol=16,parity=2,precision=4,order=2,Ns=2,Nc=24,n_rhs=1	128	1	1	1	1	1	0	-1	-1	-1	-1	7.76221e-06	# 0.00 Gflop/s, 1.58 GB/s, tuning took 0.006432 seconds at Wed Apr  2 17:24:44 2025
         2x2x2x2	N4quda4blas5Norm2IdfEE	GPU-offline,vol=16,parity=2,precision=4,order=2,Ns=2,Nc=24,n_rhs=1	256	1	1	1	1	1	0	-1	-1	-1	-1	7.11194e-06	# 0.43 Gflop/s, 0.86 GB/s, tuning took 0.006396 seconds at Wed Apr  2 17:24:44 2025
         2x2x2x2	N4quda4blas5Norm2IdfEE	GPU-offline,vol=16,parity=2,precision=4,order=2,Ns=2,Nc=24,n_rhs=24	128	1	1	1	1	24	0	-1	-1	-1	-1	8.26324e-06	# 8.92 Gflop/s, 17.84 GB/s, tuning took 0.006368 seconds at Wed Apr  2 17:24:44 2025
         2x2x2x2	N4quda7RNGInitE	GPU-offline,vol=16,parity=2,precision=4,order=2,Ns=2,Nc=24	384	1	1	1	2	1	0	-1	-1	-1	-1	0.000418133	# 0.00 Gflop/s, 0.00 GB/s, tuning took 0.056068 seconds at Wed Apr  2 17:24:44 2025
         2x2x2x2	N4quda9CopyGaugeINS_12CopyGaugeArgIffLi4608ELb1ENS_5gauge10FieldOrderIfLi48ELi1EL21QudaGaugeFieldOrder_s13ELb1EfEENS3_IfLi48ELi1ELS4_13ELb1EsEEEEEE	GPU-offline,vol=16,stride=8,precision=2,geometry=1,Nc=48,vol=16,stride=8,precision=4,geometry=1,Nc=48,fine-grained	64	1	1	1	48	2	0	-1	-1	-1	-1	5.38409e-06	# 0.00 Gflop/s, 82.16 GB/s, tuning took 0.015143 seconds at Wed Apr  2 17:24:44 2025
         2x2x2x2	N4quda9CopyGaugeINS_12CopyGaugeArgIffLi4608ELb1ENS_5gauge10FieldOrderIfLi48ELi1EL21QudaGaugeFieldOrder_s13ELb1EsEENS3_IfLi48ELi1ELS4_2ELb1EsEEEEEE	GPU-offline,vol=16,stride=16,precision=2,geometry=8,Nc=48,vol=16,stride=16,precision=2,geometry=8,Nc=48,fine-grained	32	1	2	1	48	8	0	-1	-1	-1	-1	2.8789e-05	# 0.00 Gflop/s, 163.90 GB/s, tuning took 0.055207 seconds at Wed Apr  2 17:24:44 2025
         2x2x2x2	N4quda9CopyGaugeINS_12CopyGaugeArgIffLi4608ELb1ENS_5gauge10FieldOrderIfLi48ELi1EL21QudaGaugeFieldOrder_s13ELb1EsEENS3_IfLi48ELi1ELS4_2ELb1EsEEEEEE	GPU-offline,vol=16,stride=16,precision=2,geometry=8,Nc=48,vol=16,stride=16,precision=2,geometry=8,Nc=48,fine-grained,ghost	32	1	4	1	48	2	0	-1	-1	-1	-1	9.31542e-06	# 0.00 Gflop/s, 253.27 GB/s, tuning took 0.026427 seconds at Wed Apr  2 17:24:44 2025
         2x2x2x2	N4quda9CopyGaugeINS_12CopyGaugeArgIffLi4608ELb1ENS_5gauge10FieldOrderIfLi48ELi1EL21QudaGaugeFieldOrder_s13ELb1EsEENS3_IfLi48ELi1ELS4_2ELb1EsEEEEEE	GPU-offline,vol=16,stride=8,precision=2,geometry=1,Nc=48,vol=16,stride=8,precision=2,geometry=1,Nc=48,fine-grained	96	6	1	1	8	2	0	-1	-1	-1	-1	9.07947e-06	# 0.00 Gflop/s, 32.48 GB/s, tuning took 0.016759 seconds at Wed Apr  2 17:24:44 2025
         2x2x2x2	N4quda9CopyGaugeINS_12CopyGaugeArgIffLi4608ELb1ENS_5gauge10FieldOrderIfLi48ELi1EL21QudaGaugeFieldOrder_s2ELb0EsEENS3_IfLi48ELi1ELS4_2ELb1EsEEEEEE	GPU-offline,vol=16,stride=16,precision=2,geometry=8,Nc=48,vol=16,stride=16,precision=2,geometry=8,Nc=48,fine-grained,ghost	96	3	1	1	16	8	0	-1	-1	-1	-1	8.64294e-06	# 0.00 Gflop/s, 272.97 GB/s, tuning took 0.024690 seconds at Wed Apr  2 17:24:44 2025
         2x2x2x2	N4quda9CopyGaugeINS_12CopyGaugeArgIffLi4608ELb1ENS_5gauge10FieldOrderIfLi48ELi1EL21QudaGaugeFieldOrder_s2ELb1EsEENS3_IfLi48ELi1ELS4_13ELb1EfEEEEEE	GPU-offline,vol=16,stride=8,precision=4,geometry=1,Nc=48,vol=16,stride=8,precision=2,geometry=1,Nc=48,fine-grained	96	2	1	1	24	2	0	-1	-1	-1	-1	4.6542e-06	# 0.00 Gflop/s, 95.05 GB/s, tuning took 0.013641 seconds at Wed Apr  2 17:24:44 2025
         2x2x2x2	N4quda9CopyGaugeINS_12CopyGaugeArgIffLi4608ELb1ENS_5gauge10FieldOrderIfLi48ELi1EL21QudaGaugeFieldOrder_s2ELb1EsEENS3_IfLi48ELi1ELS4_13ELb1EsEEEEEE	GPU-offline,vol=16,stride=16,precision=2,geometry=8,Nc=48,vol=16,stride=16,precision=2,geometry=8,Nc=48,fine-grained	32	7	2	1	7	8	0	-1	-1	-1	-1	1.07975e-05	# 0.00 Gflop/s, 437.01 GB/s, tuning took 0.029525 seconds at Wed Apr  2 17:24:44 2025
         2x2x2x2	N4quda9CopyGaugeINS_12CopyGaugeArgIffLi4608ELb1ENS_5gauge10FieldOrderIfLi48ELi1EL21QudaGaugeFieldOrder_s2ELb1EsEENS3_IfLi48ELi1ELS4_13ELb1EsEEEEEE	GPU-offline,vol=16,stride=16,precision=2,geometry=8,Nc=48,vol=16,stride=16,precision=2,geometry=8,Nc=48,fine-grained,ghost	32	7	2	1	7	4	0	-1	-1	-1	-1	5.07973e-06	# 0.00 Gflop/s, 464.45 GB/s, tuning took 0.018879 seconds at Wed Apr  2 17:24:44 2025
         2x2x2x2	N4quda9CopyGaugeINS_12CopyGaugeArgIffLi4608ELb1ENS_5gauge10FieldOrderIfLi48ELi1EL21QudaGaugeFieldOrder_s2ELb1EsEENS3_IfLi48ELi1ELS4_13ELb1EsEEEEEE	GPU-offline,vol=16,stride=8,precision=2,geometry=1,Nc=48,vol=16,stride=8,precision=2,geometry=1,Nc=48,fine-grained	192	2	1	1	24	2	0	-1	-1	-1	-1	4.64457e-06	# 0.00 Gflop/s, 63.50 GB/s, tuning took 0.013591 seconds at Wed Apr  2 17:24:44 2025
         2x2x2x2	N4quda9CopyGaugeINS_12CopyGaugeArgIffLi4608ELb1ENS_5gauge10FieldOrderIfLi48ELi1EL21QudaGaugeFieldOrder_s2ELb1EsEENS3_IfLi48ELi1ELS4_2ELb0EsEEEEEE	GPU-offline,vol=16,stride=16,precision=2,geometry=8,Nc=48,vol=16,stride=16,precision=2,geometry=8,Nc=48,fine-grained,ghost	64	1	4	1	48	2	0	-1	-1	-1	-1	6.50115e-06	# 0.00 Gflop/s, 362.90 GB/s, tuning took 0.021365 seconds at Wed Apr  2 17:24:44 2025
 2x2x2x2,1x2x2x8	N4quda16ProlongateLaunchIfsLi2ELi24ELi2ELi24EEE	GPU-offline,vol=16,parity=2,precision=4,order=2,Ns=2,Nc=24,vol=32,parity=1,precision=4,order=2,Ns=2,Nc=24,n_rhs=1	32	1	2	1	1	12	3073	-1	-1	-1	-1	3.30503e-06	# 89.23 Gflop/s, 50.27 GB/s, tuning took 0.017052 seconds at Wed Apr  2 17:24:50 2025
 2x2x2x2,2x2x2x8	N4quda16ProlongateLaunchIfsLi2ELi24ELi2ELi24EEE	GPU-offline,vol=16,parity=2,precision=4,order=2,Ns=2,Nc=24,vol=64,parity=2,precision=4,order=2,Ns=2,Nc=24,n_rhs=1	96	1	3	1	2	8	16385	-1	-1	-1	-1	3.36823e-06	# 175.11 Gflop/s, 96.83 GB/s, tuning took 0.020923 seconds at Wed Apr  2 17:24:44 2025
 2x2x2x2,2x2x2x8	N4quda16ProlongateLaunchIfsLi2ELi24ELi2ELi24EEE	GPU-offline,vol=16,parity=2,precision=4,order=2,Ns=2,Nc=24,vol=64,parity=2,precision=4,order=2,Ns=2,Nc=24,n_rhs=24	32	3	5	1	16	5	0	-1	-1	-1	-1	8.47383e-06	# 1670.53 Gflop/s, 923.72 GB/s, tuning took 0.090135 seconds at Wed Apr  2 17:24:44 2025
         2x2x2x8	N4quda10BlockOrthoIsfLi2ELi1ELi24ELi2ELi24EEE	GPU-offline,vol=64,parity=2,precision=2,order=2,Ns=2,Nc=576,nVec=24,block_size=1x1x1x4,n_block_ortho=1,mVec=1	32	1	1	16	1	2	3277	1	-1	-1	-1	0.000411989	# 34.00 Gflop/s, 10.39 GB/s, tuning took 0.061976 seconds at Wed Apr  2 17:24:43 2025
         2x2x2x8	N4quda10CalculateYILb0EL19QudaFieldLocation_s2ENS_13CalculateYArgILb0EfsLi4ELi2ELi3ELi24ENS_5gauge10FieldOrderIfLi48ELi2EL21QudaGaugeFieldOrder_s2ELb1EsEENS4_IfLi48ELi2ELS5_2ELb1EiEENS4_IfLi3ELi1ELS5_2ELb1EfEENS_11colorspinor12FieldOrderCBIfLi4ELi3ELi24EL16QudaFieldOrder_s8EssLb0ELb0EEESC_SC_NS_6clover10FieldOrderIfLi3ELi4EL22QudaCloverFieldOrder_s4EEEEEEE	GPU-offline,vol=16384,parity=2,precision=2,order=8,Ns=4,Nc=72,nVec=24,comm=0000,computeCoarseDiagonal,GPU-device	64	1	13	1	2	2	0	1	1	1	1	2.1313e-06	# 1.44 Gflop/s, 11.53 GB/s, tuning took 0.017162 seconds at Wed Apr  2 17:24:42 2025
         2x2x2x8	N4quda10CalculateYILb0EL19QudaFieldLocation_s2ENS_13CalculateYArgILb0EfsLi4ELi2ELi3ELi24ENS_5gauge10FieldOrderIfLi48ELi2EL21QudaGaugeFieldOrder_s2ELb1EsEENS4_IfLi48ELi2ELS5_2ELb1EiEENS4_IfLi3ELi1ELS5_2ELb1EfEENS_11colorspinor12FieldOrderCBIfLi4ELi3ELi24EL16QudaFieldOrder_s8EssLb0ELb0EEESC_SC_NS_6clover10FieldOrderIfLi3ELi4EL22QudaCloverFieldOrder_s4EEEEEEE	GPU-offline,vol=16384,parity=2,precision=2,order=8,Ns=4,Nc=72,nVec=24,comm=0000,computeConvert,GPU-device	32	5	1	1	10	24	0	1	1	1	1	3.06769e-06	# 1.00 Gflop/s, 576.81 GB/s, tuning took 0.033943 seconds at Wed Apr  2 17:24:35 2025
         2x2x2x8	N4quda10CalculateYILb1EL19QudaFieldLocation_s2ENS_13CalculateYArgILb1EfsLi2ELi2ELi24ELi24ENS_5gauge10FieldOrderIfLi48ELi2EL21QudaGaugeFieldOrder_s13ELb1EsEENS4_IfLi48ELi2ELS5_13ELb1EiEES6_NS_11colorspinor12FieldOrderCBIfLi2ELi24ELi24EL16QudaFieldOrder_s9EssLb0ELb0EEENS9_IfLi4ELi24ELi24ELSA_9EssLb0ELb0EEESB_S6_EEEE	GPU-offline,vol=64,parity=2,precision=2,order=9,Ns=2,Nc=576,nVec=24,comm=0000,computeUV,mma,3xfp16,m16n8k8,compute_max,dim=0,dir=back,nFace=1,GPU-device	32	1	1	1	12	12	0	0	0	0	0	8.84735e-06	# 3200.00 Gflop/s, 1700.06 GB/s, tuning took 0.007474 seconds at Wed Apr  2 17:24:44 2025
         2x2x2x8	N4quda10CalculateYILb1EL19QudaFieldLocation_s2ENS_13CalculateYArgILb1EfsLi2ELi2ELi24ELi24ENS_5gauge10FieldOrderIfLi48ELi2EL21QudaGaugeFieldOrder_s13ELb1EsEENS4_IfLi48ELi2ELS5_13ELb1EiEES6_NS_11colorspinor12FieldOrderCBIfLi2ELi24ELi24EL16QudaFieldOrder_s9EssLb0ELb0EEENS9_IfLi4ELi24ELi24ELSA_9EssLb0ELb0EEESB_S6_EEEE	GPU-offline,vol=64,parity=2,precision=2,order=9,Ns=2,Nc=576,nVec=24,comm=0000,computeUV,mma,3xfp16,m16n8k8,compute_max,dim=0,dir=fwd,nFace=1,GPU-device	32	1	1	1	12	12	0	0	0	0	0	8.98589e-06	# 3150.67 Gflop/s, 1673.85 GB/s, tuning took 0.029592 seconds at Wed Apr  2 17:24:43 2025
         2x2x2x8	N4quda10CalculateYILb1EL19QudaFieldLocation_s2ENS_13CalculateYArgILb1EfsLi2ELi2ELi24ELi24ENS_5gauge10FieldOrderIfLi48ELi2EL21QudaGaugeFieldOrder_s13ELb1EsEENS4_IfLi48ELi2ELS5_13ELb1EiEES6_NS_11colorspinor12FieldOrderCBIfLi2ELi24ELi24EL16QudaFieldOrder_s9EssLb0ELb0EEENS9_IfLi4ELi24ELi24ELSA_9EssLb0ELb0EEESB_S6_EEEE	GPU-offline,vol=64,parity=2,precision=2,order=9,Ns=2,Nc=576,nVec=24,comm=0000,computeUV,mma,3xfp16,m16n8k8,compute_max,dim=1,dir=back,nFace=1,GPU-device	32	1	1	1	12	12	0	0	0	0	0	8.79804e-06	# 3217.94 Gflop/s, 1709.59 GB/s, tuning took 0.007706 seconds at Wed Apr  2 17:24:44 2025
         2x2x2x8	N4quda10CalculateYILb1EL19QudaFieldLocation_s2ENS_13CalculateYArgILb1EfsLi2ELi2ELi24ELi24ENS_5gauge10FieldOrderIfLi48ELi2EL21QudaGaugeFieldOrder_s13ELb1EsEENS4_IfLi48ELi2ELS5_13ELb1EiEES6_NS_11colorspinor12FieldOrderCBIfLi2ELi24ELi24EL16QudaFieldOrder_s9EssLb0ELb0EEENS9_IfLi4ELi24ELi24ELSA_9EssLb0ELb0EEESB_S6_EEEE	GPU-offline,vol=64,parity=2,precision=2,order=9,Ns=2,Nc=576,nVec=24,comm=0000,computeUV,mma,3xfp16,m16n8k8,compute_max,dim=1,dir=fwd,nFace=1,GPU-device	32	1	1	1	12	12	0	0	0	0	0	8.94433e-06	# 3165.31 Gflop/s, 1681.63 GB/s, tuning took 0.007773 seconds at Wed Apr  2 17:24:43 2025
         2x2x2x8	N4quda10CalculateYILb1EL19QudaFieldLocation_s2ENS_13CalculateYArgILb1EfsLi2ELi2ELi24ELi24ENS_5gauge10FieldOrderIfLi48ELi2EL21QudaGaugeFieldOrder_s13ELb1EsEENS4_IfLi48ELi2ELS5_13ELb1EiEES6_NS_11colorspinor12FieldOrderCBIfLi2ELi24ELi24EL16QudaFieldOrder_s9EssLb0ELb0EEENS9_IfLi4ELi24ELi24ELSA_9EssLb0ELb0EEESB_S6_EEEE	GPU-offline,vol=64,parity=2,precision=2,order=9,Ns=2,Nc=576,nVec=24,comm=0000,computeUV,mma,3xfp16,m16n8k8,compute_max,dim=2,dir=back,nFace=1,GPU-device	32	1	1	1	12	12	0	0	0	0	0	8.75624e-06	# 3233.30 Gflop/s, 1717.75 GB/s, tuning took 0.007712 seconds at Wed Apr  2 17:24:44 2025
         2x2x2x8	N4quda10CalculateYILb1EL19QudaFieldLocation_s2ENS_13CalculateYArgILb1EfsLi2ELi2ELi24ELi24ENS_5gauge10FieldOrderIfLi48ELi2EL21QudaGaugeFieldOrder_s13ELb1EsEENS4_IfLi48ELi2ELS5_13ELb1EiEES6_NS_11colorspinor12FieldOrderCBIfLi2ELi24ELi24EL16QudaFieldOrder_s9EssLb0ELb0EEENS9_IfLi4ELi24ELi24ELSA_9EssLb0ELb0EEESB_S6_EEEE	GPU-offline,vol=64,parity=2,precision=2,order=9,Ns=2,Nc=576,nVec=24,comm=0000,computeUV,mma,3xfp16,m16n8k8,compute_max,dim=2,dir=fwd,nFace=1,GPU-device	32	1	1	1	12	12	0	0	0	0	0	8.89437e-06	# 3183.09 Gflop/s, 1691.07 GB/s, tuning took 0.007762 seconds at Wed Apr  2 17:24:43 2025
         2x2x2x8	N4quda10CalculateYILb1EL19QudaFieldLocation_s2ENS_13CalculateYArgILb1EfsLi2ELi2ELi24ELi24ENS_5gauge10FieldOrderIfLi48ELi2EL21QudaGaugeFieldOrder_s13ELb1EsEENS4_IfLi48ELi2ELS5_13ELb1EiEES6_NS_11colorspinor12FieldOrderCBIfLi2ELi24ELi24EL16QudaFieldOrder_s9EssLb0ELb0EEENS9_IfLi4ELi24ELi24ELSA_9EssLb0ELb0EEESB_S6_EEEE	GPU-offline,vol=64,parity=2,precision=2,order=9,Ns=2,Nc=576,nVec=24,comm=0000,computeUV,mma,3xfp16,m16n8k8,compute_max,dim=3,dir=back,nFace=1,GPU-device	32	1	1	1	12	12	0	0	0	0	0	8.80849e-06	# 3214.12 Gflop/s, 1707.56 GB/s, tuning took 0.007730 seconds at Wed Apr  2 17:24:44 2025
         2x2x2x8	N4quda10CalculateYILb1EL19QudaFieldLocation_s2ENS_13CalculateYArgILb1EfsLi2ELi2ELi24ELi24ENS_5gauge10FieldOrderIfLi48ELi2EL21QudaGaugeFieldOrder_s13ELb1EsEENS4_IfLi48ELi2ELS5_13ELb1EiEES6_NS_11colorspinor12FieldOrderCBIfLi2ELi24ELi24EL16QudaFieldOrder_s9EssLb0ELb0EEENS9_IfLi4ELi24ELi24ELSA_9EssLb0ELb0EEESB_S6_EEEE	GPU-offline,vol=64,parity=2,precision=2,order=9,Ns=2,Nc=576,nVec=24,comm=0000,computeUV,mma,3xfp16,m16n8k8,compute_max,dim=3,dir=fwd,nFace=1,GPU-device	32	1	1	1	12	12	0	0	0	0	0	8.93097e-06	# 3170.04 Gflop/s, 1684.14 GB/s, tuning took 0.007714 seconds at Wed Apr  2 17:24:43 2025
         2x2x2x8	N4quda10CalculateYILb1EL19QudaFieldLocation_s2ENS_13CalculateYArgILb1EfsLi2ELi2ELi24ELi24ENS_5gauge10FieldOrderIfLi48ELi2EL21QudaGaugeFieldOrder_s13ELb1EsEENS4_IfLi48ELi2ELS5_13ELb1EiEES6_NS_11colorspinor12FieldOrderCBIfLi2ELi24ELi24EL16QudaFieldOrder_s9EssLb0ELb0EEENS9_IfLi4ELi24ELi24ELSA_9EssLb0ELb0EEESB_S6_EEEE	GPU-offline,vol=64,parity=2,precision=2,order=9,Ns=2,Nc=576,nVec=24,comm=0000,computeUV,mma,3xfp16,m16n8k8,dim=0,dir=back,nFace=1,GPU-device	32	1	1	1	12	12	0	0	0	0	0	8.48457e-06	# 3336.83 Gflop/s, 1703.20 GB/s, tuning took 0.007396 seconds at Wed Apr  2 17:24:44 2025
         2x2x2x8	N4quda10CalculateYILb1EL19QudaFieldLocation_s2ENS_13CalculateYArgILb1EfsLi2ELi2ELi24ELi24ENS_5gauge10FieldOrderIfLi48ELi2EL21QudaGaugeFieldOrder_s13ELb1EsEENS4_IfLi48ELi2ELS5_13ELb1EiEES6_NS_11colorspinor12FieldOrderCBIfLi2ELi24ELi24EL16QudaFieldOrder_s9EssLb0ELb0EEENS9_IfLi4ELi24ELi24ELSA_9EssLb0ELb0EEESB_S6_EEEE	GPU-offline,vol=64,parity=2,precision=2,order=9,Ns=2,Nc=576,nVec=24,comm=0000,computeUV,mma,3xfp16,m16n8k8,dim=0,dir=fwd,nFace=1,GPU-device	32	1	1	1	12	12	0	0	0	0	0	8.67265e-06	# 3264.46 Gflop/s, 1666.27 GB/s, tuning took 0.007493 seconds at Wed Apr  2 17:24:43 2025
         2x2x2x8	N4quda10CalculateYILb1EL19QudaFieldLocation_s2ENS_13CalculateYArgILb1EfsLi2ELi2ELi24ELi24ENS_5gauge10FieldOrderIfLi48ELi2EL21QudaGaugeFieldOrder_s13ELb1EsEENS4_IfLi48ELi2ELS5_13ELb1EiEES6_NS_11colorspinor12FieldOrderCBIfLi2ELi24ELi24EL16QudaFieldOrder_s9EssLb0ELb0EEENS9_IfLi4ELi24ELi24ELSA_9EssLb0ELb0EEESB_S6_EEEE	GPU-offline,vol=64,parity=2,precision=2,order=9,Ns=2,Nc=576,nVec=24,comm=0000,computeUV,mma,3xfp16,m16n8k8,dim=1,dir=back,nFace=1,GPU-device	32	1	1	1	12	12	0	0	0	0	0	8.44242e-06	# 3353.49 Gflop/s, 1711.71 GB/s, tuning took 0.008152 seconds at Wed Apr  2 17:24:44 2025
         2x2x2x8	N4quda10CalculateYILb1EL19QudaFieldLocation_s2ENS_13CalculateYArgILb1EfsLi2ELi2ELi24ELi24ENS_5gauge10FieldOrderIfLi48ELi2EL21QudaGaugeFieldOrder_s13ELb1EsEENS4_IfLi48ELi2ELS5_13ELb1EiEES6_NS_11colorspinor12FieldOrderCBIfLi2ELi24ELi24EL16QudaFieldOrder_s9EssLb0ELb0EEENS9_IfLi4ELi24ELi24ELSA_9EssLb0ELb0EEESB_S6_EEEE	GPU-offline,vol=64,parity=2,precision=2,order=9,Ns=2,Nc=576,nVec=24,comm=0000,computeUV,mma,3xfp16,m16n8k8,dim=1,dir=fwd,nFace=1,GPU-device	32	1	1	1	12	12	0	0	0	0	0	8.55839e-06	# 3308.05 Gflop/s, 1688.51 GB/s, tuning took 0.008199 seconds at Wed Apr  2 17:24:43 2025
         2x2x2x8	N4quda10CalculateYILb1EL19QudaFieldLocation_s2ENS_13CalculateYArgILb1EfsLi2ELi2ELi24ELi24ENS_5gauge10FieldOrderIfLi48ELi2EL21QudaGaugeFieldOrder_s13ELb1EsEENS4_IfLi48ELi2ELS5_13ELb1EiEES6_NS_11colorspinor12FieldOrderCBIfLi2ELi24ELi24EL16QudaFieldOrder_s9EssLb0ELb0EEENS9_IfLi4ELi24ELi24ELSA_9EssLb0ELb0EEESB_S6_EEEE	GPU-offline,vol=64,parity=2,precision=2,order=9,Ns=2,Nc=576,nVec=24,comm=0000,computeUV,mma,3xfp16,m16n8k8,dim=2,dir=back,nFace=1,GPU-device	32	1	1	1	12	12	0	0	0	0	0	8.47412e-06	# 3340.94 Gflop/s, 1705.30 GB/s, tuning took 0.007396 seconds at Wed Apr  2 17:24:44 2025
         2x2x2x8	N4quda10CalculateYILb1EL19QudaFieldLocation_s2ENS_13CalculateYArgILb1EfsLi2ELi2ELi24ELi24ENS_5gauge10FieldOrderIfLi48ELi2EL21QudaGaugeFieldOrder_s13ELb1EsEENS4_IfLi48ELi2ELS5_13ELb1EiEES6_NS_11colorspinor12FieldOrderCBIfLi2ELi24ELi24EL16QudaFieldOrder_s9EssLb0ELb0EEENS9_IfLi4ELi24ELi24ELSA_9EssLb0ELb0EEESB_S6_EEEE	GPU-offline,vol=64,parity=2,precision=2,order=9,Ns=2,Nc=576,nVec=24,comm=0000,computeUV,mma,3xfp16,m16n8k8,dim=2,dir=fwd,nFace=1,GPU-device	32	1	1	1	12	12	0	0	0	0	0	8.58657e-06	# 3297.19 Gflop/s, 1682.97 GB/s, tuning took 0.008344 seconds at Wed Apr  2 17:24:43 2025
         2x2x2x8	N4quda10CalculateYILb1EL19QudaFieldLocation_s2ENS_13CalculateYArgILb1EfsLi2ELi2ELi24ELi24ENS_5gauge10FieldOrderIfLi48ELi2EL21QudaGaugeFieldOrder_s13ELb1EsEENS4_IfLi48ELi2ELS5_13ELb1EiEES6_NS_11colorspinor12FieldOrderCBIfLi2ELi24ELi24EL16QudaFieldOrder_s9EssLb0ELb0EEENS9_IfLi4ELi24ELi24ELSA_9EssLb0ELb0EEESB_S6_EEEE	GPU-offline,vol=64,parity=2,precision=2,order=9,Ns=2,Nc=576,nVec=24,comm=0000,computeUV,mma,3xfp16,m16n8k8,dim=3,dir=back,nFace=1,GPU-device	32	1	1	1	12	12	0	0	0	0	0	8.74627e-06	# 3236.98 Gflop/s, 1652.24 GB/s, tuning took 0.008360 seconds at Wed Apr  2 17:24:44 2025
         2x2x2x8	N4quda10CalculateYILb1EL19QudaFieldLocation_s2ENS_13CalculateYArgILb1EfsLi2ELi2ELi24ELi24ENS_5gauge10FieldOrderIfLi48ELi2EL21QudaGaugeFieldOrder_s13ELb1EsEENS4_IfLi48ELi2ELS5_13ELb1EiEES6_NS_11colorspinor12FieldOrderCBIfLi2ELi24ELi24EL16QudaFieldOrder_s9EssLb0ELb0EEENS9_IfLi4ELi24ELi24ELSA_9EssLb0ELb0EEESB_S6_EEEE	GPU-offline,vol=64,parity=2,precision=2,order=9,Ns=2,Nc=576,nVec=24,comm=0000,computeUV,mma,3xfp16,m16n8k8,dim=3,dir=fwd,nFace=1,GPU-device	32	1	1	1	12	12	0	0	0	0	0	8.70748e-06	# 3251.40 Gflop/s, 1659.60 GB/s, tuning took 0.007660 seconds at Wed Apr  2 17:24:43 2025
         2x2x2x8	N4quda10CalculateYILb1EL19QudaFieldLocation_s2ENS_13CalculateYArgILb1EfsLi2ELi2ELi24ELi24ENS_5gauge10FieldOrderIfLi48ELi2EL21QudaGaugeFieldOrder_s13ELb1EsEENS4_IfLi48ELi2ELS5_13ELb1EiEES6_NS_11colorspinor12FieldOrderCBIfLi2ELi24ELi24EL16QudaFieldOrder_s9EssLb0ELb0EEENS9_IfLi4ELi24ELi24ELSA_9EssLb0ELb0EEESB_S6_EEEE	GPU-offline,vol=64,parity=2,precision=2,order=9,Ns=2,Nc=576,nVec=24,comm=0000,computeVUV,mma,3xfp16,m16n8k8,dim=0,dir=back,nFace=1,bidirectional,GPU-device,coarse_vol=2x2x2x2	32	2	1	1	3	4	0	1	0	0	0	1.55895e-05	# 1816.06 Gflop/s, 1438.51 GB/s, tuning took 0.002005 seconds at Wed Apr  2 17:24:44 2025
         2x2x2x8	N4quda10CalculateYILb1EL19QudaFieldLocation_s2ENS_13CalculateYArgILb1EfsLi2ELi2ELi24ELi24ENS_5gauge10FieldOrderIfLi48ELi2EL21QudaGaugeFieldOrder_s13ELb1EsEENS4_IfLi48ELi2ELS5_13ELb1EiEES6_NS_11colorspinor12FieldOrderCBIfLi2ELi24ELi24EL16QudaFieldOrder_s9EssLb0ELb0EEENS9_IfLi4ELi24ELi24ELSA_9EssLb0ELb0EEESB_S6_EEEE	GPU-offline,vol=64,parity=2,precision=2,order=9,Ns=2,Nc=576,nVec=24,comm=0000,computeVUV,mma,3xfp16,m16n8k8,dim=0,dir=fwd,nFace=1,bidirectional,GPU-device,coarse_vol=2x2x2x2	32	2	1	1	3	4	0	1	0	0	0	1.60171e-05	# 1767.58 Gflop/s, 1400.10 GB/s, tuning took 0.002038 seconds at Wed Apr  2 17:24:43 2025
         2x2x2x8	N4quda10CalculateYILb1EL19QudaFieldLocation_s2ENS_13CalculateYArgILb1EfsLi2ELi2ELi24ELi24ENS_5gauge10FieldOrderIfLi48ELi2EL21QudaGaugeFieldOrder_s13ELb1EsEENS4_IfLi48ELi2ELS5_13ELb1EiEES6_NS_11colorspinor12FieldOrderCBIfLi2ELi24ELi24EL16QudaFieldOrder_s9EssLb0ELb0EEENS9_IfLi4ELi24ELi24ELSA_9EssLb0ELb0EEESB_S6_EEEE	GPU-offline,vol=64,parity=2,precision=2,order=9,Ns=2,Nc=576,nVec=24,comm=0000,computeVUV,mma,3xfp16,m16n8k8,dim=1,dir=back,nFace=1,bidirectional,GPU-device,coarse_vol=2x2x2x2	32	2	1	1	3	4	0	1	0	0	0	1.5616e-05	# 1812.98 Gflop/s, 1436.07 GB/s, tuning took 0.002068 seconds at Wed Apr  2 17:24:44 2025
         2x2x2x8	N4quda10CalculateYILb1EL19QudaFieldLocation_s2ENS_13CalculateYArgILb1EfsLi2ELi2ELi24ELi24ENS_5gauge10FieldOrderIfLi48ELi2EL21QudaGaugeFieldOrder_s13ELb1EsEENS4_IfLi48ELi2ELS5_13ELb1EiEES6_NS_11colorspinor12FieldOrderCBIfLi2ELi24ELi24EL16QudaFieldOrder_s9EssLb0ELb0EEENS9_IfLi4ELi24ELi24ELSA_9EssLb0ELb0EEESB_S6_EEEE	GPU-offline,vol=64,parity=2,precision=2,order=9,Ns=2,Nc=576,nVec=24,comm=0000,computeVUV,mma,3xfp16,m16n8k8,dim=1,dir=fwd,nFace=1,bidirectional,GPU-device,coarse_vol=2x2x2x2	32	2	1	1	3	4	0	1	0	0	0	1.61236e-05	# 1755.91 Gflop/s, 1390.86 GB/s, tuning took 0.002035 seconds at Wed Apr  2 17:24:43 2025
         2x2x2x8	N4quda10CalculateYILb1EL19QudaFieldLocation_s2ENS_13CalculateYArgILb1EfsLi2ELi2ELi24ELi24ENS_5gauge10FieldOrderIfLi48ELi2EL21QudaGaugeFieldOrder_s13ELb1EsEENS4_IfLi48ELi2ELS5_13ELb1EiEES6_NS_11colorspinor12FieldOrderCBIfLi2ELi24ELi24EL16QudaFieldOrder_s9EssLb0ELb0EEENS9_IfLi4ELi24ELi24ELSA_9EssLb0ELb0EEESB_S6_EEEE	GPU-offline,vol=64,parity=2,precision=2,order=9,Ns=2,Nc=576,nVec=24,comm=0000,computeVUV,mma,3xfp16,m16n8k8,dim=2,dir=back,nFace=1,bidirectional,GPU-device,coarse_vol=2x2x2x2	32	2	1	1	3	4	0	1	0	0	0	1.56454e-05	# 1809.58 Gflop/s, 1433.37 GB/s, tuning took 0.002109 seconds at Wed Apr  2 17:24:44 2025
         2x2x2x8	N4quda10CalculateYILb1EL19QudaFieldLocation_s2ENS_13CalculateYArgILb1EfsLi2ELi2ELi24ELi24ENS_5gauge10FieldOrderIfLi48ELi2EL21QudaGaugeFieldOrder_s13ELb1EsEENS4_IfLi48ELi2ELS5_13ELb1EiEES6_NS_11colorspinor12FieldOrderCBIfLi2ELi24ELi24EL16QudaFieldOrder_s9EssLb0ELb0EEENS9_IfLi4ELi24ELi24ELSA_9EssLb0ELb0EEESB_S6_EEEE	GPU-offline,vol=64,parity=2,precision=2,order=9,Ns=2,Nc=576,nVec=24,comm=0000,computeVUV,mma,3xfp16,m16n8k8,dim=2,dir=fwd,nFace=1,bidirectional,GPU-device,coarse_vol=2x2x2x2	32	2	1	1	3	4	0	1	0	0	0	1.61063e-05	# 1757.79 Gflop/s, 1392.35 GB/s, tuning took 0.002063 seconds at Wed Apr  2 17:24:43 2025
         2x2x2x8	N4quda10CalculateYILb1EL19QudaFieldLocation_s2ENS_13CalculateYArgILb1EfsLi2ELi2ELi24ELi24ENS_5gauge10FieldOrderIfLi48ELi2EL21QudaGaugeFieldOrder_s13ELb1EsEENS4_IfLi48ELi2ELS5_13ELb1EiEES6_NS_11colorspinor12FieldOrderCBIfLi2ELi24ELi24EL16QudaFieldOrder_s9EssLb0ELb0EEENS9_IfLi4ELi24ELi24ELSA_9EssLb0ELb0EEESB_S6_EEEE	GPU-offline,vol=64,parity=2,precision=2,order=9,Ns=2,Nc=576,nVec=24,comm=0000,computeVUV,mma,3xfp16,m16n8k8,dim=3,dir=back,nFace=1,bidirectional,GPU-device,coarse_vol=2x2x2x2	32	2	1	1	3	4	0	1	0	0	0	1.37619e-05	# 2057.24 Gflop/s, 1629.54 GB/s, tuning took 0.001998 seconds at Wed Apr  2 17:24:44 2025
         2x2x2x8	N4quda10CalculateYILb1EL19QudaFieldLocation_s2ENS_13CalculateYArgILb1EfsLi2ELi2ELi24ELi24ENS_5gauge10FieldOrderIfLi48ELi2EL21QudaGaugeFieldOrder_s13ELb1EsEENS4_IfLi48ELi2ELS5_13ELb1EiEES6_NS_11colorspinor12FieldOrderCBIfLi2ELi24ELi24EL16QudaFieldOrder_s9EssLb0ELb0EEENS9_IfLi4ELi24ELi24ELSA_9EssLb0ELb0EEESB_S6_EEEE	GPU-offline,vol=64,parity=2,precision=2,order=9,Ns=2,Nc=576,nVec=24,comm=0000,computeVUV,mma,3xfp16,m16n8k8,dim=3,dir=fwd,nFace=1,bidirectional,GPU-device,coarse_vol=2x2x2x2	32	2	1	1	3	4	0	1	0	0	0	1.59956e-05	# 1769.96 Gflop/s, 1401.99 GB/s, tuning took 0.002037 seconds at Wed Apr  2 17:24:43 2025
         2x2x2x8	N4quda10CopySpinorIffLi2ELi24ENS_11colorspinor12FieldOrderCBIfLi2ELi24ELi1EL16QudaFieldOrder_s2EffLb0ELb0EEES4_EE	GPU-offline,vol=64,parity=2,precision=4,order=2,Ns=2,Nc=24	512	2	1	1	1	24	0	-1	-1	-1	-1	1.94748e-06	# 0.00 Gflop/s, 25.24 GB/s, tuning took 0.014934 seconds at Wed Apr  2 17:24:43 2025
         2x2x2x8	N4quda10CopySpinorIssLi2ELi576ENS_11colorspinor12FieldOrderCBIfLi2ELi576ELi1EL16QudaFieldOrder_s9EssLb0ELb0EEENS2_IfLi2ELi576ELi1ELS3_2EssLb0ELb0EEEEE	GPU-offline,vol=64,parity=2,precision=2,order=2,Ns=2,Nc=576,nVec=24	32	1	3	1	2	192	0	-1	-1	-1	-1	4.51396e-06	# 0.00 Gflop/s, 130.78 GB/s, tuning took 0.016587 seconds at Wed Apr  2 17:24:43 2025
         2x2x2x8	N4quda11SpinorNoiseIfLi2ELi24EEE	GPU-offline,vol=64,parity=2,precision=4,order=2,Ns=2,Nc=24,uniform	96	1	1	1	2	1	16385	-1	-1	-1	-1	9.95788e-06	# 0.00 Gflop/s, 2.47 GB/s, tuning took 0.018193 seconds at Wed Apr  2 17:24:43 2025
         2x2x2x8	N4quda12DslashCoarseIfssLi2ELi24ELb1ELb1ELb0ELNS_10DslashTypeE2EEE	policy_kernel,GPU-offline,vol=64,parity=2,precision=4,order=2,Ns=2,Nc=24,comm=0000,full,halo=00000000,n_rhs=1	256	1	2	1	2	24	8192	8	1	1	1	1.99993e-05	# 530.55 Gflop/s, 277.72 GB/s, tuning took 0.133277 seconds at Wed Apr  2 17:24:45 2025
         2x2x2x8	N4quda12DslashCoarseIfssLi2ELi24ELb1ELb1ELb1ELNS_10DslashTypeE2EEE	policy_kernel,GPU-offline,vol=64,parity=2,precision=4,order=2,Ns=2,Nc=24,comm=0000,full,halo=00000000,n_rhs=1	64	2	4	2	1	24	8192	4	2	1	1	1.96969e-05	# 538.70 Gflop/s, 281.98 GB/s, tuning took 0.147067 seconds at Wed Apr  2 17:24:45 2025
         2x2x2x8	N4quda12ExtractGhostIsLi48ENS_5gauge10FieldOrderIfLi48ELi1EL21QudaGaugeFieldOrder_s13ELb1EsEEEE	GPU-offline,vol=64,stride=64,precision=2,geometry=8,Nc=48fine-grained,extract	32	1	4	1	48	2	0	-1	-1	-1	-1	2.40152e-05	# 0.00 Gflop/s, 79.82 GB/s, tuning took 0.102818 seconds at Wed Apr  2 17:24:42 2025
         2x2x2x8	N4quda12ExtractGhostIsLi48ENS_5gauge10FieldOrderIfLi48ELi1EL21QudaGaugeFieldOrder_s2ELb0EsEEEE	GPU-offline,vol=64,stride=64,precision=2,geometry=8,Nc=48fine-grained,extract	32	21	1	1	3	8	0	-1	-1	-1	-1	1.99981e-05	# 0.00 Gflop/s, 95.86 GB/s, tuning took 0.192629 seconds at Wed Apr  2 17:24:42 2025
         2x2x2x8	N4quda12ExtractGhostIsLi48ENS_5gauge10FieldOrderIfLi48ELi1EL21QudaGaugeFieldOrder_s2ELb0EsEEEE	GPU-offline,vol=64,stride=64,precision=2,geometry=8,Nc=48fine-grained,inject	32	11	1	1	5	8	0	-1	-1	-1	-1	2.02078e-06	# 0.00 Gflop/s, 948.61 GB/s, tuning took 0.021838 seconds at Wed Apr  2 17:24:43 2025
         2x2x2x8	N4quda13CalculateYhatIL19QudaFieldLocation_s2EfsNS_5gauge10FieldOrderIfLi48ELi1EL21QudaGaugeFieldOrder_s13ELb1EsEES5_NS3_IfLi48ELi1ELS4_13ELb1EfEELi48ELi4ELi2ELb0ELb1EEE	GPU-offline,vol=64,stride=64,precision=2,geometry=8,Nc=48,GPU-device,comm=0000,mma,3xfp16,m16n8k8	8	1	1	4	24	96	0	0	0	0	0	8.9264e-05	# 5048.23 Gflop/s, 5709.00 GB/s, tuning took 0.001478 seconds at Wed Apr  2 17:24:42 2025
         2x2x2x8	N4quda13CalculateYhatIL19QudaFieldLocation_s2EfsNS_5gauge10FieldOrderIfLi48ELi1EL21QudaGaugeFieldOrder_s13ELb1EsEES5_NS3_IfLi48ELi1ELS4_13ELb1EfEELi48ELi4ELi2ELb1ELb1EEE	GPU-offline,vol=64,stride=64,precision=2,geometry=8,Nc=48,GPU-device,comm=0000,mma,3xfp16,m16n8k8,compute_max	8	1	1	4	24	96	0	0	0	0	0	7.96185e-05	# 5659.81 Gflop/s, 3555.90 GB/s, tuning took 0.011731 seconds at Wed Apr  2 17:24:42 2025
         2x2x2x8	N4quda22DslashCoarsePolicyTuneINS_18DslashCoarseLaunchINS_1DELb0ELi24ELb0ELi1EEEEE	policy,dslashclover,vol=64,parity=2,precision=4,order=2,Ns=2,Nc=24,gauge_prec=2,halo_prec=2,comm=0000,topo=1111,p2p=0,gdr=0,nvshmem=0,pol=11110000000,full,n_rhs=1	32	1	1	1	1	1	0	0	0	0	0	1.99981e-05	# 530.58 Gflop/s, 277.73 GB/s, tuning took 0.004560 seconds at Wed Apr  2 17:24:45 2025
         2x2x2x8	N4quda22DslashCoarsePolicyTuneINS_18DslashCoarseLaunchINS_1DELb1ELi24ELb0ELi1EEEEE	policy,dslashclover,vol=64,parity=2,precision=4,order=2,Ns=2,Nc=24,gauge_prec=2,halo_prec=2,comm=0000,topo=1111,p2p=0,gdr=0,nvshmem=0,pol=11110000000,full,n_rhs=1	32	1	1	1	1	1	0	0	0	0	0	1.96568e-05	# 539.80 Gflop/s, 282.56 GB/s, tuning took 0.004489 seconds at Wed Apr  2 17:24:45 2025
         2x2x2x8	N4quda4blas10caxpyNorm2IdfEE	GPU-offline,vol=64,parity=2,precision=4,order=2,Ns=2,Nc=24,n_rhs=1	256	1	1	2	1	1	0	-1	-1	-1	-1	9.5419e-06	# 5.15 Gflop/s, 7.73 GB/s, tuning took 0.011980 seconds at Wed Apr  2 17:24:49 2025
         2x2x2x8	N4quda4blas10caxpyNorm2IdfEE	GPU-offline,vol=64,parity=2,precision=4,order=2,Ns=2,Nc=24,n_rhs=24	256	1	1	1	1	24	0	-1	-1	-1	-1	1.13577e-05	# 103.86 Gflop/s, 155.79 GB/s, tuning took 0.011877 seconds at Wed Apr  2 17:24:44 2025
         2x2x2x8	N4quda4blas12MaxDeviationIdfEE	GPU-offline,vol=64,parity=2,precision=4,order=2,Ns=2,Nc=24,n_rhs=1	256	1	1	2	1	1	0	-1	-1	-1	-1	1.05586e-05	# 0.00 Gflop/s, 4.66 GB/s, tuning took 0.011816 seconds at Wed Apr  2 17:24:49 2025
         2x2x2x8	N4quda4blas12MaxDeviationIdfEE	GPU-offline,vol=64,parity=2,precision=4,order=2,Ns=2,Nc=24,n_rhs=24	256	1	1	1	1	24	0	-1	-1	-1	-1	1.27234e-05	# 0.00 Gflop/s, 92.72 GB/s, tuning took 0.012065 seconds at Wed Apr  2 17:24:44 2025
         2x2x2x8	N4quda4blas4CdotIdfEE	GPU-offline,vol=64,parity=2,precision=4,order=2,Ns=2,Nc=24,n_rhs=1	128	1	1	2	1	1	0	-1	-1	-1	-1	1.15076e-05	# 2.14 Gflop/s, 4.27 GB/s, tuning took 0.012755 seconds at Wed Apr  2 17:24:43 2025
         2x2x2x8	N4quda4blas4axy_IfEE	GPU-offline,vol=64,parity=2,precision=4,order=2,Ns=2,Nc=24,n_rhs=1	512	1	2	56	1	1	0	-1	-1	-1	-1	2.39951e-06	# 7.68 Gflop/s, 20.48 GB/s, tuning took 0.010316 seconds at Wed Apr  2 17:24:43 2025
         2x2x2x8	N4quda4blas5Norm2IdfEE	GPU-offline,vol=64,parity=2,precision=4,order=2,Ns=2,Nc=24,n_rhs=1	256	1	1	2	1	1	0	-1	-1	-1	-1	9.17785e-06	# 1.34 Gflop/s, 2.68 GB/s, tuning took 0.011642 seconds at Wed Apr  2 17:24:43 2025
         2x2x2x8	N4quda4blas5Norm2IdfEE	GPU-offline,vol=64,parity=2,precision=4,order=2,Ns=2,Nc=24,n_rhs=24	256	1	1	1	1	24	0	-1	-1	-1	-1	1.09573e-05	# 26.91 Gflop/s, 53.83 GB/s, tuning took 0.012182 seconds at Wed Apr  2 17:24:44 2025
         2x2x2x8	N4quda4blas6caxpy_IfEE	GPU-offline,vol=64,parity=2,precision=4,order=2,Ns=2,Nc=24,n_rhs=1	448	1	2	56	1	1	0	-1	-1	-1	-1	2.3937e-06	# 10.27 Gflop/s, 30.80 GB/s, tuning took 0.010285 seconds at Wed Apr  2 17:24:43 2025
         2x2x2x8	N4quda7RNGInitE	GPU-offline,vol=64,parity=2,precision=4,order=2,Ns=2,Nc=24	224	1	1	1	2	1	0	-1	-1	-1	-1	0.000574123	# 0.00 Gflop/s, 0.00 GB/s, tuning took 0.076897 seconds at Wed Apr  2 17:24:43 2025
         2x2x2x8	N4quda9CopyGaugeINS_12CopyGaugeArgIffLi4608ELb1ENS_5gauge10FieldOrderIfLi48ELi1EL21QudaGaugeFieldOrder_s13ELb1EfEENS3_IfLi48ELi1ELS4_2ELb1EsEEEEEE	GPU-offline,vol=64,stride=32,precision=2,geometry=1,Nc=48,vol=64,stride=32,precision=4,geometry=1,Nc=48,fine-grained	64	1	1	1	48	2	0	-1	-1	-1	-1	1.455e-05	# 0.00 Gflop/s, 121.61 GB/s, tuning took 0.022926 seconds at Wed Apr  2 17:24:42 2025
         2x2x2x8	N4quda9CopyGaugeINS_12CopyGaugeArgIffLi4608ELb1ENS_5gauge10FieldOrderIfLi48ELi1EL21QudaGaugeFieldOrder_s13ELb1EsEENS3_IfLi48ELi1ELS4_2ELb1EsEEEEEE	GPU-offline,vol=64,stride=32,precision=2,geometry=1,Nc=48,vol=64,stride=32,precision=2,geometry=1,Nc=48,fine-grained	64	7	1	1	7	2	0	-1	-1	-1	-1	1.46584e-05	# 0.00 Gflop/s, 80.48 GB/s, tuning took 0.022869 seconds at Wed Apr  2 17:24:42 2025
         2x2x2x8	N4quda9CopyGaugeINS_12CopyGaugeArgIffLi4608ELb1ENS_5gauge10FieldOrderIfLi48ELi1EL21QudaGaugeFieldOrder_s13ELb1EsEENS3_IfLi48ELi1ELS4_2ELb1EsEEEEEE	GPU-offline,vol=64,stride=64,precision=2,geometry=8,Nc=48,vol=64,stride=64,precision=2,geometry=8,Nc=48,fine-grained	64	7	2	1	7	8	0	-1	-1	-1	-1	0.000105165	# 0.00 Gflop/s, 179.47 GB/s, tuning took 0.185220 seconds at Wed Apr  2 17:24:42 2025
         2x2x2x8	N4quda9CopyGaugeINS_12CopyGaugeArgIffLi4608ELb1ENS_5gauge10FieldOrderIfLi48ELi1EL21QudaGaugeFieldOrder_s13ELb1EsEENS3_IfLi48ELi1ELS4_2ELb1EsEEEEEE	GPU-offline,vol=64,stride=64,precision=2,geometry=8,Nc=48,vol=64,stride=64,precision=2,geometry=8,Nc=48,fine-grained,ghost	32	1	2	1	48	4	0	-1	-1	-1	-1	2.3747e-05	# 0.00 Gflop/s, 322.89 GB/s, tuning took 0.043547 seconds at Wed Apr  2 17:24:42 2025
         2x2x2x8	N4quda9CopyGaugeINS_12CopyGaugeArgIffLi4608ELb1ENS_5gauge10FieldOrderIfLi48ELi1EL21QudaGaugeFieldOrder_s2ELb0EsEENS3_IfLi48ELi1ELS4_2ELb1EsEEEEEE	GPU-offline,vol=64,stride=64,precision=2,geometry=8,Nc=48,vol=64,stride=64,precision=2,geometry=8,Nc=48,fine-grained,ghost	32	2	3	1	24	3	0	-1	-1	-1	-1	1.93378e-05	# 0.00 Gflop/s, 396.51 GB/s, tuning took 0.037452 seconds at Wed Apr  2 17:24:43 2025
         2x2x2x8	N4quda9CopyGaugeINS_12CopyGaugeArgIffLi4608ELb1ENS_5gauge10FieldOrderIfLi48ELi1EL21QudaGaugeFieldOrder_s2ELb1EsEENS3_IfLi48ELi1ELS4_13ELb1EfEEEEEE	GPU-offline,vol=64,stride=32,precision=4,geometry=1,Nc=48,vol=64,stride=32,precision=2,geometry=1,Nc=48,fine-grained	64	1	1	1	48	2	0	-1	-1	-1	-1	6.90469e-06	# 0.00 Gflop/s, 256.27 GB/s, tuning took 0.017362 seconds at Wed Apr  2 17:24:42 2025
         2x2x2x8	N4quda9CopyGaugeINS_12CopyGaugeArgIffLi4608ELb1ENS_5gauge10FieldOrderIfLi48ELi1EL21QudaGaugeFieldOrder_s2ELb1EsEENS3_IfLi48ELi1ELS4_13ELb1EsEEEEEE	GPU-offline,vol=64,stride=64,precision=2,geometry=8,Nc=48,vol=64,stride=64,precision=2,geometry=8,Nc=48,fine-grained	64	7	2	1	7	8	0	-1	-1	-1	-1	3.75846e-05	# 0.00 Gflop/s, 502.18 GB/s, tuning took 0.062205 seconds at Wed Apr  2 17:24:43 2025
         2x2x2x8	N4quda9CopyGaugeINS_12CopyGaugeArgIffLi4608ELb1ENS_5gauge10FieldOrderIfLi48ELi1EL21QudaGaugeFieldOrder_s2ELb1EsEENS3_IfLi48ELi1ELS4_13ELb1EsEEEEEE	GPU-offline,vol=64,stride=64,precision=2,geometry=8,Nc=48,vol=64,stride=64,precision=2,geometry=8,Nc=48,fine-grained,ghost	32	1	2	1	48	4	0	-1	-1	-1	-1	1.10993e-05	# 0.00 Gflop/s, 690.83 GB/s, tuning took 0.024368 seconds at Wed Apr  2 17:24:43 2025
         2x2x2x8	N4quda9CopyGaugeINS_12CopyGaugeArgIffLi4608ELb1ENS_5gauge10FieldOrderIfLi48ELi1EL21QudaGaugeFieldOrder_s2ELb1EsEENS3_IfLi48ELi1ELS4_2ELb0EsEEEEEE	GPU-offline,vol=64,stride=64,precision=2,geometry=8,Nc=48,vol=64,stride=64,precision=2,geometry=8,Nc=48,fine-grained,ghost	64	6	1	1	8	8	0	-1	-1	-1	-1	2.06537e-05	# 0.00 Gflop/s, 371.25 GB/s, tuning took 0.035818 seconds at Wed Apr  2 17:24:42 2025
 2x2x2x8,2x2x2x2	N4quda14RestrictLaunchIffsLi2ELi24ELi2ELi24EEE	GPU-offline,vol=64,parity=2,precision=4,order=2,Ns=2,Nc=24,vol=16,parity=2,precision=4,order=2,Ns=2,Nc=24,n_rhs=1	32	1	1	16	1	12	0	8	-1	-1	-1	5.53345e-06	# 106.59 Gflop/s, 58.94 GB/s, tuning took 0.026927 seconds at Wed Apr  2 17:24:44 2025
 2x2x2x8,2x2x2x2	N4quda14RestrictLaunchIffsLi2ELi24ELi2ELi24EEE	GPU-offline,vol=64,parity=2,precision=4,order=2,Ns=2,Nc=24,vol=16,parity=2,precision=4,order=2,Ns=2,Nc=24,n_rhs=24	32	1	4	16	1	72	0	2	-1	-1	-1	4.8128e-05	# 294.13 Gflop/s, 162.64 GB/s, tuning took 0.013326 seconds at Wed Apr  2 17:24:44 2025
2x2x2x8,4x8x8x32	N4quda16ProlongateLaunchIfsLi4ELi3ELi2ELi24EEE	GPU-offline,vol=64,parity=2,precision=4,order=2,Ns=2,Nc=24,vol=8192,parity=1,precision=4,order=4,Ns=4,Nc=3,n_rhs=1,to_non_rel	64	1	1	128	1	3	0	-1	-1	-1	-1	3.38603e-05	# 557.42 Gflop/s, 304.60 GB/s, tuning took 0.052020 seconds at Wed Apr  2 17:24:50 2025
2x2x2x8,8x8x8x32	N4quda16ProlongateLaunchIfsLi4ELi3ELi2ELi24EEE	GPU-offline,vol=64,parity=2,precision=4,order=2,Ns=2,Nc=24,vol=16384,parity=2,precision=4,order=4,Ns=4,Nc=3,n_rhs=1,to_non_rel	64	1	3	128	2	1	0	-1	-1	-1	-1	6.5792e-05	# 573.76 Gflop/s, 313.15 GB/s, tuning took 0.118616 seconds at Wed Apr  2 17:24:49 2025
2x2x2x8,8x8x8x32	N4quda16ProlongateLaunchIfsLi4ELi3ELi2ELi24EEE	GPU-offline,vol=64,parity=2,precision=4,order=2,Ns=2,Nc=24,vol=16384,parity=2,precision=4,order=4,Ns=4,Nc=3,n_rhs=24	32	4	3	256	12	1	0	-1	-1	-1	-1	0.000501077	# 1808.04 Gflop/s, 986.81 GB/s, tuning took 2.954258 seconds at Wed Apr  2 17:24:48 2025
           36864	N4quda15TransformReduceINS_7maximumIfEENS_7complexIsEEjNS_8abs_max_IfsEENS_8identityEEE	,batch_size=2	1024	1	1	14	1	2	0	-1	-1	-1	-1	6.77583e-06	# 0.00 Gflop/s, 43.52 GB/s, tuning took 0.023570 seconds at Wed Apr  2 17:24:43 2025
          458752	N4quda15TransformReduceINS_7maximumIdEEKNS_7complexIdEEmNS_8abs_max_IddEENS_8identityEEE	,batch_size=1	256	1	1	56	1	1	0	-1	-1	-1	-1	3.08441e-05	# 0.00 Gflop/s, 237.97 GB/s, tuning took 0.179684 seconds at Wed Apr  2 16:47:07 2025
        4x8x8x32	N4quda15CopyColorSpinorILi4ELi3ENS_11colorspinor11FloatNOrderIdLi4ELi3ELi2ELb0ELb0ELb0EEES3_St5tupleIJRNS_16ColorSpinorFieldERKS5_19QudaFieldLocation_sPdPKdEEEE	GPU-offline,vol=8192,parity=1,precision=8,order=2,Ns=4,Nc=3vol=8192,parity=1,precision=8,order=2,Ns=4,Nc=3	64	1	1	128	1	1	0	-1	-1	-1	-1	8.58585e-06	# 0.00 Gflop/s, 366.39 GB/s, tuning took 0.012795 seconds at Wed Apr  2 16:47:08 2025
        4x8x8x32	N4quda15CopyColorSpinorILi4ELi3ENS_11colorspinor11FloatNOrderIfLi4ELi3ELi4ELb0ELb0ELb0EEENS2_IdLi4ELi3ELi2ELb0ELb0ELb0EEESt5tupleIJRNS_16ColorSpinorFieldERKS6_19QudaFieldLocation_sPfPKdEEEE	GPU-offline,vol=8192,parity=1,precision=8,order=2,Ns=4,Nc=3vol=8192,parity=1,precision=4,order=4,Ns=4,Nc=3	320	1	1	26	1	1	0	-1	-1	-1	-1	6.26162e-06	# 0.00 Gflop/s, 376.79 GB/s, tuning took 0.014988 seconds at Wed Apr  2 17:24:49 2025
        4x8x8x32	N4quda15CopyColorSpinorILi4ELi3ENS_11colorspinor11FloatNOrderIfLi4ELi3ELi4ELb0ELb0ELb0EEES3_St5tupleIJRNS_16ColorSpinorFieldERKS5_19QudaFieldLocation_sPfPKfEEEE	GPU-offline,vol=8192,parity=1,precision=4,order=4,Ns=4,Nc=3vol=8192,parity=1,precision=4,order=4,Ns=4,Nc=3	320	1	1	26	1	1	0	-1	-1	-1	-1	2.62282e-06	# 0.00 Gflop/s, 599.68 GB/s, tuning took 0.012943 seconds at Wed Apr  2 17:24:24 2025
        4x8x8x32	N4quda15CopyColorSpinorILi4ELi3ENS_11colorspinor11FloatNOrderIsLi4ELi3ELi8ELb0ELb0ELb0EEENS2_IdLi4ELi3ELi2ELb0ELb0ELb0EEESt5tupleIJRNS_16ColorSpinorFieldERKS6_19QudaFieldLocation_sPsPKdEEEE	GPU-offline,vol=8192,parity=1,precision=8,order=2,Ns=4,Nc=3vol=8192,parity=1,precision=2,order=8,Ns=4,Nc=3	32	1	1	256	1	1	0	-1	-1	-1	-1	5.94056e-06	# 0.00 Gflop/s, 336.47 GB/s, tuning took 0.016398 seconds at Wed Apr  2 16:47:08 2025
        4x8x8x32	N4quda15CopyColorSpinorILi4ELi3ENS_11colorspinor11FloatNOrderIsLi4ELi3ELi8ELb0ELb0ELb0EEENS2_IfLi4ELi3ELi4ELb0ELb0ELb0EEESt5tupleIJRNS_16ColorSpinorFieldERKS6_19QudaFieldLocation_sPsPKfEEEE	GPU-offline,vol=8192,parity=1,precision=4,order=4,Ns=4,Nc=3vol=8192,parity=1,precision=2,order=8,Ns=4,Nc=3	192	1	1	43	1	1	0	-1	-1	-1	-1	2.58935e-06	# 0.00 Gflop/s, 468.23 GB/s, tuning took 0.009349 seconds at Wed Apr  2 17:24:24 2025
        4x8x8x32	N4quda15CopyColorSpinorILi4ELi3ENS_11colorspinor11FloatNOrderIsLi4ELi3ELi8ELb0ELb0ELb0EEES3_St5tupleIJRNS_16ColorSpinorFieldERKS5_19QudaFieldLocation_sPsPKsEEEE	GPU-offline,vol=8192,parity=1,precision=2,order=8,Ns=4,Nc=3vol=8192,parity=1,precision=2,order=8,Ns=4,Nc=3	96	1	1	86	1	1	0	-1	-1	-1	-1	2.44351e-06	# 0.00 Gflop/s, 348.67 GB/s, tuning took 0.013236 seconds at Wed Apr  2 16:47:08 2025
        4x8x8x32	N4quda26WilsonCloverPreconditionedINS_15WilsonCloverArgIdLi3ELi4EL21QudaReconstructType_s12ELb0EEEEE	policy,GPU-offline,vol=8192,parity=1,precision=8,order=2,Ns=4,Nc=3,commDim=0000,n_rhs=1,n_rhs_tile=1,topo=1111,p2p=0,gdr=0,nvshmem=0,pol=110000000000000000	32	1	1	1	1	1	0	1	0	0	-1	0.00018688	# 82.06 Gflop/s, 120.64 GB/s, tuning took 0.004159 seconds at Wed Apr  2 16:47:08 2025
        4x8x8x32	N4quda26WilsonCloverPreconditionedINS_15WilsonCloverArgIdLi3ELi4EL21QudaReconstructType_s12ELb0EEEEE	policy,GPU-offline,vol=8192,parity=1,precision=8,order=2,Ns=4,Nc=3,commDim=0000,xpay,n_rhs=1,n_rhs_tile=1,topo=1111,p2p=0,gdr=0,nvshmem=0,pol=110000000000000000	32	1	1	1	1	1	0	1	0	0	-1	0.000189237	# 83.12 Gflop/s, 119.13 GB/s, tuning took 0.004210 seconds at Wed Apr  2 16:47:09 2025
        4x8x8x32	N4quda26WilsonCloverPreconditionedINS_15WilsonCloverArgIdLi3ELi4EL21QudaReconstructType_s12ELb0EEEEE	policy_kernel=interior,GPU-offline,vol=8192,parity=1,precision=8,order=2,Ns=4,Nc=3,commDim=0000,n_rhs=1,n_rhs_tile=1,comm=0000	64	1	1	128	1	1	25345	-1	-1	-1	-1	0.00018688	# 82.06 Gflop/s, 120.64 GB/s, tuning took 0.170197 seconds at Wed Apr  2 16:47:08 2025
        4x8x8x32	N4quda26WilsonCloverPreconditionedINS_15WilsonCloverArgIdLi3ELi4EL21QudaReconstructType_s12ELb0EEEEE	policy_kernel=interior,GPU-offline,vol=8192,parity=1,precision=8,order=2,Ns=4,Nc=3,commDim=0000,xpay,n_rhs=1,n_rhs_tile=1,comm=0000	32	1	1	256	1	1	20276	-1	-1	-1	-1	0.000189099	# 83.18 Gflop/s, 119.22 GB/s, tuning took 0.150886 seconds at Wed Apr  2 16:47:09 2025
        4x8x8x32	N4quda26WilsonCloverPreconditionedINS_15WilsonCloverArgIfLi3ELi4EL21QudaReconstructType_s12ELb0EEEEE	policy,GPU-offline,vol=8192,parity=1,precision=4,order=4,Ns=4,Nc=3,commDim=0000,dagger,n_rhs=1,n_rhs_tile=1,topo=1111,p2p=0,gdr=0,nvshmem=0,pol=110000000000000000	32	1	1	1	1	1	0	1	0	0	-1	9.01973e-05	# 170.02 Gflop/s, 124.97 GB/s, tuning took 0.003110 seconds at Wed Apr  2 17:24:24 2025
        4x8x8x32	N4quda26WilsonCloverPreconditionedINS_15WilsonCloverArgIfLi3ELi4EL21QudaReconstructType_s12ELb0EEEEE	policy,GPU-offline,vol=8192,parity=1,precision=4,order=4,Ns=4,Nc=3,commDim=0000,n_rhs=1,n_rhs_tile=1,topo=1111,p2p=0,gdr=0,nvshmem=0,pol=110000000000000000	32	1	1	1	1	1	0	0	0	0	-1	9.05493e-05	# 169.36 Gflop/s, 124.49 GB/s, tuning took 0.003125 seconds at Wed Apr  2 17:24:24 2025
        4x8x8x32	N4quda26WilsonCloverPreconditionedINS_15WilsonCloverArgIfLi3ELi4EL21QudaReconstructType_s12ELb0EEEEE	policy,GPU-offline,vol=8192,parity=1,precision=4,order=4,Ns=4,Nc=3,commDim=0000,xpay,n_rhs=1,n_rhs_tile=1,topo=1111,p2p=0,gdr=0,nvshmem=0,pol=110000000000000000	32	1	1	1	1	1	0	0	0	0	-1	9.07636e-05	# 173.29 Gflop/s, 124.19 GB/s, tuning took 0.002950 seconds at Wed Apr  2 17:24:24 2025
        4x8x8x32	N4quda26WilsonCloverPreconditionedINS_15WilsonCloverArgIfLi3ELi4EL21QudaReconstructType_s12ELb0EEEEE	policy_kernel=interior,GPU-offline,vol=8192,parity=1,precision=4,order=4,Ns=4,Nc=3,commDim=0000,dagger,n_rhs=1,n_rhs_tile=1,comm=0000	32	1	1	256	1	1	16897	-1	-1	-1	-1	9.02827e-05	# 169.86 Gflop/s, 124.85 GB/s, tuning took 0.092079 seconds at Wed Apr  2 17:24:24 2025
        4x8x8x32	N4quda26WilsonCloverPreconditionedINS_15WilsonCloverArgIfLi3ELi4EL21QudaReconstructType_s12ELb0EEEEE	policy_kernel=interior,GPU-offline,vol=8192,parity=1,precision=4,order=4,Ns=4,Nc=3,commDim=0000,n_rhs=1,n_rhs_tile=1,comm=0000	32	1	1	256	1	1	16897	-1	-1	-1	-1	9.04533e-05	# 169.54 Gflop/s, 124.62 GB/s, tuning took 0.163703 seconds at Wed Apr  2 17:24:24 2025
        4x8x8x32	N4quda26WilsonCloverPreconditionedINS_15WilsonCloverArgIfLi3ELi4EL21QudaReconstructType_s12ELb0EEEEE	policy_kernel=interior,GPU-offline,vol=8192,parity=1,precision=4,order=4,Ns=4,Nc=3,commDim=0000,xpay,n_rhs=1,n_rhs_tile=1,comm=0000	32	1	1	256	1	1	16897	-1	-1	-1	-1	9.08829e-05	# 173.06 Gflop/s, 124.03 GB/s, tuning took 0.090955 seconds at Wed Apr  2 17:24:24 2025
        4x8x8x32	N4quda26WilsonCloverPreconditionedINS_15WilsonCloverArgIsLi3ELi4EL21QudaReconstructType_s12ELb0EEEEE	policy,GPU-offline,vol=8192,parity=1,precision=2,order=8,Ns=4,Nc=3,commDim=0000,dagger,n_rhs=1,n_rhs_tile=1,topo=1111,p2p=0,gdr=0,nvshmem=0,pol=110000000000000000	32	1	1	1	1	1	0	0	0	0	-1	1.41534e-05	# 1083.51 Gflop/s, 416.74 GB/s, tuning took 0.002112 seconds at Wed Apr  2 17:24:24 2025
        4x8x8x32	N4quda26WilsonCloverPreconditionedINS_15WilsonCloverArgIsLi3ELi4EL21QudaReconstructType_s12ELb0EEEEE	policy,GPU-offline,vol=8192,parity=1,precision=2,order=8,Ns=4,Nc=3,commDim=0000,n_rhs=1,n_rhs_tile=1,topo=1111,p2p=0,gdr=0,nvshmem=0,pol=110000000000000000	32	1	1	1	1	1	0	0	0	0	-1	1.39109e-05	# 1102.41 Gflop/s, 424.00 GB/s, tuning took 0.002138 seconds at Wed Apr  2 16:47:08 2025
        4x8x8x32	N4quda26WilsonCloverPreconditionedINS_15WilsonCloverArgIsLi3ELi4EL21QudaReconstructType_s12ELb0EEEEE	policy,GPU-offline,vol=8192,parity=1,precision=2,order=8,Ns=4,Nc=3,commDim=0000,xpay,n_rhs=1,n_rhs_tile=1,topo=1111,p2p=0,gdr=0,nvshmem=0,pol=110000000000000000	32	1	1	1	1	1	0	1	0	0	-1	1.53935e-05	# 1021.77 Gflop/s, 383.17 GB/s, tuning took 0.002114 seconds at Wed Apr  2 16:47:08 2025
        4x8x8x32	N4quda26WilsonCloverPreconditionedINS_15WilsonCloverArgIsLi3ELi4EL21QudaReconstructType_s12ELb0EEEEE	policy_kernel=interior,GPU-offline,vol=8192,parity=1,precision=2,order=8,Ns=4,Nc=3,commDim=0000,dagger,n_rhs=1,n_rhs_tile=1,comm=0000	112	1	1	74	1	1	0	-1	-1	-1	-1	1.41189e-05	# 1086.17 Gflop/s, 417.76 GB/s, tuning took 0.027006 seconds at Wed Apr  2 17:24:24 2025
        4x8x8x32	N4quda26WilsonCloverPreconditionedINS_15WilsonCloverArgIsLi3ELi4EL21QudaReconstructType_s12ELb0EEEEE	policy_kernel=interior,GPU-offline,vol=8192,parity=1,precision=2,order=8,Ns=4,Nc=3,commDim=0000,n_rhs=1,n_rhs_tile=1,comm=0000	96	1	1	86	1	1	9217	-1	-1	-1	-1	1.3824e-05	# 1109.33 Gflop/s, 426.67 GB/s, tuning took 0.098291 seconds at Wed Apr  2 16:47:08 2025
        4x8x8x32	N4quda26WilsonCloverPreconditionedINS_15WilsonCloverArgIsLi3ELi4EL21QudaReconstructType_s12ELb0EEEEE	policy_kernel=interior,GPU-offline,vol=8192,parity=1,precision=2,order=8,Ns=4,Nc=3,commDim=0000,xpay,n_rhs=1,n_rhs_tile=1,comm=0000	192	1	1	43	1	1	20276	-1	-1	-1	-1	1.54531e-05	# 1017.83 Gflop/s, 381.69 GB/s, tuning took 0.028522 seconds at Wed Apr  2 16:47:08 2025
        4x8x8x32	N4quda4blas10CdotNormABIdfEE	GPU-offline,vol=8192,parity=1,precision=2,order=8,Ns=4,Nc=3,n_rhs=1	32	1	1	52	1	1	0	-1	-1	-1	-1	2.21639e-05	# 70.97 Gflop/s, 38.44 GB/s, tuning took 0.065487 seconds at Wed Apr  2 16:47:08 2025
        4x8x8x32	N4quda4blas10CdotNormABIdfEE	GPU-offline,vol=8192,parity=1,precision=4,order=4,Ns=4,Nc=3,n_rhs=1	128	1	1	28	1	1	0	-1	-1	-1	-1	2.13079e-05	# 73.82 Gflop/s, 73.82 GB/s, tuning took 0.062473 seconds at Wed Apr  2 17:25:03 2025
        4x8x8x32	N4quda4blas10caxpyNorm2IddEE	GPU-offline,vol=8192,parity=1,precision=8,order=2,Ns=4,Nc=3,n_rhs=1	256	1	1	56	1	1	0	-1	-1	-1	-1	2.00229e-05	# 78.55 Gflop/s, 235.66 GB/s, tuning took 0.072290 seconds at Wed Apr  2 16:47:09 2025
        4x8x8x32	N4quda4blas10caxpyNorm2IdfEE	GPU-offline,vol=8192,parity=1,precision=4,order=4,Ns=4,Nc=3,n_rhs=1	128	1	1	55	1	1	0	-1	-1	-1	-1	1.20265e-05	# 130.78 Gflop/s, 196.17 GB/s, tuning took 0.038423 seconds at Wed Apr  2 17:24:24 2025
        4x8x8x32	N4quda4blas10multiaxpy_IfEE	GPU-offline,vol=8192,parity=1,precision=2,order=8,Ns=4,Nc=3,vol=8192,parity=1,precision=4,order=4,Ns=4,Nc=3,Nxz=1,Nyw=1	192	1	1	56	1	1	0	1	0	0	0	3.97052e-06	# 99.03 Gflop/s, 503.42 GB/s, tuning took 0.037973 seconds at Wed Apr  2 17:24:25 2025
        4x8x8x32	N4quda4blas11axpbyzNorm2IdfEE	GPU-offline,vol=8192,parity=1,precision=2,order=8,Ns=4,Nc=3,n_rhs=1	64	1	1	50	1	1	0	-1	-1	-1	-1	1.38973e-05	# 56.59 Gflop/s, 91.96 GB/s, tuning took 0.032719 seconds at Wed Apr  2 17:24:25 2025
        4x8x8x32	N4quda4blas11multicaxpy_IdEE	GPU-offline,vol=8192,parity=1,precision=4,order=4,Ns=4,Nc=3,vol=8192,parity=1,precision=8,order=2,Ns=4,Nc=3,Nxz=1,Nyw=1	160	1	1	56	1	1	0	1	0	0	0	9.72404e-06	# 80.87 Gflop/s, 404.37 GB/s, tuning took 0.011199 seconds at Wed Apr  2 17:25:03 2025
        4x8x8x32	N4quda4blas11multicaxpy_IdEE	GPU-offline,vol=8192,parity=1,precision=4,order=4,Ns=4,Nc=3,vol=8192,parity=1,precision=8,order=2,Ns=4,Nc=3,Nxz=4,Nyw=1	320	1	1	56	1	1	0	1	0	0	0	3.1072e-05	# 101.24 Gflop/s, 202.48 GB/s, tuning took 0.014413 seconds at Wed Apr  2 17:25:03 2025
        4x8x8x32	N4quda4blas11multicaxpy_IfEE	GPU-offline,vol=8192,parity=1,precision=2,order=8,Ns=4,Nc=3,vol=8192,parity=1,precision=4,order=4,Ns=4,Nc=3,Nxz=8,Nyw=1	192	1	1	56	1	1	0	1	0	0	0	1.5131e-05	# 415.80 Gflop/s, 329.17 GB/s, tuning took 0.011918 seconds at Wed Apr  2 17:25:03 2025
        4x8x8x32	N4quda4blas12TileSizeTuneINS0_9multiCdotES2_St7complexIdERKNS_10vector_refIKNS_16ColorSpinorFieldEEESA_SA_SA_EE	nested_policy,vol=8192,parity=1,precision=2,order=8,Ns=4,Nc=3,vol=8192,parity=1,precision=2,order=8,Ns=4,Nc=3,n=8,m=9,multi-blas-n=4,max_nyw_tile=8	32	1	1	1	1	1	0	8	9	0	0	0.000490144	# 0.00 Gflop/s, 0.00 GB/s, tuning took 0.025630 seconds at Wed Apr  2 17:24:57 2025
        4x8x8x32	N4quda4blas12TileSizeTuneINS0_9multiCdotES2_St7complexIdERKNS_10vector_refIKNS_16ColorSpinorFieldEEESA_SA_SA_EE	nested_policy,vol=8192,parity=1,precision=2,order=8,Ns=4,Nc=3,vol=8192,parity=1,precision=2,order=8,Ns=4,Nc=3,n=9,m=8,multi-blas-n=4,max_nyw_tile=8	32	1	1	1	1	1	0	8	8	0	0	0.000535211	# 0.00 Gflop/s, 0.00 GB/s, tuning took 0.022399 seconds at Wed Apr  2 17:25:03 2025
        4x8x8x32	N4quda4blas13TransposeTuneINS0_9multiCdotES2_St7complexIdERKNS_10vector_refIKNS_16ColorSpinorFieldEEESA_EE	policy,vol=8192,parity=1,precision=2,order=8,Ns=4,Nc=3,vol=8192,parity=1,precision=2,order=8,Ns=4,Nc=3,n=8,m=9,multi-blas-n=4,max_nyw_tile=8	32	1	1	1	1	1	0	0	0	0	0	0.0004912	# 0.00 Gflop/s, 0.00 GB/s, tuning took 0.007236 seconds at Wed Apr  2 17:25:03 2025
        4x8x8x32	N4quda4blas13cabxpyzaxnormIdfEE	GPU-offline,vol=8192,parity=1,precision=4,order=4,Ns=4,Nc=3,n_rhs=1	128	1	1	55	1	1	0	-1	-1	-1	-1	1.21912e-05	# 161.27 Gflop/s, 258.03 GB/s, tuning took 0.039031 seconds at Wed Apr  2 17:25:03 2025
        4x8x8x32	N4quda4blas15tripleCGUpdate_IfEE	GPU-offline,vol=8192,parity=1,precision=2,order=8,Ns=4,Nc=3,vol=8192,parity=1,precision=4,order=4,Ns=4,Nc=3,n_rhs=1	160	1	1	56	1	1	0	-1	-1	-1	-1	6.04864e-06	# 195.03 Gflop/s, 612.17 GB/s, tuning took 0.014770 seconds at Wed Apr  2 17:24:25 2025
        4x8x8x32	N4quda4blas18tripleCGReduction_IdfEE	GPU-offline,vol=8192,parity=1,precision=2,order=8,Ns=4,Nc=3,n_rhs=1	32	1	1	53	1	1	0	-1	-1	-1	-1	2.26909e-05	# 51.99 Gflop/s, 56.32 GB/s, tuning took 0.066262 seconds at Wed Apr  2 17:24:25 2025
        4x8x8x32	N4quda4blas23HeavyQuarkResidualNorm_IddEE	GPU-offline,vol=8192,parity=1,precision=8,order=2,Ns=4,Nc=3,n_rhs=1	128	1	1	36	1	1	0	-1	-1	-1	-1	1.97565e-05	# 39.81 Gflop/s, 159.22 GB/s, tuning took 0.052994 seconds at Wed Apr  2 17:25:03 2025
        4x8x8x32	N4quda4blas23HeavyQuarkResidualNorm_IdfEE	GPU-offline,vol=8192,parity=1,precision=4,order=4,Ns=4,Nc=3,n_rhs=1	64	1	1	50	1	1	0	-1	-1	-1	-1	1.92591e-05	# 40.83 Gflop/s, 81.67 GB/s, tuning took 0.056463 seconds at Wed Apr  2 17:24:25 2025
        4x8x8x32	N4quda4blas31caxpbypzYmbwcDotProductUYNormY_IddEE	GPU-offline,vol=8192,parity=1,precision=2,order=8,Ns=4,Nc=3,vol=8192,parity=1,precision=8,order=2,Ns=4,Nc=3,n_rhs=1	32	1	1	56	1	1	0	-1	-1	-1	-1	5.33625e-05	# 66.32 Gflop/s, 98.86 GB/s, tuning took 0.095744 seconds at Wed Apr  2 16:47:08 2025
        4x8x8x32	N4quda4blas4CdotIdfEE	GPU-offline,vol=8192,parity=1,precision=2,order=8,Ns=4,Nc=3,n_rhs=1	32	1	1	52	1	1	0	-1	-1	-1	-1	1.79828e-05	# 43.73 Gflop/s, 47.38 GB/s, tuning took 0.050912 seconds at Wed Apr  2 16:47:08 2025
        4x8x8x32	N4quda4blas4CdotIdfEE	GPU-offline,vol=8192,parity=1,precision=4,order=4,Ns=4,Nc=3,n_rhs=1	128	1	1	28	1	1	0	-1	-1	-1	-1	1.65211e-05	# 47.60 Gflop/s, 95.20 GB/s, tuning took 0.049740 seconds at Wed Apr  2 17:24:49 2025
        4x8x8x32	N4quda4blas5Norm2IddEE	GPU-offline,vol=8192,parity=1,precision=8,order=2,Ns=4,Nc=3,n_rhs=1	256	1	1	55	1	1	0	-1	-1	-1	-1	9.90269e-06	# 39.71 Gflop/s, 158.83 GB/s, tuning took 0.037028 seconds at Wed Apr  2 16:47:08 2025
        4x8x8x32	N4quda4blas5Norm2IdfEE	GPU-offline,vol=8192,parity=1,precision=4,order=4,Ns=4,Nc=3,n_rhs=1	256	1	1	28	1	1	0	-1	-1	-1	-1	1.17218e-05	# 33.55 Gflop/s, 67.09 GB/s, tuning took 0.046486 seconds at Wed Apr  2 17:24:24 2025
        4x8x8x32	N4quda4blas6caxpy_IfEE	GPU-offline,vol=8192,parity=1,precision=2,order=8,Ns=4,Nc=3,n_rhs=1	384	1	1	56	1	1	0	-1	-1	-1	-1	3.19321e-06	# 246.28 Gflop/s, 400.21 GB/s, tuning took 0.009031 seconds at Wed Apr  2 16:47:08 2025
        4x8x8x32	N4quda4blas6caxpy_IfEE	GPU-offline,vol=8192,parity=1,precision=4,order=4,Ns=4,Nc=3,n_rhs=1	672	1	1	56	1	1	0	-1	-1	-1	-1	3.46906e-06	# 226.70 Gflop/s, 680.10 GB/s, tuning took 0.009488 seconds at Wed Apr  2 17:25:03 2025
        4x8x8x32	N4quda4blas7axpbyz_IdEE	GPU-offline,vol=8192,parity=1,precision=8,order=2,Ns=4,Nc=3,n_rhs=1	768	1	1	56	1	1	0	-1	-1	-1	-1	1.23642e-05	# 47.70 Gflop/s, 381.63 GB/s, tuning took 0.011838 seconds at Wed Apr  2 16:47:08 2025
        4x8x8x32	N4quda4blas7axpbyz_IfEE	GPU-offline,vol=8192,parity=1,precision=2,order=8,Ns=4,Nc=3,n_rhs=1	192	1	1	56	1	1	0	-1	-1	-1	-1	3.23918e-06	# 182.09 Gflop/s, 394.53 GB/s, tuning took 0.009278 seconds at Wed Apr  2 17:24:25 2025
        4x8x8x32	N4quda4blas7axpbyz_IfEE	GPU-offline,vol=8192,parity=1,precision=4,order=4,Ns=4,Nc=3,n_rhs=1	608	1	1	56	1	1	0	-1	-1	-1	-1	3.55683e-06	# 165.83 Gflop/s, 663.31 GB/s, tuning took 0.009669 seconds at Wed Apr  2 17:24:25 2025
        4x8x8x32	N4quda4blas9axpyZpbx_IfEE	GPU-offline,vol=8192,parity=1,precision=2,order=8,Ns=4,Nc=3,vol=8192,parity=1,precision=4,order=4,Ns=4,Nc=3,n_rhs=1	320	1	1	56	1	1	0	-1	-1	-1	-1	4.45649e-06	# 176.47 Gflop/s, 639.70 GB/s, tuning took 0.010063 seconds at Wed Apr  2 17:24:25 2025
        4x8x8x32	N4quda4blas9cxpaypbz_IfEE	GPU-offline,vol=8192,parity=1,precision=2,order=8,Ns=4,Nc=3,n_rhs=1	160	1	1	56	1	1	0	-1	-1	-1	-1	3.84364e-06	# 460.36 Gflop/s, 443.31 GB/s, tuning took 0.009369 seconds at Wed Apr  2 16:47:08 2025
        4x8x8x32	N4quda4blas9multiCdotIdfEE	policy_kernel,GPU-offline,vol=8192,parity=1,precision=2,order=8,Ns=4,Nc=3,Nxz=1,Nyw=1,max_nyw_tile=8	32	1	1	54	1	1	0	-1	-1	-1	-1	1.68277e-05	# 46.73 Gflop/s, 50.63 GB/s, tuning took 0.049386 seconds at Wed Apr  2 17:24:50 2025
        4x8x8x32	N4quda4blas9multiCdotIdfEE	policy_kernel,GPU-offline,vol=8192,parity=1,precision=2,order=8,Ns=4,Nc=3,Nxz=1,Nyw=1,max_nyw_tile=8,norm	32	1	1	54	1	1	0	-1	-1	-1	-1	1.67413e-05	# 46.98 Gflop/s, 50.89 GB/s, tuning took 0.049514 seconds at Wed Apr  2 17:24:50 2025
        4x8x8x32	N4quda4blas9multiCdotIdfEE	policy_kernel,GPU-offline,vol=8192,parity=1,precision=2,order=8,Ns=4,Nc=3,Nxz=1,Nyw=2,max_nyw_tile=8	32	1	1	42	1	2	0	-1	-1	-1	-1	2.52752e-05	# 62.23 Gflop/s, 67.42 GB/s, tuning took 0.107221 seconds at Wed Apr  2 17:24:57 2025
        4x8x8x32	N4quda4blas9multiCdotIdfEE	policy_kernel,GPU-offline,vol=8192,parity=1,precision=2,order=8,Ns=4,Nc=3,Nxz=2,Nyw=1,max_nyw_tile=8	32	1	1	54	1	1	0	-1	-1	-1	-1	2.38149e-05	# 66.05 Gflop/s, 53.66 GB/s, tuning took 0.072180 seconds at Wed Apr  2 17:24:51 2025
        4x8x8x32	N4quda4blas9multiCdotIdfEE	policy_kernel,GPU-offline,vol=8192,parity=1,precision=2,order=8,Ns=4,Nc=3,Nxz=2,Nyw=2,max_nyw_tile=8	32	1	2	56	1	1	0	-1	-1	-1	-1	3.91877e-05	# 80.27 Gflop/s, 65.22 GB/s, tuning took 0.168471 seconds at Wed Apr  2 17:24:51 2025
        4x8x8x32	N4quda4blas9multiCdotIdfEE	policy_kernel,GPU-offline,vol=8192,parity=1,precision=2,order=8,Ns=4,Nc=3,Nxz=2,Nyw=2,max_nyw_tile=8,norm	32	1	1	42	1	2	0	-1	-1	-1	-1	3.91877e-05	# 80.27 Gflop/s, 65.22 GB/s, tuning took 0.168334 seconds at Wed Apr  2 17:24:50 2025
        4x8x8x32	N4quda4blas9multiCdotIdfEE	policy_kernel,GPU-offline,vol=8192,parity=1,precision=2,order=8,Ns=4,Nc=3,Nxz=2,Nyw=4,max_nyw_tile=8	32	1	1	35	1	4	0	-1	-1	-1	-1	6.90859e-05	# 91.07 Gflop/s, 73.99 GB/s, tuning took 0.450044 seconds at Wed Apr  2 17:24:58 2025
        4x8x8x32	N4quda4blas9multiCdotIdfEE	policy_kernel,GPU-offline,vol=8192,parity=1,precision=2,order=8,Ns=4,Nc=3,Nxz=2,Nyw=8,max_nyw_tile=8	32	1	1	21	1	8	0	-1	-1	-1	-1	0.000127376	# 98.79 Gflop/s, 80.26 GB/s, tuning took 1.216419 seconds at Wed Apr  2 17:25:01 2025
        4x8x8x32	N4quda4blas9multiCdotIdfEE	policy_kernel,GPU-offline,vol=8192,parity=1,precision=2,order=8,Ns=4,Nc=3,Nxz=3,Nyw=4,max_nyw_tile=8	32	1	1	21	1	4	0	-1	-1	-1	-1	9.48596e-05	# 99.49 Gflop/s, 71.85 GB/s, tuning took 0.504857 seconds at Wed Apr  2 17:24:58 2025
        4x8x8x32	N4quda4blas9multiCdotIdfEE	policy_kernel,GPU-offline,vol=8192,parity=1,precision=2,order=8,Ns=4,Nc=3,Nxz=3,Nyw=8,max_nyw_tile=8	32	1	1	21	1	8	0	-1	-1	-1	-1	0.000177493	# 106.34 Gflop/s, 76.80 GB/s, tuning took 1.455780 seconds at Wed Apr  2 17:25:03 2025
        4x8x8x32	N4quda4blas9multiCdotIdfEE	policy_kernel,GPU-offline,vol=8192,parity=1,precision=2,order=8,Ns=4,Nc=3,Nxz=4,Nyw=2,max_nyw_tile=8	32	1	1	42	1	2	0	-1	-1	-1	-1	6.88128e-05	# 91.43 Gflop/s, 61.90 GB/s, tuning took 0.233977 seconds at Wed Apr  2 17:24:52 2025
        4x8x8x32	N4quda4blas9multiCdotIdfEE	policy_kernel,GPU-offline,vol=8192,parity=1,precision=2,order=8,Ns=4,Nc=3,Nxz=4,Nyw=3,max_nyw_tile=8	32	1	1	37	1	3	0	-1	-1	-1	-1	9.33702e-05	# 101.07 Gflop/s, 68.43 GB/s, tuning took 0.435304 seconds at Wed Apr  2 17:24:53 2025
        4x8x8x32	N4quda4blas9multiCdotIdfEE	policy_kernel,GPU-offline,vol=8192,parity=1,precision=2,order=8,Ns=4,Nc=3,Nxz=4,Nyw=4,max_nyw_tile=8	32	1	1	21	1	4	0	-1	-1	-1	-1	0.000121401	# 103.65 Gflop/s, 70.18 GB/s, tuning took 0.646970 seconds at Wed Apr  2 17:24:52 2025
        4x8x8x32	N4quda4blas9multiCdotIdfEE	policy_kernel,GPU-offline,vol=8192,parity=1,precision=2,order=8,Ns=4,Nc=3,Nxz=4,Nyw=4,max_nyw_tile=8,norm	32	1	1	21	1	4	0	-1	-1	-1	-1	0.000118556	# 106.13 Gflop/s, 71.86 GB/s, tuning took 0.638634 seconds at Wed Apr  2 17:24:51 2025
        4x8x8x32	N4quda4blas9multiCdotIdfEE	policy_kernel,GPU-offline,vol=8192,parity=1,precision=2,order=8,Ns=4,Nc=3,Nxz=4,Nyw=8,max_nyw_tile=8	32	1	1	14	1	8	0	-1	-1	-1	-1	0.000229798	# 109.51 Gflop/s, 74.15 GB/s, tuning took 1.768605 seconds at Wed Apr  2 17:25:00 2025
        4x8x8x32	N4quda4blas9multiCdotIdfEE	policy_kernel,GPU-offline,vol=8192,parity=1,precision=2,order=8,Ns=4,Nc=3,Nxz=8,Nyw=4,max_nyw_tile=8	32	1	2	14	1	2	0	-1	-1	-1	-1	0.000229786	# 109.52 Gflop/s, 66.74 GB/s, tuning took 0.852841 seconds at Wed Apr  2 17:24:53 2025
        4x8x8x32	N4quda4blas9multiCdotIdfEE	policy_kernel,GPU-offline,vol=8192,parity=1,precision=2,order=8,Ns=4,Nc=3,Nxz=8,Nyw=5,max_nyw_tile=8	32	1	3	27	1	2	0	-1	-1	-1	-1	0.00028672	# 109.71 Gflop/s, 66.86 GB/s, tuning took 1.177163 seconds at Wed Apr  2 17:24:55 2025
        4x8x8x32	N4quda4blas9multiCdotIdfEE	policy_kernel,GPU-offline,vol=8192,parity=1,precision=2,order=8,Ns=4,Nc=3,Nxz=8,Nyw=9,max_nyw_tile=8	32	1	6	37	1	2	0	-1	-1	-1	-1	0.000490155	# 115.52 Gflop/s, 70.40 GB/s, tuning took 2.314576 seconds at Wed Apr  2 17:24:57 2025
        4x8x8x32	N4quda6CloverIdLi3EEE	GPU-offline,vol=8192,parity=1,precision=8,order=2,Ns=4,Nc=3,n_rhs=1	64	1	1	128	1	1	3781	-1	-1	-1	-1	7.86117e-05	# 52.52 Gflop/s, 86.70 GB/s, tuning took 0.043548 seconds at Wed Apr  2 16:47:08 2025
        4x8x8x32	N4quda6CloverIfLi3EEE	GPU-offline,vol=8192,parity=1,precision=4,order=4,Ns=4,Nc=3,n_rhs=1	64	1	1	128	1	1	3781	-1	-1	-1	-1	8.24714e-05	# 50.06 Gflop/s, 41.32 GB/s, tuning took 0.045757 seconds at Wed Apr  2 17:24:24 2025
        4x8x8x32	N4quda6CloverIsLi3EEE	GPU-offline,vol=8192,parity=1,precision=2,order=8,Ns=4,Nc=3,n_rhs=1	64	1	1	128	1	1	0	-1	-1	-1	-1	4.77483e-06	# 864.69 Gflop/s, 370.58 GB/s, tuning took 0.013019 seconds at Wed Apr  2 17:24:24 2025
        4x8x8x32	N4quda6WilsonINS_9WilsonArgIdLi3ELi4EL21QudaReconstructType_s12ELb0EEEEE	policy,GPU-offline,vol=8192,parity=1,precision=8,order=2,Ns=4,Nc=3,commDim=0000,xpay,n_rhs=1,n_rhs_tile=1,topo=1111,p2p=0,gdr=0,nvshmem=0,pol=110000000000000000	32	1	1	1	1	1	0	1	0	0	-1	0.000119108	# 94.09 Gflop/s, 158.47 GB/s, tuning took 0.003390 seconds at Wed Apr  2 16:47:08 2025
        4x8x8x32	N4quda6WilsonINS_9WilsonArgIdLi3ELi4EL21QudaReconstructType_s12ELb0EEEEE	policy_kernel=interior,GPU-offline,vol=8192,parity=1,precision=8,order=2,Ns=4,Nc=3,commDim=0000,xpay,n_rhs=1,n_rhs_tile=1,comm=0000	32	1	1	256	1	1	16897	-1	-1	-1	-1	0.000119353	# 93.90 Gflop/s, 158.14 GB/s, tuning took 0.247131 seconds at Wed Apr  2 16:47:08 2025
        4x8x8x32	N4quda6WilsonINS_9WilsonArgIfLi3ELi4EL21QudaReconstructType_s12ELb0EEEEE	policy,GPU-offline,vol=8192,parity=1,precision=4,order=4,Ns=4,Nc=3,commDim=0000,xpay,dagger,n_rhs=1,n_rhs_tile=1,topo=1111,p2p=0,gdr=0,nvshmem=0,pol=110000000000000000	32	1	1	1	1	1	0	1	0	0	-1	1.8944e-05	# 591.57 Gflop/s, 498.17 GB/s, tuning took 0.002205 seconds at Wed Apr  2 17:24:24 2025
        4x8x8x32	N4quda6WilsonINS_9WilsonArgIfLi3ELi4EL21QudaReconstructType_s12ELb0EEEEE	policy,GPU-offline,vol=8192,parity=1,precision=4,order=4,Ns=4,Nc=3,commDim=0000,xpay,n_rhs=1,n_rhs_tile=1,topo=1111,p2p=0,gdr=0,nvshmem=0,pol=110000000000000000	32	1	1	1	1	1	0	0	0	0	-1	1.89046e-05	# 592.80 Gflop/s, 499.21 GB/s, tuning took 0.002202 seconds at Wed Apr  2 17:24:24 2025
        4x8x8x32	N4quda6WilsonINS_9WilsonArgIfLi3ELi4EL21QudaReconstructType_s12ELb0EEEEE	policy_kernel=interior,GPU-offline,vol=8192,parity=1,precision=4,order=4,Ns=4,Nc=3,commDim=0000,xpay,dagger,n_rhs=1,n_rhs_tile=1,comm=0000	352	1	1	24	1	1	33793	-1	-1	-1	-1	1.89537e-05	# 591.27 Gflop/s, 497.91 GB/s, tuning took 0.030309 seconds at Wed Apr  2 17:24:24 2025
        4x8x8x32	N4quda6WilsonINS_9WilsonArgIfLi3ELi4EL21QudaReconstructType_s12ELb0EEEEE	policy_kernel=interior,GPU-offline,vol=8192,parity=1,precision=4,order=4,Ns=4,Nc=3,commDim=0000,xpay,n_rhs=1,n_rhs_tile=1,comm=0000	32	1	1	256	1	1	8449	-1	-1	-1	-1	1.88232e-05	# 595.36 Gflop/s, 501.36 GB/s, tuning took 0.160607 seconds at Wed Apr  2 17:24:24 2025
        4x8x8x32	N4quda6WilsonINS_9WilsonArgIsLi3ELi4EL21QudaReconstructType_s12ELb0EEEEE	policy,GPU-offline,vol=8192,parity=1,precision=2,order=8,Ns=4,Nc=3,commDim=0000,xpay,dagger,n_rhs=1,n_rhs_tile=1,topo=1111,p2p=0,gdr=0,nvshmem=0,pol=110000000000000000	32	1	1	1	1	1	0	1	0	0	-1	1.22745e-05	# 913.01 Gflop/s, 405.78 GB/s, tuning took 0.002082 seconds at Wed Apr  2 17:24:25 2025
        4x8x8x32	N4quda6WilsonINS_9WilsonArgIsLi3ELi4EL21QudaReconstructType_s12ELb0EEEEE	policy_kernel=interior,GPU-offline,vol=8192,parity=1,precision=2,order=8,Ns=4,Nc=3,commDim=0000,xpay,dagger,n_rhs=1,n_rhs_tile=1,comm=0000	160	1	1	52	1	1	14483	-1	-1	-1	-1	1.22755e-05	# 912.93 Gflop/s, 405.75 GB/s, tuning took 0.025756 seconds at Wed Apr  2 17:24:25 2025
4x8x8x32,2x2x2x8	N4quda14RestrictLaunchIffsLi4ELi3ELi2ELi24EEE	GPU-offline,vol=8192,parity=1,precision=4,order=4,Ns=4,Nc=3,vol=64,parity=2,precision=4,order=2,Ns=2,Nc=24,n_rhs=1,from_non_rel	64	1	3	64	1	2	0	10	-1	-1	-1	3.85182e-05	# 490.01 Gflop/s, 267.76 GB/s, tuning took 0.053340 seconds at Wed Apr  2 17:24:49 2025
           73728	N4quda15TransformReduceINS_7maximumIfEENS_7complexIfEEjNS_8abs_max_IffEENS_8identityEEE	,batch_size=2	512	1	1	37	1	2	0	-1	-1	-1	-1	7.37221e-06	# 0.00 Gflop/s, 160.01 GB/s, tuning took 0.027109 seconds at Wed Apr  2 17:24:42 2025
           73728	N4quda15TransformReduceINS_7maximumIfEENS_7complexIiEEjNS_8abs_max_IfiEENS_8identityEEE	,batch_size=2	256	1	1	45	1	2	0	-1	-1	-1	-1	7.62137e-06	# 0.00 Gflop/s, 154.78 GB/s, tuning took 0.029591 seconds at Wed Apr  2 17:24:35 2025
        8x8x8x32	N4quda10BlockOrthoIssLi4ELi2ELi3ELi2ELi24EEE	GPU-offline,vol=16384,parity=2,precision=2,order=8,Ns=4,Nc=72,nVec=24,block_size=4x4x4x4,n_block_ortho=1,mVec=4	256	1	1	64	1	2	0	1	-1	-1	-1	0.00245999	# 364.45 Gflop/s, 104.55 GB/s, tuning took 0.130889 seconds at Wed Apr  2 17:24:25 2025
        8x8x8x32	N4quda10CalculateYILb0EL19QudaFieldLocation_s2ENS_13CalculateYArgILb0EfsLi4ELi2ELi3ELi24ENS_5gauge10FieldOrderIfLi48ELi2EL21QudaGaugeFieldOrder_s2ELb1EsEENS4_IfLi48ELi2ELS5_2ELb1EiEENS4_IfLi3ELi1ELS5_2ELb1EfEENS_11colorspinor12FieldOrderCBIfLi4ELi3ELi24EL16QudaFieldOrder_s8EssLb0ELb0EEESC_SC_NS_6clover10FieldOrderIfLi3ELi4EL22QudaCloverFieldOrder_s4EEEEEEE	GPU-offline,vol=16384,parity=2,precision=2,order=8,Ns=4,Nc=72,nVec=24,comm=0000,computeAV,Dynamic,GPU-device	32	1	8	256	4	3	0	1	0	0	0	0.0033495	# 67.62 Gflop/s, 31.95 GB/s, tuning took 3.847105 seconds at Wed Apr  2 17:24:34 2025
        8x8x8x32	N4quda10CalculateYILb0EL19QudaFieldLocation_s2ENS_13CalculateYArgILb0EfsLi4ELi2ELi3ELi24ENS_5gauge10FieldOrderIfLi48ELi2EL21QudaGaugeFieldOrder_s2ELb1EsEENS4_IfLi48ELi2ELS5_2ELb1EiEENS4_IfLi3ELi1ELS5_2ELb1EfEENS_11colorspinor12FieldOrderCBIfLi4ELi3ELi24EL16QudaFieldOrder_s8EssLb0ELb0EEESC_SC_NS_6clover10FieldOrderIfLi3ELi4EL22QudaCloverFieldOrder_s4EEEEEEE	GPU-offline,vol=16384,parity=2,precision=2,order=8,Ns=4,Nc=72,nVec=24,comm=0000,computeAV,compute_max,Dynamic,GPU-device	32	1	8	256	4	3	0	1	0	0	0	0.00334743	# 67.66 Gflop/s, 37.63 GB/s, tuning took 3.845298 seconds at Wed Apr  2 17:24:30 2025
        8x8x8x32	N4quda10CalculateYILb0EL19QudaFieldLocation_s2ENS_13CalculateYArgILb0EfsLi4ELi2ELi3ELi24ENS_5gauge10FieldOrderIfLi48ELi2EL21QudaGaugeFieldOrder_s2ELb1EsEENS4_IfLi48ELi2ELS5_2ELb1EiEENS4_IfLi3ELi1ELS5_2ELb1EfEENS_11colorspinor12FieldOrderCBIfLi4ELi3ELi24EL16QudaFieldOrder_s8EssLb0ELb0EEESC_SC_NS_6clover10FieldOrderIfLi3ELi4EL22QudaCloverFieldOrder_s4EEEEEEE	GPU-offline,vol=16384,parity=2,precision=2,order=8,Ns=4,Nc=72,nVec=24,comm=0000,computeUV,compute_max,tile_size=3x2x1,dim=0,dir=back,nFace=1,GPU-device	32	1	12	256	2	1	0	1	1	1	1	6.4848e-05	# 1746.33 Gflop/s, 1020.72 GB/s, tuning took 0.129401 seconds at Wed Apr  2 17:24:38 2025
        8x8x8x32	N4quda10CalculateYILb0EL19QudaFieldLocation_s2ENS_13CalculateYArgILb0EfsLi4ELi2ELi3ELi24ENS_5gauge10FieldOrderIfLi48ELi2EL21QudaGaugeFieldOrder_s2ELb1EsEENS4_IfLi48ELi2ELS5_2ELb1EiEENS4_IfLi3ELi1ELS5_2ELb1EfEENS_11colorspinor12FieldOrderCBIfLi4ELi3ELi24EL16QudaFieldOrder_s8EssLb0ELb0EEESC_SC_NS_6clover10FieldOrderIfLi3ELi4EL22QudaCloverFieldOrder_s4EEEEEEE	GPU-offline,vol=16384,parity=2,precision=2,order=8,Ns=4,Nc=72,nVec=24,comm=0000,computeUV,compute_max,tile_size=3x2x1,dim=0,dir=fwd,nFace=1,GPU-device	32	1	6	256	2	2	0	1	0	0	0	6.74475e-05	# 1679.03 Gflop/s, 981.38 GB/s, tuning took 0.138782 seconds at Wed Apr  2 17:24:34 2025
        8x8x8x32	N4quda10CalculateYILb0EL19QudaFieldLocation_s2ENS_13CalculateYArgILb0EfsLi4ELi2ELi3ELi24ENS_5gauge10FieldOrderIfLi48ELi2EL21QudaGaugeFieldOrder_s2ELb1EsEENS4_IfLi48ELi2ELS5_2ELb1EiEENS4_IfLi3ELi1ELS5_2ELb1EfEENS_11colorspinor12FieldOrderCBIfLi4ELi3ELi24EL16QudaFieldOrder_s8EssLb0ELb0EEESC_SC_NS_6clover10FieldOrderIfLi3ELi4EL22QudaCloverFieldOrder_s4EEEEEEE	GPU-offline,vol=16384,parity=2,precision=2,order=8,Ns=4,Nc=72,nVec=24,comm=0000,computeUV,compute_max,tile_size=3x2x1,dim=1,dir=back,nFace=1,GPU-device	32	1	12	256	2	1	16385	1	1	1	1	6.5006e-05	# 1742.09 Gflop/s, 1018.23 GB/s, tuning took 0.129263 seconds at Wed Apr  2 17:24:39 2025
        8x8x8x32	N4quda10CalculateYILb0EL19QudaFieldLocation_s2ENS_13CalculateYArgILb0EfsLi4ELi2ELi3ELi24ENS_5gauge10FieldOrderIfLi48ELi2EL21QudaGaugeFieldOrder_s2ELb1EsEENS4_IfLi48ELi2ELS5_2ELb1EiEENS4_IfLi3ELi1ELS5_2ELb1EfEENS_11colorspinor12FieldOrderCBIfLi4ELi3ELi24EL16QudaFieldOrder_s8EssLb0ELb0EEESC_SC_NS_6clover10FieldOrderIfLi3ELi4EL22QudaCloverFieldOrder_s4EEEEEEE	GPU-offline,vol=16384,parity=2,precision=2,order=8,Ns=4,Nc=72,nVec=24,comm=0000,computeUV,compute_max,tile_size=3x2x1,dim=1,dir=fwd,nFace=1,GPU-device	32	1	6	256	2	2	0	1	1	1	1	6.75669e-05	# 1676.06 Gflop/s, 979.64 GB/s, tuning took 0.138673 seconds at Wed Apr  2 17:24:35 2025
        8x8x8x32	N4quda10CalculateYILb0EL19QudaFieldLocation_s2ENS_13CalculateYArgILb0EfsLi4ELi2ELi3ELi24ENS_5gauge10FieldOrderIfLi48ELi2EL21QudaGaugeFieldOrder_s2ELb1EsEENS4_IfLi48ELi2ELS5_2ELb1EiEENS4_IfLi3ELi1ELS5_2ELb1EfEENS_11colorspinor12FieldOrderCBIfLi4ELi3ELi24EL16QudaFieldOrder_s8EssLb0ELb0EEESC_SC_NS_6clover10FieldOrderIfLi3ELi4EL22QudaCloverFieldOrder_s4EEEEEEE	GPU-offline,vol=16384,parity=2,precision=2,order=8,Ns=4,Nc=72,nVec=24,comm=0000,computeUV,compute_max,tile_size=3x2x1,dim=2,dir=back,nFace=1,GPU-device	32	1	12	256	2	1	12289	1	1	1	1	6.4832e-05	# 1746.76 Gflop/s, 1020.97 GB/s, tuning took 0.128276 seconds at Wed Apr  2 17:24:40 2025
        8x8x8x32	N4quda10CalculateYILb0EL19QudaFieldLocation_s2ENS_13CalculateYArgILb0EfsLi4ELi2ELi3ELi24ENS_5gauge10FieldOrderIfLi48ELi2EL21QudaGaugeFieldOrder_s2ELb1EsEENS4_IfLi48ELi2ELS5_2ELb1EiEENS4_IfLi3ELi1ELS5_2ELb1EfEENS_11colorspinor12FieldOrderCBIfLi4ELi3ELi24EL16QudaFieldOrder_s8EssLb0ELb0EEESC_SC_NS_6clover10FieldOrderIfLi3ELi4EL22QudaCloverFieldOrder_s4EEEEEEE	GPU-offline,vol=16384,parity=2,precision=2,order=8,Ns=4,Nc=72,nVec=24,comm=0000,computeUV,compute_max,tile_size=3x2x1,dim=2,dir=fwd,nFace=1,GPU-device	32	1	6	256	2	2	0	1	1	1	1	6.72427e-05	# 1684.14 Gflop/s, 984.37 GB/s, tuning took 0.137793 seconds at Wed Apr  2 17:24:36 2025
        8x8x8x32	N4quda10CalculateYILb0EL19QudaFieldLocation_s2ENS_13CalculateYArgILb0EfsLi4ELi2ELi3ELi24ENS_5gauge10FieldOrderIfLi48ELi2EL21QudaGaugeFieldOrder_s2ELb1EsEENS4_IfLi48ELi2ELS5_2ELb1EiEENS4_IfLi3ELi1ELS5_2ELb1EfEENS_11colorspinor12FieldOrderCBIfLi4ELi3ELi24EL16QudaFieldOrder_s8EssLb0ELb0EEESC_SC_NS_6clover10FieldOrderIfLi3ELi4EL22QudaCloverFieldOrder_s4EEEEEEE	GPU-offline,vol=16384,parity=2,precision=2,order=8,Ns=4,Nc=72,nVec=24,comm=0000,computeUV,compute_max,tile_size=3x2x1,dim=3,dir=back,nFace=1,GPU-device	32	1	12	256	2	1	12289	1	1	1	1	6.5112e-05	# 1739.25 Gflop/s, 1016.58 GB/s, tuning took 0.128561 seconds at Wed Apr  2 17:24:41 2025
        8x8x8x32	N4quda10CalculateYILb0EL19QudaFieldLocation_s2ENS_13CalculateYArgILb0EfsLi4ELi2ELi3ELi24ENS_5gauge10FieldOrderIfLi48ELi2EL21QudaGaugeFieldOrder_s2ELb1EsEENS4_IfLi48ELi2ELS5_2ELb1EiEENS4_IfLi3ELi1ELS5_2ELb1EfEENS_11colorspinor12FieldOrderCBIfLi4ELi3ELi24EL16QudaFieldOrder_s8EssLb0ELb0EEESC_SC_NS_6clover10FieldOrderIfLi3ELi4EL22QudaCloverFieldOrder_s4EEEEEEE	GPU-offline,vol=16384,parity=2,precision=2,order=8,Ns=4,Nc=72,nVec=24,comm=0000,computeUV,compute_max,tile_size=3x2x1,dim=3,dir=fwd,nFace=1,GPU-device	32	1	6	256	2	2	0	1	1	1	1	6.75157e-05	# 1677.33 Gflop/s, 980.38 GB/s, tuning took 0.138015 seconds at Wed Apr  2 17:24:37 2025
        8x8x8x32	N4quda10CalculateYILb0EL19QudaFieldLocation_s2ENS_13CalculateYArgILb0EfsLi4ELi2ELi3ELi24ENS_5gauge10FieldOrderIfLi48ELi2EL21QudaGaugeFieldOrder_s2ELb1EsEENS4_IfLi48ELi2ELS5_2ELb1EiEENS4_IfLi3ELi1ELS5_2ELb1EfEENS_11colorspinor12FieldOrderCBIfLi4ELi3ELi24EL16QudaFieldOrder_s8EssLb0ELb0EEESC_SC_NS_6clover10FieldOrderIfLi3ELi4EL22QudaCloverFieldOrder_s4EEEEEEE	GPU-offline,vol=16384,parity=2,precision=2,order=8,Ns=4,Nc=72,nVec=24,comm=0000,computeUV,tile_size=3x2x1,dim=0,dir=back,nFace=1,GPU-device	32	1	12	256	2	1	16385	1	1	1	1	0.000125056	# 905.56 Gflop/s, 377.84 GB/s, tuning took 0.199961 seconds at Wed Apr  2 17:24:38 2025
        8x8x8x32	N4quda10CalculateYILb0EL19QudaFieldLocation_s2ENS_13CalculateYArgILb0EfsLi4ELi2ELi3ELi24ENS_5gauge10FieldOrderIfLi48ELi2EL21QudaGaugeFieldOrder_s2ELb1EsEENS4_IfLi48ELi2ELS5_2ELb1EiEENS4_IfLi3ELi1ELS5_2ELb1EfEENS_11colorspinor12FieldOrderCBIfLi4ELi3ELi24EL16QudaFieldOrder_s8EssLb0ELb0EEESC_SC_NS_6clover10FieldOrderIfLi3ELi4EL22QudaCloverFieldOrder_s4EEEEEEE	GPU-offline,vol=16384,parity=2,precision=2,order=8,Ns=4,Nc=72,nVec=24,comm=0000,computeUV,tile_size=3x2x1,dim=0,dir=fwd,nFace=1,GPU-device	32	1	12	256	2	1	12289	1	0	0	0	0.000125042	# 905.67 Gflop/s, 377.89 GB/s, tuning took 0.199744 seconds at Wed Apr  2 17:24:34 2025
        8x8x8x32	N4quda10CalculateYILb0EL19QudaFieldLocation_s2ENS_13CalculateYArgILb0EfsLi4ELi2ELi3ELi24ENS_5gauge10FieldOrderIfLi48ELi2EL21QudaGaugeFieldOrder_s2ELb1EsEENS4_IfLi48ELi2ELS5_2ELb1EiEENS4_IfLi3ELi1ELS5_2ELb1EfEENS_11colorspinor12FieldOrderCBIfLi4ELi3ELi24EL16QudaFieldOrder_s8EssLb0ELb0EEESC_SC_NS_6clover10FieldOrderIfLi3ELi4EL22QudaCloverFieldOrder_s4EEEEEEE	GPU-offline,vol=16384,parity=2,precision=2,order=8,Ns=4,Nc=72,nVec=24,comm=0000,computeUV,tile_size=3x2x1,dim=1,dir=back,nFace=1,GPU-device	32	1	12	256	2	1	16385	1	1	1	1	0.000124928	# 906.49 Gflop/s, 378.23 GB/s, tuning took 0.201830 seconds at Wed Apr  2 17:24:39 2025
        8x8x8x32	N4quda10CalculateYILb0EL19QudaFieldLocation_s2ENS_13CalculateYArgILb0EfsLi4ELi2ELi3ELi24ENS_5gauge10FieldOrderIfLi48ELi2EL21QudaGaugeFieldOrder_s2ELb1EsEENS4_IfLi48ELi2ELS5_2ELb1EiEENS4_IfLi3ELi1ELS5_2ELb1EfEENS_11colorspinor12FieldOrderCBIfLi4ELi3ELi24EL16QudaFieldOrder_s8EssLb0ELb0EEESC_SC_NS_6clover10FieldOrderIfLi3ELi4EL22QudaCloverFieldOrder_s4EEEEEEE	GPU-offline,vol=16384,parity=2,precision=2,order=8,Ns=4,Nc=72,nVec=24,comm=0000,computeUV,tile_size=3x2x1,dim=1,dir=fwd,nFace=1,GPU-device	32	1	12	256	2	1	0	1	1	1	1	0.000125042	# 905.67 Gflop/s, 377.89 GB/s, tuning took 0.200216 seconds at Wed Apr  2 17:24:35 2025
        8x8x8x32	N4quda10CalculateYILb0EL19QudaFieldLocation_s2ENS_13CalculateYArgILb0EfsLi4ELi2ELi3ELi24ENS_5gauge10FieldOrderIfLi48ELi2EL21QudaGaugeFieldOrder_s2ELb1EsEENS4_IfLi48ELi2ELS5_2ELb1EiEENS4_IfLi3ELi1ELS5_2ELb1EfEENS_11colorspinor12FieldOrderCBIfLi4ELi3ELi24EL16QudaFieldOrder_s8EssLb0ELb0EEESC_SC_NS_6clover10FieldOrderIfLi3ELi4EL22QudaCloverFieldOrder_s4EEEEEEE	GPU-offline,vol=16384,parity=2,precision=2,order=8,Ns=4,Nc=72,nVec=24,comm=0000,computeUV,tile_size=3x2x1,dim=2,dir=back,nFace=1,GPU-device	32	1	12	256	2	1	0	1	1	1	1	0.0001248	# 907.42 Gflop/s, 378.62 GB/s, tuning took 0.200319 seconds at Wed Apr  2 17:24:40 2025
        8x8x8x32	N4quda10CalculateYILb0EL19QudaFieldLocation_s2ENS_13CalculateYArgILb0EfsLi4ELi2ELi3ELi24ENS_5gauge10FieldOrderIfLi48ELi2EL21QudaGaugeFieldOrder_s2ELb1EsEENS4_IfLi48ELi2ELS5_2ELb1EiEENS4_IfLi3ELi1ELS5_2ELb1EfEENS_11colorspinor12FieldOrderCBIfLi4ELi3ELi24EL16QudaFieldOrder_s8EssLb0ELb0EEESC_SC_NS_6clover10FieldOrderIfLi3ELi4EL22QudaCloverFieldOrder_s4EEEEEEE	GPU-offline,vol=16384,parity=2,precision=2,order=8,Ns=4,Nc=72,nVec=24,comm=0000,computeUV,tile_size=3x2x1,dim=2,dir=fwd,nFace=1,GPU-device	32	1	12	256	2	1	24577	1	1	1	1	0.000124796	# 907.45 Gflop/s, 378.63 GB/s, tuning took 0.199808 seconds at Wed Apr  2 17:24:36 2025
        8x8x8x32	N4quda10CalculateYILb0EL19QudaFieldLocation_s2ENS_13CalculateYArgILb0EfsLi4ELi2ELi3ELi24ENS_5gauge10FieldOrderIfLi48ELi2EL21QudaGaugeFieldOrder_s2ELb1EsEENS4_IfLi48ELi2ELS5_2ELb1EiEENS4_IfLi3ELi1ELS5_2ELb1EfEENS_11colorspinor12FieldOrderCBIfLi4ELi3ELi24EL16QudaFieldOrder_s8EssLb0ELb0EEESC_SC_NS_6clover10FieldOrderIfLi3ELi4EL22QudaCloverFieldOrder_s4EEEEEEE	GPU-offline,vol=16384,parity=2,precision=2,order=8,Ns=4,Nc=72,nVec=24,comm=0000,computeUV,tile_size=3x2x1,dim=3,dir=back,nFace=1,GPU-device	32	1	12	256	2	1	0	1	1	1	1	0.000124948	# 906.35 Gflop/s, 378.17 GB/s, tuning took 0.200179 seconds at Wed Apr  2 17:24:41 2025
        8x8x8x32	N4quda10CalculateYILb0EL19QudaFieldLocation_s2ENS_13CalculateYArgILb0EfsLi4ELi2ELi3ELi24ENS_5gauge10FieldOrderIfLi48ELi2EL21QudaGaugeFieldOrder_s2ELb1EsEENS4_IfLi48ELi2ELS5_2ELb1EiEENS4_IfLi3ELi1ELS5_2ELb1EfEENS_11colorspinor12FieldOrderCBIfLi4ELi3ELi24EL16QudaFieldOrder_s8EssLb0ELb0EEESC_SC_NS_6clover10FieldOrderIfLi3ELi4EL22QudaCloverFieldOrder_s4EEEEEEE	GPU-offline,vol=16384,parity=2,precision=2,order=8,Ns=4,Nc=72,nVec=24,comm=0000,computeUV,tile_size=3x2x1,dim=3,dir=fwd,nFace=1,GPU-device	32	1	12	256	2	1	24577	1	1	1	1	0.000124814	# 907.32 Gflop/s, 378.57 GB/s, tuning took 0.199796 seconds at Wed Apr  2 17:24:37 2025
        8x8x8x32	N4quda10CalculateYILb0EL19QudaFieldLocation_s2ENS_13CalculateYArgILb0EfsLi4ELi2ELi3ELi24ENS_5gauge10FieldOrderIfLi48ELi2EL21QudaGaugeFieldOrder_s2ELb1EsEENS4_IfLi48ELi2ELS5_2ELb1EiEENS4_IfLi3ELi1ELS5_2ELb1EfEENS_11colorspinor12FieldOrderCBIfLi4ELi3ELi24EL16QudaFieldOrder_s8EssLb0ELb0EEESC_SC_NS_6clover10FieldOrderIfLi3ELi4EL22QudaCloverFieldOrder_s4EEEEEEE	GPU-offline,vol=16384,parity=2,precision=2,order=8,Ns=4,Nc=72,nVec=24,comm=0000,computeVUV,tile_size=4x2x1,dim=0,dir=back,nFace=1,bidirectional,GPU-device,coarse_vol=2x2x2x8	128	1	1	64	2	4	16385	4	1	1	0	0.00126191	# 1435.87 Gflop/s, 724.17 GB/s, tuning took 0.663023 seconds at Wed Apr  2 17:24:39 2025
        8x8x8x32	N4quda10CalculateYILb0EL19QudaFieldLocation_s2ENS_13CalculateYArgILb0EfsLi4ELi2ELi3ELi24ENS_5gauge10FieldOrderIfLi48ELi2EL21QudaGaugeFieldOrder_s2ELb1EsEENS4_IfLi48ELi2ELS5_2ELb1EiEENS4_IfLi3ELi1ELS5_2ELb1EfEENS_11colorspinor12FieldOrderCBIfLi4ELi3ELi24EL16QudaFieldOrder_s8EssLb0ELb0EEESC_SC_NS_6clover10FieldOrderIfLi3ELi4EL22QudaCloverFieldOrder_s4EEEEEEE	GPU-offline,vol=16384,parity=2,precision=2,order=8,Ns=4,Nc=72,nVec=24,comm=0000,computeVUV,tile_size=4x2x1,dim=0,dir=fwd,nFace=1,bidirectional,GPU-device,coarse_vol=2x2x2x8	128	1	1	64	2	4	24577	4	1	1	0	0.00126678	# 1430.35 Gflop/s, 721.38 GB/s, tuning took 0.653378 seconds at Wed Apr  2 17:24:35 2025
        8x8x8x32	N4quda10CalculateYILb0EL19QudaFieldLocation_s2ENS_13CalculateYArgILb0EfsLi4ELi2ELi3ELi24ENS_5gauge10FieldOrderIfLi48ELi2EL21QudaGaugeFieldOrder_s2ELb1EsEENS4_IfLi48ELi2ELS5_2ELb1EiEENS4_IfLi3ELi1ELS5_2ELb1EfEENS_11colorspinor12FieldOrderCBIfLi4ELi3ELi24EL16QudaFieldOrder_s8EssLb0ELb0EEESC_SC_NS_6clover10FieldOrderIfLi3ELi4EL22QudaCloverFieldOrder_s4EEEEEEE	GPU-offline,vol=16384,parity=2,precision=2,order=8,Ns=4,Nc=72,nVec=24,comm=0000,computeVUV,tile_size=4x2x1,dim=1,dir=back,nFace=1,bidirectional,GPU-device,coarse_vol=2x2x2x8	128	1	1	64	2	4	24577	4	1	1	0	0.00127044	# 1426.23 Gflop/s, 719.30 GB/s, tuning took 0.665798 seconds at Wed Apr  2 17:24:40 2025
        8x8x8x32	N4quda10CalculateYILb0EL19QudaFieldLocation_s2ENS_13CalculateYArgILb0EfsLi4ELi2ELi3ELi24ENS_5gauge10FieldOrderIfLi48ELi2EL21QudaGaugeFieldOrder_s2ELb1EsEENS4_IfLi48ELi2ELS5_2ELb1EiEENS4_IfLi3ELi1ELS5_2ELb1EfEENS_11colorspinor12FieldOrderCBIfLi4ELi3ELi24EL16QudaFieldOrder_s8EssLb0ELb0EEESC_SC_NS_6clover10FieldOrderIfLi3ELi4EL22QudaCloverFieldOrder_s4EEEEEEE	GPU-offline,vol=16384,parity=2,precision=2,order=8,Ns=4,Nc=72,nVec=24,comm=0000,computeVUV,tile_size=4x2x1,dim=1,dir=fwd,nFace=1,bidirectional,GPU-device,coarse_vol=2x2x2x8	128	1	1	64	2	4	24577	4	1	1	0	0.00127249	# 1423.93 Gflop/s, 718.15 GB/s, tuning took 0.650569 seconds at Wed Apr  2 17:24:36 2025
        8x8x8x32	N4quda10CalculateYILb0EL19QudaFieldLocation_s2ENS_13CalculateYArgILb0EfsLi4ELi2ELi3ELi24ENS_5gauge10FieldOrderIfLi48ELi2EL21QudaGaugeFieldOrder_s2ELb1EsEENS4_IfLi48ELi2ELS5_2ELb1EiEENS4_IfLi3ELi1ELS5_2ELb1EfEENS_11colorspinor12FieldOrderCBIfLi4ELi3ELi24EL16QudaFieldOrder_s8EssLb0ELb0EEESC_SC_NS_6clover10FieldOrderIfLi3ELi4EL22QudaCloverFieldOrder_s4EEEEEEE	GPU-offline,vol=16384,parity=2,precision=2,order=8,Ns=4,Nc=72,nVec=24,comm=0000,computeVUV,tile_size=4x2x1,dim=2,dir=back,nFace=1,bidirectional,GPU-device,coarse_vol=2x2x2x8	128	1	1	64	2	4	24577	4	1	1	0	0.00112469	# 1611.05 Gflop/s, 812.52 GB/s, tuning took 0.651116 seconds at Wed Apr  2 17:24:41 2025
        8x8x8x32	N4quda10CalculateYILb0EL19QudaFieldLocation_s2ENS_13CalculateYArgILb0EfsLi4ELi2ELi3ELi24ENS_5gauge10FieldOrderIfLi48ELi2EL21QudaGaugeFieldOrder_s2ELb1EsEENS4_IfLi48ELi2ELS5_2ELb1EiEENS4_IfLi3ELi1ELS5_2ELb1EfEENS_11colorspinor12FieldOrderCBIfLi4ELi3ELi24EL16QudaFieldOrder_s8EssLb0ELb0EEESC_SC_NS_6clover10FieldOrderIfLi3ELi4EL22QudaCloverFieldOrder_s4EEEEEEE	GPU-offline,vol=16384,parity=2,precision=2,order=8,Ns=4,Nc=72,nVec=24,comm=0000,computeVUV,tile_size=4x2x1,dim=2,dir=fwd,nFace=1,bidirectional,GPU-device,coarse_vol=2x2x2x8	128	1	1	64	2	4	16385	4	1	1	0	0.0012762	# 1419.79 Gflop/s, 716.06 GB/s, tuning took 0.665253 seconds at Wed Apr  2 17:24:37 2025
        8x8x8x32	N4quda10CalculateYILb0EL19QudaFieldLocation_s2ENS_13CalculateYArgILb0EfsLi4ELi2ELi3ELi24ENS_5gauge10FieldOrderIfLi48ELi2EL21QudaGaugeFieldOrder_s2ELb1EsEENS4_IfLi48ELi2ELS5_2ELb1EiEENS4_IfLi3ELi1ELS5_2ELb1EfEENS_11colorspinor12FieldOrderCBIfLi4ELi3ELi24EL16QudaFieldOrder_s8EssLb0ELb0EEESC_SC_NS_6clover10FieldOrderIfLi3ELi4EL22QudaCloverFieldOrder_s4EEEEEEE	GPU-offline,vol=16384,parity=2,precision=2,order=8,Ns=4,Nc=72,nVec=24,comm=0000,computeVUV,tile_size=4x2x1,dim=3,dir=back,nFace=1,bidirectional,GPU-device,coarse_vol=2x2x2x8	128	1	1	64	2	4	24577	4	1	1	0	0.00128649	# 1408.44 Gflop/s, 710.33 GB/s, tuning took 0.680089 seconds at Wed Apr  2 17:24:42 2025
        8x8x8x32	N4quda10CalculateYILb0EL19QudaFieldLocation_s2ENS_13CalculateYArgILb0EfsLi4ELi2ELi3ELi24ENS_5gauge10FieldOrderIfLi48ELi2EL21QudaGaugeFieldOrder_s2ELb1EsEENS4_IfLi48ELi2ELS5_2ELb1EiEENS4_IfLi3ELi1ELS5_2ELb1EfEENS_11colorspinor12FieldOrderCBIfLi4ELi3ELi24EL16QudaFieldOrder_s8EssLb0ELb0EEESC_SC_NS_6clover10FieldOrderIfLi3ELi4EL22QudaCloverFieldOrder_s4EEEEEEE	GPU-offline,vol=16384,parity=2,precision=2,order=8,Ns=4,Nc=72,nVec=24,comm=0000,computeVUV,tile_size=4x2x1,dim=3,dir=fwd,nFace=1,bidirectional,GPU-device,coarse_vol=2x2x2x8	128	1	1	64	2	4	16384	4	1	1	0	0.00128341	# 1411.81 Gflop/s, 712.03 GB/s, tuning took 0.670885 seconds at Wed Apr  2 17:24:38 2025
        8x8x8x32	N4quda10CopyCloverINS_6clover11FloatNOrderIfLi72ELi4ELb0ELb1ELb0EEENS2_IdLi72ELi2ELb0ELb1ELb0EEEfdEE	GPU-offline,vol=16384precision=8Nc=3	32	2	1	256	1	1	3511	-1	-1	-1	-1	3.71058e-05	# 0.00 Gflop/s, 296.72 GB/s, tuning took 0.034689 seconds at Wed Apr  2 16:47:07 2025
        8x8x8x32	N4quda10CopyCloverINS_6clover11FloatNOrderIsLi72ELi8ELb0ELb1ELb0EEENS2_IdLi72ELi2ELb0ELb1ELb0EEEsdEE	GPU-offline,vol=16384precision=8Nc=3	64	1	1	128	2	1	3781	-1	-1	-1	-1	3.29992e-05	# 0.00 Gflop/s, 278.04 GB/s, tuning took 0.039786 seconds at Wed Apr  2 16:47:07 2025
        8x8x8x32	N4quda10ForceGaugeIdLi3EL21QudaReconstructType_s18ELb0EEE	GPU-offline,vol=16384,stride=8192,precision=8,geometry=4,Nc=3,r=0000,num_paths=4,comm=0000	32	1	2	256	2	2	3073	-1	-1	-1	-1	0.00148958	# 148.09 Gflop/s, 145.72 GB/s, tuning took 1.533428 seconds at Fri Apr  4 16:42:38 2025
        8x8x8x32	N4quda10GaugeSTOUTIdLi3EL21QudaReconstructType_s18EEE	GPU-offline,vol=16384,stride=8192,precision=8,geometry=4,Nc=3,r=0000,dir_ignore=4,comm=0000	32	2	1	256	1	4	7799	-1	-1	-1	-1	0.00144111	# 126.06 Gflop/s, 130.97 GB/s, tuning took 1.202226 seconds at Wed Apr  2 17:20:37 2025
        8x8x8x32	N4quda11CopyGaugeExIddLi18ENS_5gauge11FloatNOrderIdLi18ELi2ELi12EL20QudaStaggeredPhase_s0ELb1EL19QudaGhostExchange_sn2147483648ELb0EEES5_EE	GPU-offline,vol=16384,stride=9216,precision=8,geometry=4,Nc=3vol=16384,stride=8192,precision=8,geometry=4,Nc=3,r=0000	352	2	1	24	1	1	0	-1	-1	-1	-1	4.09907e-05	# 0.00 Gflop/s, 326.16 GB/s, tuning took 0.074564 seconds at Wed Apr  2 16:47:01 2025
        8x8x8x32	N4quda11CopyGaugeExIddLi18ENS_5gauge11FloatNOrderIdLi18ELi2ELi18EL20QudaStaggeredPhase_s0ELb1EL19QudaGhostExchange_sn2147483648ELb0EEES5_EE	GPU-offline,vol=16384,stride=8192,precision=8,geometry=4,Nc=3,r=0000vol=16384,stride=8192,precision=8,geometry=4,Nc=3,r=0000	320	2	1	26	1	1	0	-1	-1	-1	-1	5.91511e-05	# 0.00 Gflop/s, 319.09 GB/s, tuning took 0.020063 seconds at Wed Apr  2 17:20:36 2025
        8x8x8x32	N4quda11CopyGaugeExIddLi18ENS_5gauge11FloatNOrderIdLi18ELi2ELi18EL20QudaStaggeredPhase_s0ELb1EL19QudaGhostExchange_sn2147483648ELb0EEES5_EE	GPU-offline,vol=16384,stride=8192,precision=8,geometry=4,Nc=3,r=0000vol=16384,stride=9216,precision=8,geometry=4,Nc=3	640	1	1	13	2	1	0	-1	-1	-1	-1	5.95332e-05	# 0.00 Gflop/s, 336.85 GB/s, tuning took 0.021380 seconds at Wed Apr  2 17:20:37 2025
        8x8x8x32	N4quda11CopyGaugeExIddLi18ENS_5gauge11FloatNOrderIdLi18ELi2ELi18EL20QudaStaggeredPhase_s0ELb1EL19QudaGhostExchange_sn2147483648ELb0EEES5_EE	GPU-offline,vol=16384,stride=8192,precision=8,geometry=4,Nc=3vol=16384,stride=8192,precision=8,geometry=4,Nc=3,r=0000	640	1	1	13	2	1	0	-1	-1	-1	-1	5.94522e-05	# 0.00 Gflop/s, 317.47 GB/s, tuning took 0.071298 seconds at Fri Apr  4 16:42:36 2025
        8x8x8x32	N4quda11CopyGaugeExIddLi18ENS_5gauge11FloatNOrderIdLi18ELi2ELi18EL20QudaStaggeredPhase_s0ELb1EL19QudaGhostExchange_sn2147483648ELb0EEES5_EE	GPU-offline,vol=16384,stride=9216,precision=8,geometry=4,Nc=3vol=16384,stride=8192,precision=8,geometry=4,Nc=3,r=0000	640	1	1	13	2	1	0	-1	-1	-1	-1	5.93939e-05	# 0.00 Gflop/s, 337.64 GB/s, tuning took 0.092161 seconds at Wed Apr  2 17:20:36 2025
        8x8x8x32	N4quda11SpinorNoiseIfLi4ELi3EEE	GPU-offline,vol=16384,parity=2,precision=4,order=4,Ns=4,Nc=3,uniform	608	1	1	14	2	1	0	-1	-1	-1	-1	2.0066e-05	# 0.00 Gflop/s, 78.38 GB/s, tuning took 0.029352 seconds at Wed Apr  2 17:24:24 2025
        8x8x8x32	N4quda12CloverInvertIdEE	GPU-offline,vol=16384precision=8Nc=3,trlog,twist=false	32	2	1	56	1	1	0	-1	-1	-1	-1	0.000181045	# 0.00 Gflop/s, 40.54 GB/s, tuning took 4.335494 seconds at Wed Apr  2 16:47:07 2025
        8x8x8x32	N4quda12ExtractGhostIdLi3ENS_5gauge11FloatNOrderIdLi18ELi2ELi12EL20QudaStaggeredPhase_s0ELb1EL19QudaGhostExchange_sn2147483648ELb0EEEEE	GPU-offline,vol=16384,stride=9216,precision=8,geometry=4,Nc=3,extract	32	1	3	64	1	3	0	-1	-1	-1	-1	5.23362e-06	# 0.00 Gflop/s, 244.18 GB/s, tuning took 0.022519 seconds at Wed Apr  2 16:47:01 2025
        8x8x8x32	N4quda12ExtractGhostIdLi3ENS_5gauge11FloatNOrderIdLi18ELi2ELi18EL20QudaStaggeredPhase_s0ELb1EL19QudaGhostExchange_sn2147483648ELb0EEEEE	GPU-offline,vol=16384,stride=9216,precision=8,geometry=4,Nc=3,extract	256	1	3	8	1	3	0	-1	-1	-1	-1	7.8668e-06	# 0.00 Gflop/s, 243.67 GB/s, tuning took 0.027385 seconds at Wed Apr  2 17:20:36 2025
        8x8x8x32	N4quda12WilsonCloverINS_15WilsonCloverArgIfLi3ELi4EL21QudaReconstructType_s12ELb0ELb0EEEEE	policy,GPU-offline,vol=16384,parity=2,precision=4,order=4,Ns=4,Nc=3,commDim=0000,xpay,dagger,n_rhs=1,n_rhs_tile=1,topo=1111,p2p=0,gdr=0,nvshmem=0,pol=110000000000000000	32	1	1	1	1	1	0	0	0	0	-1	3.82031e-05	# 823.42 Gflop/s, 590.12 GB/s, tuning took 0.002412 seconds at Wed Apr  2 17:24:49 2025
        8x8x8x32	N4quda12WilsonCloverINS_15WilsonCloverArgIfLi3ELi4EL21QudaReconstructType_s12ELb0ELb0EEEEE	policy,GPU-offline,vol=16384,parity=2,precision=4,order=4,Ns=4,Nc=3,commDim=0000,xpay,n_rhs=1,n_rhs_tile=1,topo=1111,p2p=0,gdr=0,nvshmem=0,pol=110000000000000000	32	1	1	1	1	1	0	1	0	0	-1	3.82818e-05	# 821.73 Gflop/s, 588.91 GB/s, tuning took 0.002421 seconds at Wed Apr  2 17:24:49 2025
        8x8x8x32	N4quda12WilsonCloverINS_15WilsonCloverArgIfLi3ELi4EL21QudaReconstructType_s12ELb0ELb0EEEEE	policy_kernel=interior,GPU-offline,vol=16384,parity=2,precision=4,order=4,Ns=4,Nc=3,commDim=0000,xpay,dagger,n_rhs=1,n_rhs_tile=1,comm=0000	32	1	2	256	1	1	16897	-1	-1	-1	-1	3.81156e-05	# 825.31 Gflop/s, 591.48 GB/s, tuning took 0.075562 seconds at Wed Apr  2 17:24:49 2025
        8x8x8x32	N4quda12WilsonCloverINS_15WilsonCloverArgIfLi3ELi4EL21QudaReconstructType_s12ELb0ELb0EEEEE	policy_kernel=interior,GPU-offline,vol=16384,parity=2,precision=4,order=4,Ns=4,Nc=3,commDim=0000,xpay,n_rhs=1,n_rhs_tile=1,comm=0000	160	1	2	52	1	1	50689	-1	-1	-1	-1	3.8419e-05	# 818.80 Gflop/s, 586.81 GB/s, tuning took 0.139963 seconds at Wed Apr  2 17:24:49 2025
        8x8x8x32	N4quda13ComputeCloverIdEE	GPU-offline,vol=16384precision=8Nc=3	32	1	1	256	2	1	0	-1	-1	-1	-1	7.41669e-05	# 106.04 Gflop/s, 289.83 GB/s, tuning took 0.017811 seconds at Wed Apr  2 16:47:03 2025
        8x8x8x32	N4quda15CopyColorSpinorILi4ELi3ENS_11colorspinor11FloatNOrderIdLi4ELi3ELi2ELb0ELb0ELb0EEENS1_21SpaceSpinorColorOrderIdLi4ELi3EEESt5tupleIJRNS_16ColorSpinorFieldERKS7_19QudaFieldLocation_sPdPKdEEEE	GPU-offline,vol=16384,parity=2,precision=8,order=9,Ns=4,Nc=3vol=16384,parity=2,precision=8,order=2,Ns=4,Nc=3to_ukqcd,from_degrand_rossi	32	1	1	256	2	1	0	-1	-1	-1	-1	2.0716e-05	# 0.00 Gflop/s, 303.70 GB/s, tuning took 0.019729 seconds at Wed Apr  2 16:47:07 2025
        8x8x8x32	N4quda15CopyColorSpinorILi4ELi3ENS_11colorspinor11FloatNOrderIfLi4ELi3ELi4ELb0ELb0ELb0EEENS2_IsLi4ELi3ELi8ELb0ELb0ELb0EEESt5tupleIJRNS_16ColorSpinorFieldERKS6_19QudaFieldLocation_sPfPKsEEEE	GPU-offline,vol=16384,parity=2,precision=2,order=8,Ns=4,Nc=3vol=16384,parity=2,precision=4,order=4,Ns=4,Nc=3to_ukqcd,from_degrand_rossi	64	1	1	128	2	1	0	-1	-1	-1	-1	4.00675e-06	# 0.00 Gflop/s, 605.19 GB/s, tuning took 0.014290 seconds at Wed Apr  2 17:24:24 2025
        8x8x8x32	N4quda15CopyColorSpinorILi4ELi3ENS_11colorspinor11FloatNOrderIsLi4ELi3ELi8ELb0ELb0ELb0EEENS2_IfLi4ELi3ELi4ELb0ELb0ELb0EEESt5tupleIJRNS_16ColorSpinorFieldERKS6_19QudaFieldLocation_sPsPKfEEEE	GPU-offline,vol=16384,parity=2,precision=4,order=4,Ns=4,Nc=3vol=16384,parity=2,precision=2,order=8,Ns=4,Nc=3	64	1	1	128	2	1	0	-1	-1	-1	-1	3.63756e-06	# 0.00 Gflop/s, 666.61 GB/s, tuning took 0.014098 seconds at Wed Apr  2 17:24:24 2025
        8x8x8x32	N4quda15CopyColorSpinorILi4ELi3ENS_11colorspinor11FloatNOrderIsLi4ELi3ELi8ELb0ELb0ELb0EEENS2_IfLi4ELi3ELi4ELb0ELb0ELb0EEESt5tupleIJRNS_16ColorSpinorFieldERKS6_19QudaFieldLocation_sPsPKfEEEE	GPU-offline,vol=16384,parity=2,precision=4,order=4,Ns=4,Nc=3vol=16384,parity=2,precision=2,order=8,Ns=4,Nc=3to_degrand_rossi,from_ukqcd	288	1	1	29	2	1	0	-1	-1	-1	-1	3.60281e-06	# 0.00 Gflop/s, 673.04 GB/s, tuning took 0.010692 seconds at Wed Apr  2 17:24:25 2025
        8x8x8x32	N4quda15CopyColorSpinorILi4ELi3ENS_11colorspinor21SpaceSpinorColorOrderIdLi4ELi3EEENS1_11FloatNOrderIdLi4ELi3ELi2ELb0ELb0ELb0EEESt5tupleIJRNS_16ColorSpinorFieldERKS7_19QudaFieldLocation_sPdPKdEEEE	GPU-offline,vol=16384,parity=2,precision=8,order=2,Ns=4,Nc=3vol=16384,parity=2,precision=8,order=9,Ns=4,Nc=3to_degrand_rossi,from_ukqcd	64	1	1	128	2	1	0	-1	-1	-1	-1	2.03559e-05	# 0.00 Gflop/s, 309.07 GB/s, tuning took 0.013808 seconds at Wed Apr  2 16:47:09 2025
        8x8x8x32	N4quda4blas10caxpyNorm2IdfEE	GPU-offline,vol=16384,parity=2,precision=2,order=8,Ns=4,Nc=3,vol=16384,parity=2,precision=4,order=4,Ns=4,Nc=3,n_rhs=24	32	1	1	7	1	24	0	-1	-1	-1	-1	0.000299264	# 252.28 Gflop/s, 320.60 GB/s, tuning took 0.281689 seconds at Wed Apr  2 17:24:49 2025
        8x8x8x32	N4quda4blas12MaxDeviationIdfEE	GPU-offline,vol=16384,parity=2,precision=2,order=8,Ns=4,Nc=3,vol=16384,parity=2,precision=4,order=4,Ns=4,Nc=3,n_rhs=24	32	1	1	14	1	24	0	-1	-1	-1	-1	0.000312288	# 0.00 Gflop/s, 186.35 GB/s, tuning took 0.369044 seconds at Wed Apr  2 17:24:48 2025
        8x8x8x32	N4quda4blas4CdotIdfEE	GPU-offline,vol=16384,parity=2,precision=2,order=8,Ns=4,Nc=3,n_rhs=1	64	1	1	56	1	1	0	-1	-1	-1	-1	2.67373e-05	# 58.83 Gflop/s, 63.73 GB/s, tuning took 0.073699 seconds at Wed Apr  2 17:24:25 2025
        8x8x8x32	N4quda4blas4CdotIdfEE	GPU-offline,vol=16384,parity=2,precision=4,order=4,Ns=4,Nc=3,n_rhs=1	128	1	1	56	1	1	0	-1	-1	-1	-1	2.64396e-05	# 59.49 Gflop/s, 118.98 GB/s, tuning took 0.086266 seconds at Wed Apr  2 17:24:49 2025
        8x8x8x32	N4quda4blas4axy_IdEE	GPU-offline,vol=16384,parity=2,precision=8,order=2,Ns=4,Nc=3,n_rhs=1	928	1	1	56	1	2	0	-1	-1	-1	-1	2.07573e-05	# 56.83 Gflop/s, 303.10 GB/s, tuning took 0.018205 seconds at Wed Apr  2 16:47:08 2025
        8x8x8x32	N4quda4blas4axy_IfEE	GPU-offline,vol=16384,parity=2,precision=2,order=8,Ns=4,Nc=3,n_rhs=1	160	1	2	56	1	1	0	-1	-1	-1	-1	3.55388e-06	# 331.93 Gflop/s, 479.46 GB/s, tuning took 0.009262 seconds at Wed Apr  2 17:24:25 2025
        8x8x8x32	N4quda4blas5Norm2IddEE	GPU-offline,vol=16384,parity=2,precision=8,order=2,Ns=4,Nc=3,n_rhs=1	256	1	1	48	1	1	0	-1	-1	-1	-1	1.79671e-05	# 43.77 Gflop/s, 175.08 GB/s, tuning took 0.091124 seconds at Wed Apr  2 16:47:08 2025
        8x8x8x32	N4quda4blas5Norm2IdfEE	GPU-offline,vol=16384,parity=2,precision=2,order=8,Ns=4,Nc=3,n_rhs=1	128	1	1	55	1	1	0	-1	-1	-1	-1	1.72491e-05	# 45.59 Gflop/s, 49.39 GB/s, tuning took 0.048729 seconds at Wed Apr  2 17:24:25 2025
        8x8x8x32	N4quda4blas5Norm2IdfEE	GPU-offline,vol=16384,parity=2,precision=2,order=8,Ns=4,Nc=3,n_rhs=24	32	1	1	14	1	24	0	-1	-1	-1	-1	0.000207654	# 90.89 Gflop/s, 98.47 GB/s, tuning took 0.253399 seconds at Wed Apr  2 17:24:45 2025
        8x8x8x32	N4quda4blas6caxpy_IfEE	GPU-offline,vol=16384,parity=2,precision=2,order=8,Ns=4,Nc=3,n_rhs=1	160	1	2	56	1	1	0	-1	-1	-1	-1	4.19943e-06	# 374.54 Gflop/s, 608.63 GB/s, tuning took 0.010133 seconds at Wed Apr  2 17:24:25 2025
        8x8x8x32	N4quda5FmunuIdLi3EL21QudaReconstructType_s12EEE	GPU-offline,vol=16384,stride=8192,precision=8,geometry=4,Nc=3,r=0000,comm=0000	32	2	1	256	1	6	3277	-1	-1	-1	-1	0.00177323	# 136.71 Gflop/s, 93.14 GB/s, tuning took 1.551576 seconds at Wed Apr  2 16:47:03 2025
        8x8x8x32	N4quda7RNGInitE	GPU-offline,vol=16384,parity=2,precision=2,order=8,Ns=4,Nc=3	32	1	1	256	2	1	0	-1	-1	-1	-1	0.00692531	# 0.00 Gflop/s, 0.00 GB/s, tuning took 1.059503 seconds at Wed Apr  2 17:24:24 2025
        8x8x8x32	N4quda9CopyGaugeINS_12CopyGaugeArgIddLi18ELb0ENS_5gauge11FloatNOrderIdLi18ELi2ELi12EL20QudaStaggeredPhase_s0ELb1EL19QudaGhostExchange_sn2147483648ELb0EEENS2_8QDPOrderIdLi18EEEEEEE	GPU-offline,vol=16384,stride=8192,precision=8,geometry=4,Nc=3,vol=16384,stride=9216,precision=8,geometry=4,Nc=3	192	1	4	43	1	2	0	-1	-1	-1	-1	4.93303e-05	# 0.00 Gflop/s, 334.79 GB/s, tuning took 0.088084 seconds at Wed Apr  2 16:47:01 2025
        8x8x8x32	N4quda9CopyGaugeINS_12CopyGaugeArgIddLi18ELb0ENS_5gauge11FloatNOrderIdLi18ELi2ELi12EL20QudaStaggeredPhase_s0ELb1EL19QudaGhostExchange_sn2147483648ELb0EEES6_EEEE	GPU-offline,vol=16384,stride=9216,precision=8,geometry=4,Nc=3,vol=16384,stride=9216,precision=8,geometry=4,Nc=3,ghost	96	1	2	11	1	4	0	-1	-1	-1	-1	3.21737e-06	# 0.00 Gflop/s, 446.85 GB/s, tuning took 0.011202 seconds at Wed Apr  2 16:47:01 2025
        8x8x8x32	N4quda9CopyGaugeINS_12CopyGaugeArgIddLi18ELb0ENS_5gauge11FloatNOrderIdLi18ELi2ELi18EL20QudaStaggeredPhase_s0ELb1EL19QudaGhostExchange_sn2147483648ELb0EEENS2_8QDPOrderIdLi18EEEEEEE	GPU-offline,vol=16384,stride=8192,precision=8,geometry=4,Nc=3,vol=16384,stride=8192,precision=8,geometry=4,Nc=3	192	1	4	43	1	2	0	-1	-1	-1	-1	5.88499e-05	# 0.00 Gflop/s, 320.72 GB/s, tuning took 0.071300 seconds at Fri Apr  4 16:42:36 2025
        8x8x8x32	N4quda9CopyGaugeINS_12CopyGaugeArgIddLi18ELb0ENS_5gauge11FloatNOrderIdLi18ELi2ELi18EL20QudaStaggeredPhase_s0ELb1EL19QudaGhostExchange_sn2147483648ELb0EEENS2_8QDPOrderIdLi18EEEEEEE	GPU-offline,vol=16384,stride=8192,precision=8,geometry=4,Nc=3,vol=16384,stride=9216,precision=8,geometry=4,Nc=3	288	1	3	29	1	3	0	-1	-1	-1	-1	5.87765e-05	# 0.00 Gflop/s, 341.19 GB/s, tuning took 0.112296 seconds at Wed Apr  2 17:20:36 2025
        8x8x8x32	N4quda9CopyGaugeINS_12CopyGaugeArgIddLi18ELb0ENS_5gauge11FloatNOrderIdLi18ELi2ELi18EL20QudaStaggeredPhase_s0ELb1EL19QudaGhostExchange_sn2147483648ELb0EEES6_EEEE	GPU-offline,vol=16384,stride=9216,precision=8,geometry=4,Nc=3,vol=16384,stride=9216,precision=8,geometry=4,Nc=3,ghost	96	1	2	11	1	4	0	-1	-1	-1	-1	3.6446e-06	# 0.00 Gflop/s, 591.71 GB/s, tuning took 0.011677 seconds at Wed Apr  2 17:20:36 2025
        8x8x8x32	N4quda9CopyGaugeINS_12CopyGaugeArgIddLi18ELb0ENS_5gauge8QDPOrderIdLi18EEENS2_11FloatNOrderIdLi18ELi2ELi18EL20QudaStaggeredPhase_s0ELb1EL19QudaGhostExchange_sn2147483648ELb0EEEEEEE	GPU-offline,vol=16384,stride=8192,precision=8,geometry=4,Nc=3,vol=16384,stride=8192,precision=8,geometry=4,Nc=3	32	1	1	256	1	8	0	-1	-1	-1	-1	5.86541e-05	# 0.00 Gflop/s, 321.79 GB/s, tuning took 0.027843 seconds at Fri Apr  4 16:42:38 2025
        8x8x8x32	N4quda9CopyGaugeINS_12CopyGaugeArgIddLi18ELb0ENS_5gauge8QDPOrderIdLi18EEENS2_11FloatNOrderIdLi18ELi2ELi18EL20QudaStaggeredPhase_s0ELb1EL19QudaGhostExchange_sn2147483648ELb0EEEEEEE	GPU-offline,vol=16384,stride=9216,precision=8,geometry=4,Nc=3,vol=16384,stride=8192,precision=8,geometry=4,Nc=3	32	1	1	256	1	8	0	-1	-1	-1	-1	5.87482e-05	# 0.00 Gflop/s, 341.36 GB/s, tuning took 0.032099 seconds at Wed Apr  2 17:20:38 2025
        8x8x8x32	N4quda9CopyGaugeINS_12CopyGaugeArgIfdLi18ELb0ENS_5gauge11FloatNOrderIfLi18ELi4ELi12EL20QudaStaggeredPhase_s0ELb1EL19QudaGhostExchange_sn2147483648ELb0EEENS3_IdLi18ELi2ELi12ELS4_0ELb1ELS5_n2147483648ELb0EEEEEEE	GPU-offline,vol=16384,stride=9216,precision=8,geometry=4,Nc=3,vol=16384,stride=9216,precision=4,geometry=4,Nc=3	32	1	1	256	1	8	0	-1	-1	-1	-1	3.1264e-05	# 0.00 Gflop/s, 339.59 GB/s, tuning took 0.019463 seconds at Wed Apr  2 16:47:01 2025
        8x8x8x32	N4quda9CopyGaugeINS_12CopyGaugeArgIfdLi18ELb0ENS_5gauge11FloatNOrderIfLi18ELi4ELi12EL20QudaStaggeredPhase_s0ELb1EL19QudaGhostExchange_sn2147483648ELb0EEENS3_IdLi18ELi2ELi12ELS4_0ELb1ELS5_n2147483648ELb0EEEEEEE	GPU-offline,vol=16384,stride=9216,precision=8,geometry=4,Nc=3,vol=16384,stride=9216,precision=4,geometry=4,Nc=3,ghost	32	1	1	32	1	8	0	-1	-1	-1	-1	4.12418e-06	# 0.00 Gflop/s, 261.45 GB/s, tuning took 0.012332 seconds at Wed Apr  2 16:47:01 2025
        8x8x8x32	N4quda9CopyGaugeINS_12CopyGaugeArgIffLi18ELb0ENS_5gauge11FloatNOrderIfLi18ELi2ELi18EL20QudaStaggeredPhase_s0ELb1EL19QudaGhostExchange_sn2147483648ELb0EEENS3_IfLi18ELi4ELi12ELS4_0ELb1ELS5_n2147483648ELb0EEEEEEE	GPU-offline,vol=16384,stride=9216,precision=4,geometry=4,Nc=3,vol=16384,stride=9216,precision=4,geometry=4,Nc=3	64	1	6	128	1	2	0	-1	-1	-1	-1	2.57536e-05	# 0.00 Gflop/s, 343.54 GB/s, tuning took 0.055236 seconds at Wed Apr  2 17:24:26 2025
        8x8x8x32	N4quda9CopyGaugeINS_12CopyGaugeArgIffLi18ELb0ENS_5gauge11FloatNOrderIfLi18ELi2ELi18EL20QudaStaggeredPhase_s0ELb1EL19QudaGhostExchange_sn2147483648ELb0EEENS3_IfLi18ELi4ELi12ELS4_0ELb1ELS5_n2147483648ELb0EEEEEEE	GPU-offline,vol=16384,stride=9216,precision=4,geometry=4,Nc=3,vol=16384,stride=9216,precision=4,geometry=4,Nc=3,ghost	32	1	1	32	1	8	0	-1	-1	-1	-1	2.65629e-06	# 0.00 Gflop/s, 338.28 GB/s, tuning took 0.010683 seconds at Wed Apr  2 17:24:26 2025
        8x8x8x32	N4quda9CopyGaugeINS_12CopyGaugeArgIsdLi18ELb0ENS_5gauge11FloatNOrderIsLi18ELi4ELi12EL20QudaStaggeredPhase_s0ELb1EL19QudaGhostExchange_sn2147483648ELb0EEENS3_IdLi18ELi2ELi12ELS4_0ELb1ELS5_n2147483648ELb0EEEEEEE	GPU-offline,vol=16384,stride=9216,precision=8,geometry=4,Nc=3,vol=16384,stride=9216,precision=2,geometry=4,Nc=3	32	1	1	256	1	8	0	-1	-1	-1	-1	2.72605e-05	# 0.00 Gflop/s, 324.55 GB/s, tuning took 0.018755 seconds at Wed Apr  2 16:47:01 2025
        8x8x8x32	N4quda9CopyGaugeINS_12CopyGaugeArgIsdLi18ELb0ENS_5gauge11FloatNOrderIsLi18ELi4ELi12EL20QudaStaggeredPhase_s0ELb1EL19QudaGhostExchange_sn2147483648ELb0EEENS3_IdLi18ELi2ELi12ELS4_0ELb1ELS5_n2147483648ELb0EEEEEEE	GPU-offline,vol=16384,stride=9216,precision=8,geometry=4,Nc=3,vol=16384,stride=9216,precision=2,geometry=4,Nc=3,ghost	32	1	1	32	1	8	0	-1	-1	-1	-1	4.10553e-06	# 0.00 Gflop/s, 218.87 GB/s, tuning took 0.012090 seconds at Wed Apr  2 16:47:01 2025
8x8x8x32,2x2x2x8	N4quda14RestrictLaunchIffsLi4ELi3ELi2ELi24EEE	GPU-offline,vol=16384,parity=2,precision=4,order=4,Ns=4,Nc=3,vol=64,parity=2,precision=4,order=2,Ns=2,Nc=24,n_rhs=1,from_non_rel	64	1	3	64	1	2	0	47	-1	-1	-1	7.14126e-05	# 528.60 Gflop/s, 288.50 GB/s, tuning took 0.086880 seconds at Wed Apr  2 17:24:49 2025
8x8x8x32,2x2x2x8	N4quda14RestrictLaunchIfssLi4ELi3ELi2ELi24EEE	GPU-offline,vol=16384,parity=2,precision=2,order=8,Ns=4,Nc=3,vol=64,parity=2,precision=4,order=2,Ns=2,Nc=24,n_rhs=24	32	1	4	64	1	36	0	2	-1	-1	-1	0.000817152	# 1108.69 Gflop/s, 583.94 GB/s, tuning took 0.081140 seconds at Wed Apr  2 17:24:45 2025
      bytes=1024	cudaMemcpyHostToDevice	BatchInvertMatrix,blas_lapack_cublas.cpp,125	32	1	1	1	1	1	0	-1	-1	-1	-1	4.61643e-06	# 0.00 Gflop/s, 0.22 GB/s, tuning took 0.000726 seconds at Wed Apr  2 17:24:42 2025
   bytes=1179648	cudaMemset	zero,gauge_field.cpp,1186	32	1	1	1	1	1	0	-1	-1	-1	-1	2.86302e-06	# 0.00 Gflop/s, 412.03 GB/s, tuning took 0.004078 seconds at Wed Apr  2 17:24:34 2025
     bytes=12288	cudaMemsetAsync	zero,color_spinor_field.cpp,414	32	1	1	1	1	1	0	-1	-1	-1	-1	1.68724e-06	# 0.00 Gflop/s, 7.28 GB/s, tuning took 0.000683 seconds at Wed Apr  2 17:24:43 2025
    bytes=147456	cudaMemset	zero,gauge_field.cpp,1186	32	1	1	1	1	1	0	-1	-1	-1	-1	1.7739e-06	# 0.00 Gflop/s, 83.13 GB/s, tuning took 0.000727 seconds at Wed Apr  2 17:24:43 2025
   bytes=1572864	cudaMemsetAsync	zero,color_spinor_field.cpp,414	32	1	1	1	1	1	0	-1	-1	-1	-1	3.28202e-06	# 0.00 Gflop/s, 479.24 GB/s, tuning took 0.000841 seconds at Wed Apr  2 16:47:08 2025
  bytes=18939904	cudaMemsetAsync	zero,color_spinor_field.cpp,414	32	1	1	1	1	1	0	-1	-1	-1	-1	5.6832e-05	# 0.00 Gflop/s, 333.26 GB/s, tuning took 0.001274 seconds at Wed Apr  2 17:24:26 2025
    bytes=196608	cudaMemcpyDeviceToDevice	exchangeGhost,gauge_field.cpp,527	32	1	1	1	1	1	0	-1	-1	-1	-1	2.52251e-06	# 0.00 Gflop/s, 155.88 GB/s, tuning took 0.000741 seconds at Wed Apr  2 16:47:01 2025
   bytes=2359296	cudaMemcpyDefault	copy,gauge_field.cpp,1085	32	1	1	1	1	1	0	-1	-1	-1	-1	0.000191659	# 0.00 Gflop/s, 12.31 GB/s, tuning took 0.002026 seconds at Wed Apr  2 16:47:01 2025
   bytes=2359296	cudaMemcpyDeviceToHost	copy,gauge_field.cpp,1024	32	1	1	1	1	1	0	-1	-1	-1	-1	0.000263616	# 0.00 Gflop/s, 8.95 GB/s, tuning took 0.002197 seconds at Wed Apr  2 17:20:38 2025
   bytes=2359296	cudaMemset	zero,gauge_field.cpp,1186	32	1	1	1	1	1	0	-1	-1	-1	-1	8.18504e-06	# 0.00 Gflop/s, 288.24 GB/s, tuning took 0.000995 seconds at Wed Apr  2 17:24:43 2025
     bytes=24576	cudaMemsetAsync	zero,color_spinor_field.cpp,414	32	1	1	1	1	1	0	-1	-1	-1	-1	1.68127e-06	# 0.00 Gflop/s, 14.62 GB/s, tuning took 0.003106 seconds at Wed Apr  2 17:24:26 2025
       bytes=256	cudaMemcpyDeviceToHost	BatchInvertMatrix,blas_lapack_cublas.cpp,133	32	1	1	1	1	1	0	-1	-1	-1	-1	4.352e-06	# 0.00 Gflop/s, 0.06 GB/s, tuning took 0.000923 seconds at Wed Apr  2 17:24:42 2025
       bytes=256	cudaMemcpyDeviceToHost	BatchInvertMatrix,blas_lapack_cublas.cpp,149	32	1	1	1	1	1	0	-1	-1	-1	-1	4.3409e-06	# 0.00 Gflop/s, 0.06 GB/s, tuning took 0.000968 seconds at Wed Apr  2 17:24:42 2025
       bytes=256	cudaMemcpyHostToDevice	BatchInvertMatrix,blas_lapack_cublas.cpp,125	32	1	1	1	1	1	0	-1	-1	-1	-1	4.48932e-06	# 0.00 Gflop/s, 0.06 GB/s, tuning took 0.000721 seconds at Wed Apr  2 17:24:44 2025
       bytes=256	cudaMemcpyHostToDevice	createGeoMap,transfer.cpp,239	32	1	1	1	1	1	0	-1	-1	-1	-1	4.42611e-06	# 0.00 Gflop/s, 0.06 GB/s, tuning took 0.000711 seconds at Wed Apr  2 17:24:43 2025
       bytes=256	cudaMemcpyHostToDevice	createGeoMap,transfer.cpp,240	32	1	1	1	1	1	0	-1	-1	-1	-1	4.42798e-06	# 0.00 Gflop/s, 0.06 GB/s, tuning took 0.000760 seconds at Wed Apr  2 17:24:43 2025
    bytes=294912	cudaMemcpyDeviceToDevice	exchangeGhost,gauge_field.cpp,527	32	1	1	1	1	1	0	-1	-1	-1	-1	3.14246e-06	# 0.00 Gflop/s, 187.70 GB/s, tuning took 0.000722 seconds at Wed Apr  2 17:20:36 2025
    bytes=294912	cudaMemcpyDeviceToDevice	exchangeGhost,gauge_field.cpp,536	32	1	1	1	1	1	0	-1	-1	-1	-1	2.23018e-06	# 0.00 Gflop/s, 264.47 GB/s, tuning took 0.000754 seconds at Wed Apr  2 17:24:42 2025
    bytes=294912	cudaMemset	create,gauge_field.cpp,219	32	1	1	1	1	1	0	-1	-1	-1	-1	1.75642e-06	# 0.00 Gflop/s, 167.90 GB/s, tuning took 0.000624 seconds at Wed Apr  2 17:24:26 2025
    bytes=294912	cudaMemset	create,gauge_field.cpp,220	32	1	1	1	1	1	0	-1	-1	-1	-1	1.77472e-06	# 0.00 Gflop/s, 166.17 GB/s, tuning took 0.000601 seconds at Wed Apr  2 17:24:26 2025
    bytes=294912	cudaMemset	zero,gauge_field.cpp,1186	32	1	1	1	1	1	0	-1	-1	-1	-1	1.78349e-06	# 0.00 Gflop/s, 165.36 GB/s, tuning took 0.000725 seconds at Wed Apr  2 17:24:43 2025
      bytes=3072	cudaMemsetAsync	zero,color_spinor_field.cpp,414	32	1	1	1	1	1	0	-1	-1	-1	-1	1.44072e-06	# 0.00 Gflop/s, 2.13 GB/s, tuning took 0.000725 seconds at Wed Apr  2 17:24:49 2025
   bytes=3145728	cudaMemsetAsync	zero,color_spinor_field.cpp,414	32	1	1	1	1	1	0	-1	-1	-1	-1	1.06895e-05	# 0.00 Gflop/s, 294.28 GB/s, tuning took 0.000984 seconds at Wed Apr  2 16:47:07 2025
       bytes=368	cudaMemcpyHostToDevice	paths,gauge_path_helper.cuh,58	32	1	1	1	1	1	0	-1	-1	-1	-1	3.92704e-06	# 0.00 Gflop/s, 0.09 GB/s, tuning took 0.000818 seconds at Fri Apr  4 16:42:36 2025
         bytes=4	cudaMemsetAsync	Launch,coarse_op.cuh,393	32	1	1	1	1	1	0	-1	-1	-1	-1	1.50326e-06	# 0.00 Gflop/s, 0.00 GB/s, tuning took 0.000615 seconds at Wed Apr  2 17:24:30 2025
         bytes=4	cudaMemsetAsync	apply,coarse_op_preconditioned_24.cu,82	32	1	1	1	1	1	0	-1	-1	-1	-1	1.20815e-06	# 0.00 Gflop/s, 0.00 GB/s, tuning took 0.000607 seconds at Wed Apr  2 17:24:42 2025
    bytes=425984	cudaMemsetAsync	zero,color_spinor_field.cpp,414	32	1	1	1	1	1	0	-1	-1	-1	-1	1.88546e-06	# 0.00 Gflop/s, 225.93 GB/s, tuning took 0.000763 seconds at Wed Apr  2 16:47:08 2025
     bytes=49152	cudaMemcpyDeviceToDevice	exchangeGhost,gauge_field.cpp,527	32	1	1	1	1	1	0	-1	-1	-1	-1	2.6458e-06	# 0.00 Gflop/s, 37.15 GB/s, tuning took 0.000761 seconds at Wed Apr  2 16:47:01 2025
    bytes=589824	cudaMemset	zero,gauge_field.cpp,1186	32	1	1	1	1	1	0	-1	-1	-1	-1	2.09198e-06	# 0.00 Gflop/s, 281.95 GB/s, tuning took 0.000709 seconds at Wed Apr  2 17:24:26 2025
    bytes=590080	cudaMemsetAsync	zero,color_spinor_field.cpp,414	32	1	1	1	1	1	0	-1	-1	-1	-1	2.20514e-06	# 0.00 Gflop/s, 267.59 GB/s, tuning took 0.000888 seconds at Wed Apr  2 17:24:43 2025
      bytes=6144	cudaMemsetAsync	zero,color_spinor_field.cpp,414	32	1	1	1	1	1	0	-1	-1	-1	-1	1.69469e-06	# 0.00 Gflop/s, 3.63 GB/s, tuning took 0.001084 seconds at Wed Apr  2 17:24:43 2025
    bytes=638976	cudaMemset	allocateGhostBuffer,lattice_field.cpp,278	32	1	1	1	1	1	0	-1	-1	-1	-1	2.3296e-06	# 0.00 Gflop/s, 274.29 GB/s, tuning took 0.000705 seconds at Wed Apr  2 16:47:01 2025
    bytes=638976	cudaMemset	allocateGhostBuffer,lattice_field.cpp,283	32	1	1	1	1	1	0	-1	-1	-1	-1	2.3296e-06	# 0.00 Gflop/s, 274.29 GB/s, tuning took 0.000682 seconds at Wed Apr  2 16:47:01 2025
        bytes=64	cudaMemcpyDeviceToHost	BatchInvertMatrix,blas_lapack_cublas.cpp,133	32	1	1	1	1	1	0	-1	-1	-1	-1	4.33762e-06	# 0.00 Gflop/s, 0.01 GB/s, tuning took 0.000868 seconds at Wed Apr  2 17:24:44 2025
        bytes=64	cudaMemcpyDeviceToHost	BatchInvertMatrix,blas_lapack_cublas.cpp,149	32	1	1	1	1	1	0	-1	-1	-1	-1	4.35722e-06	# 0.00 Gflop/s, 0.01 GB/s, tuning took 0.000955 seconds at Wed Apr  2 17:24:44 2025
     bytes=65536	cudaMemcpyHostToDevice	createGeoMap,transfer.cpp,239	32	1	1	1	1	1	0	-1	-1	-1	-1	8.77714e-06	# 0.00 Gflop/s, 7.47 GB/s, tuning took 0.000920 seconds at Wed Apr  2 17:24:25 2025
     bytes=65536	cudaMemcpyHostToDevice	createGeoMap,transfer.cpp,240	32	1	1	1	1	1	0	-1	-1	-1	-1	8.82703e-06	# 0.00 Gflop/s, 7.42 GB/s, tuning took 0.000958 seconds at Wed Apr  2 17:24:25 2025
     bytes=73728	cudaMemcpyDeviceToDevice	exchangeGhost,gauge_field.cpp,527	32	1	1	1	1	1	0	-1	-1	-1	-1	3.21733e-06	# 0.00 Gflop/s, 45.83 GB/s, tuning took 0.000844 seconds at Wed Apr  2 17:20:36 2025
     bytes=73728	cudaMemcpyDeviceToDevice	exchangeGhost,gauge_field.cpp,536	32	1	1	1	1	1	0	-1	-1	-1	-1	2.26387e-06	# 0.00 Gflop/s, 65.13 GB/s, tuning took 0.000863 seconds at Wed Apr  2 17:24:42 2025
     bytes=73728	cudaMemset	create,gauge_field.cpp,219	32	1	1	1	1	1	0	-1	-1	-1	-1	1.76516e-06	# 0.00 Gflop/s, 41.77 GB/s, tuning took 0.000713 seconds at Wed Apr  2 17:24:26 2025
     bytes=73728	cudaMemset	create,gauge_field.cpp,220	32	1	1	1	1	1	0	-1	-1	-1	-1	1.76516e-06	# 0.00 Gflop/s, 41.77 GB/s, tuning took 0.000713 seconds at Wed Apr  2 17:24:26 2025
    bytes=786432	cudaMemsetAsync	zero,color_spinor_field.cpp,414	32	1	1	1	1	1	0	-1	-1	-1	-1	2.44378e-06	# 0.00 Gflop/s, 321.81 GB/s, tuning took 0.000827 seconds at Wed Apr  2 17:24:24 2025
   bytes=9437184	cudaMemset	zero,gauge_field.cpp,1186	32	1	1	1	1	1	0	-1	-1	-1	-1	2.90033e-05	# 0.00 Gflop/s, 325.38 GB/s, tuning took 0.001124 seconds at Wed Apr  2 17:24:26 2025
    bytes=958464	cudaMemset	allocateGhostBuffer,lattice_field.cpp,278	32	1	1	1	1	1	0	-1	-1	-1	-1	2.6368e-06	# 0.00 Gflop/s, 363.50 GB/s, tuning took 0.000806 seconds at Wed Apr  2 17:20:36 2025
    bytes=958464	cudaMemset	allocateGhostBuffer,lattice_field.cpp,283	32	1	1	1	1	1	0	-1	-1	-1	-1	2.64124e-06	# 0.00 Gflop/s, 362.88 GB/s, tuning took 0.000750 seconds at Wed Apr  2 17:20:36 2025
